,Subject,Question,Answer,Topic
0,excited,My spouse bought me a diamond necklace for my birthday.,Yes I was_comma_ I felt love and appreciated. ,Actitud
1,faithful,Getting married this fall,It's lovely. Be a happy couple. live long together!,Actitud
2,faithful,I was married to my wife for thirty years_comma_ and even though she has passed I can't bring myself to date anyone else.,Well_comma_ if that's how you feel then maybe it is best if you stay in the dugout and don't play the field. No shame in that.,Actitud
3,faithful,When my spouse was out of town for work_comma_ a friend stopped by to visit. This friend offered to kiss me_comma_ but I declined and asked the friend to leave. I only have interest in my spouse in this way.,I said no and made the friend leave. I only like my spouse.,Actitud
4,faithful,I would never cheat on my wife like my brother cheated on his wife,Cheating  on your spouse is a despicable thing to do.,Actitud
5,faithful,I love my girlfriend so much. I think im going to marry her.,Congratulations and thats OK I do that a lot too.,Actitud
6,faithful,When I am in nature I feel good that this world is exactly as it should be. Everything is moving a long to Gods desires.,Why do cities make you feel that way?,Actitud
7,faithful,I feel this way because I have hope that I will get into grad school.,That sounds interesting_comma_ when do you learn if you got in?,Actitud
8,faithful,I feel very committed to my work. No matter how I feel_comma_ I have to press on and complete it. It's been a rough week and my will power is very strong to still work through all this,yes. It's been a rough week and my will power is very strong to still work through all this,Actitud
9,faithful,I'm hoping I can reach diamond next season in overwatch. I've been practicing a ridiculous amount,I would say it's my favorite fps now by a mile. Cod became fecal matter 5 or 6 years ago. I'm hoping I can finally stop being a pleb and hit diamond next season,Actitud
10,faithful,I have always  been faithful to my girlfiend of almost 3 years,So many people cheat nowadays. That's good to hear!,Actitud
11,faithful,I just celebrated 25 years at my job.,You should've made them buy another cake!,Actitud
12,faithful,Some one owed me some money,I thought he would not pay back after a long time,Actitud
13,faithful,3,A key to a long relationship is persistence_comma_ so keep at it! ,Actitud
14,faithful,I had a girl try to hook up with me_comma_ but i didnt do anything because I love my wife.,This attractive girl at the bar was trying to get me to go home with her the other night,Actitud
15,faithful,god has done so much for me in my life. i owe everything to him,and i know he's going to come back for me and take me away from this place,Actitud
16,faithful,I have been with my car insurance company for 30 years.,I have been with my car insurance company for 30 years.,Actitud
17,faithful,One day my neighbor helped me in a risky situation. So I'm loyal to their family always.,Yeah_comma_ They helped me in the risky situation when I was alone.,Actitud
18,faithful,When the guy I'm now married to and I met for the first time I was actually dating someone else. I thought that my now husband would just be a really good friend to me. I stayed with my ex-boyfriend for a while after_comma_ and even when I knew I wanted to date my now husband I never did anything to betray my ex.,Well that's good. Sounds like it all worked out pretty well.,Actitud
19,faithful,I've failed a lot of diets in the past_comma_ but this time I've been able to stay dedicated for the past four months. I'm seeing great progress now!,Yeah_comma_ that sounds like a really good idea!,Actitud
20,faithful,I fully trust in my intuition and dreams.  They have gotten me this far and I'm going all the way to the top,These days I'm trusting my intuition and following my gut to achieve my goals.  They've gotten me this far and haven't let me down yet,Actitud
21,faithful,I've never cheated on my wife,uh oh how does Facebook help? lol,Actitud
22,faithful,i have faith my brother will do alright,Well at least you were able to introduce him to your friend. I hope everything works out for him!,Actitud
23,faithful,I was invited to church this last weekend. I went and felt very optimistic in the church.,I went to church with a friend recently.,Actitud
24,faithful,I am very faithful to my employer.,My employer provides me with lots of training and support so I have become very faithful to them.,Actitud
25,trusting,My mom said she'd go to the doctor the next time she started feeling weird heart palpitations again. I'm about a thousand miles away from her_comma_ so I can't force her to go. But I'm worried about her_comma_ as she's always avoided the doctor_comma_ and always been in poor health. Hope she does the right thing.,"Sort of.. we have a neighbor that's been by her for 10 years_comma_ and they've been friends for a long time. But she's older herself_comma_ and has her own worries_comma_ so it's not like I can put more on her plate. My mother is just stubborn. I love her to death_comma_ but she's kind of a ""What will be_comma_ will be"" type person_comma_ and just assumes life will happen and you can_comma_ nor should_comma_ do anything to get in the way of it.",Actitud
26,trusting,My daughter has grown up so much. She is finally able tobabysit her younger siblings,my daughter has matured so well,Actitud
27,trusting,i felt trusting when my dad and my mon care for me,Well as a fellow human being_comma_ I agree that when parents care for their children_comma_ it creates a lifelasting bond between the two parties.,Actitud
28,trusting,I was working on a boat_comma_ and I had to hope that my friend didn't screw something up while I had my hands in the engine.,Gosh I hate it when I have to work on complicated parts in my boat engine_comma_ when my friend is helping me.,Actitud
29,trusting,I believed that my son would behave responsibly when I left him home alone for the weekend.,Wow_comma_ that would have scared me_comma_ how did it go?,Actitud
30,trusting,I went skydiving. I had to trust in the tandem partner I had to not kill me.,That's so awesome. I don't think I would have the courage now. Will you do it again?,Actitud
31,trusting,I wanted to go out but needed someone to watch my kids. No one had ever babysat before. I let my sister watch them because I knew she would do a good job. ,Oh that's so great - and now you can feel comfortable leaving them with her more often!,Actitud
32,trusting,My nephew is learning how to drive and asked to use my car to take the driving test this weekend. ,Yeah. I feel he wont let me down. ,Actitud
33,trusting,My partner and I both work 24-hour shifts and tend to alternate shifts (I'll be at home hwen she's at work and she'll be at home when I'm at work). This can lead to some insecurities sometimes because not only are we away from each other alot_comma_ but we have a lot of time by ourselves where anyone could come over if they want to. I feel so lucky knowing that my wife has my best interest in mind. ,Ahh! We both enjoy it. Thanks for the thank you_comma_ though! :) ,Actitud
34,trusting,I trust my wife with my life,thats a good bond how long have you been together? ,Actitud
35,trusting,I let my son drive the car for the first time.,You must be so proud of him!,Actitud
36,trusting,When I had many problems or I was sad_comma_ I knew God was with me and the things were going to improve.,Can you facetime them?,Actitud
37,trusting,I can tell my best friend anything!,I usually ask her for advice and tell her embarrassing stories because she never snitches!,Actitud
38,trusting,I knew my dad would help me with my test. He was good at math,I knew my dad would help me with my test. He was good with math,Actitud
39,trusting,My co-worker is in charge of finishing up our big project. I am putting all my faith in them.,I have a co-worker putting the finishing touches on a big project and work_comma_ and I am really putting all my faith in him.,Actitud
40,trusting,I like my new manager. He is so kind and a good listener. I feel that I can trust him with any issue that I have.,I hate that too. Most of the managers are like that. They never listen and they can be rude.,Actitud
41,trusting,Once I was working on a big project with a bunch of people and made a mistake. One of the other people working on the project covered for me even though they didn't need to. ,did it boost your confidence and faith in mankind?,Actitud
42,trusting,If I'm going to be in a relationship I need girl I can depend on_comma_ not some effed up crazy damaged goods type of girl,Yes_comma_ glad you agree....I was an idiot and mistook a deadly combo of pity and infatuation for love...but now I know what to avoid and what I want so I'm thankful,Actitud
43,trusting,When I was a little kid I used to put my faith in everybody.  I learned later on_comma_ as I matured that you can't rely on other people too much because only you know what is best for you in life while everyone else will try to use you if they see you doing too well in life,I understand. Do you like Tony Montana in the movie Scarface?,Actitud
44,trusting,The first time I went on a motorcycle_comma_ I was scared. But I knew my husband wouldn't do anything to hurt me. I trusted him with my life.,It must be nice to have that kind of trust for someone_comma_ and motorcycles can be fun!,Actitud
45,trusting,I was walking around SF zoo the other day and realized that animals are such genuine creature and I like them like humans_comma_,Have you ever been to the zoo just to realize that animals can be just as good as humans?,Actitud
46,trusting,When my dad wanted to help me get a car_comma_ I trusted him. I knew he would help me a lot,That is nice of him_comma_ that is a good dad right there!,Actitud
47,trusting,I let people so much in my life and they ended up betraying my confidence i had in them.,I can sympathize with you. I've had a lot of betrayal in the past. The ONLY thing to do is to continue looking for trustworthy individuals. ,Actitud
48,trusting,I am waiting on my friend to come over. They are bringing me a medicine for my pet.,I'm sorry. That must make you sad.,Actitud
49,faithful,I was on a business trip last week spending some time at a local bar. There was a girl who was being flirty with me. I had to tell her that I was married and I couldn't play with her.,Last week on a business trip I spent some time at the bar. There was this girl who was really flirty with me. I had to tell her that I couldn't play with her because I was married.,Actitud
50,hopeful,My daughter starts public school for the first time in 3 years. I think she is going to do well,My daughter starts public school for the first time in 3 years! I think she is going to do great but she's a little bit nervous.,Actitud
51,prepared,I knew I was going to pass my drivers test. I just knew I would do well,I knew I was going to pass my drivers test. I knew I would do well,Actitud
52,prepared,I'm looking forward to presenting to my client_comma_ I spent a lot of time on that powerpoint,I'm looking forward to presenting to my client_comma_ I spent a lot of time on that powerpoint,Actitud
53,prepared,I am having some financial issues. I am selling almost everything before the bailiff come.,I am having some financial issues. I am selling almost everything before the bailiff come.,Actitud
54,prepared,ready to leave this hood ,That sounds like a plan.,Actitud
55,prepared,I'm spent all summer getting ready to write my thesis. I can't wait to get time to start.,I spent all summer getting ready to write my thesis. I can't wait to get time to start.,Actitud
56,prepared,I've got all my fishing gear packed up. I'm ready for tomorrow morning.,I've got all my fishing gear packed up. I'm ready for tomorrow morning.,Actitud
57,prepared,I@ve done lots of research for an interview tis week,I have an interview this week,Actitud
58,prepared,When I went into labor with my son_comma_ it was quite the ordeal. He was coming way too early and we had to rush to get him out. Thankfully_comma_ I had everything already packed beforehand!,Is he healthy?,Actitud
59,prepared,It was my first time taking the DMV test. I went there rather early and aced the test.,Yes it was even though I was a bit nervous.,Actitud
60,prepared,I think I got everything I need for my job interview tomorrow. I got my fancy clothes and answers prepared for common questions they usually throw at u.,I think I got everything I need for my job interview tomorrow. I got my fancy clothes and answers prepared for common questions they usually throw at u.,Actitud
61,prepared,I had a big presentation that I was very nervous about. Luckily_comma_ I made sure to practice and get everything together before time,I am so happy everything went well for you.,Actitud
62,prepared,Getting ready to file quarterly taxes and I have been very diligent with organization this year so I am prepared,How much stuff did you have to go through?,Actitud
63,prepared,I went into that interviewing knowing i could answer any question they threw at me,yea im sure i'll get the job,Actitud
64,prepared,im ready for next week!,what's happening next week?,Actitud
65,prepared,I had been grinding at home trying to build my website when this girl I hadn't heard from since high school called. She said she was in town and wanted to catch up.  Deciding I needed a break from work I turned off my laptop_comma_ threw on some fresh khakis and air nikes and 2 condoms just in case.  Turned out it's always better safe than sorry.,They're known to cause erectile dysfunction? There's chemicals in the laces_comma_ dude! A conspiracy I tell you! Done by OBAMA!,Actitud
66,prepared,College is starting in 3 weeks_comma_ and I have my apartment all settled_comma_ my classes picked out_comma_ and my student loans scheduled. I feel like I'm on track to start the semester in a way where I'm not hurried or confused_comma_ and it feels good.,Hey... that's okay. I'm 28 and just now about to finish my 4-year degree. My brother finished his at 36. There's always a reason for the path you take. Maybe it led to better things. Don't ever just consider yourself a statistic. Good luck!,Actitud
67,prepared,I am all packed for my vacation.  I don't believe I have forgotten anything for the trip but you never know.,I'm leaving for my vacation soon.  I have everything all packed and ready to go.,Actitud
68,prepared,I have been training for months for the race.,I'm sure all the work will be worth it in the end!,Actitud
69,prepared,We went through hurricane irma last year. We got everything we needed and put metal shutter on all the windows and decided to stay. , i must have been terrifying_comma_ I am glad you both made it through it,Actitud
70,prepared,Last week when I was coming back to my home_comma_ a man approached me. But_comma_ I had a gun. I felt I was ready.,I had a gun. I felt I was ready. If anything would have happened_comma_ I could have used it.,Actitud
71,prepared,We had a big storm last summer_comma_ so this year I bought a ton of supplies in case we lost power or had flooding. Last year our basement got very damaged. ,Yeah its all repaired now. I also bought lots of food in case we loose power.,Actitud
72,prepared,when I had my test to get a new certification at work_comma_ I felt great about it because I had workd really hard and studied.,I had my test for a new certification at work.  I really wasn't that nervous for it though.,Actitud
73,hopeful,I am confident my brother will beat his cancer.,I am confident my brother will beat this cancer.,Actitud
