,Topic,Subject,Question,Answer
132,Actitud,joyful,i got a surprise gift in the mail,one time on my birthday i never expect much to me is just a regular day _comma_ then i get a package in the mail it was copic markers my friend mailed them to me from another state i was so happy
133,Actitud,joyful,I remember as a child when I got my Nintendo 64 how happy and excited I was. Best christmas memory I have.,Yea _comma_ I still play it sometimes for funs sake.
134,Actitud,joyful,I won a year of unlimited pizza. I'm so psyched.,It will save you a lot of money too
135,Actitud,joyful,Going to disney world in december!,Oh that's exciting! Have you gone before?
136,Actitud,joyful,I felt this way after the birth of my son.,What did you name him?
137,Actitud,proud,I got all A's in my last semester.,Thanks! Yes_comma_ I think I did my best anyway.
138,Actitud,joyful,My dogs passed away 2 years ago. My family adopted me one this past weekend on my birthday.,My dogs passed away 2 years ago. My family adopted me one this past weekend on my birthday.
139,Actitud,joyful,Took the kiddos to the lake,That sound fun! I love to eat fresh fish!
140,Actitud,prepared,Getting ready to file quarterly taxes and I have been very diligent with organization this year so I am prepared,I bought a big rubbermaid portable file box that has folders 
141,Actitud,joyful,I recently received my teaching certificate,thats so awesome good for you 
142,Actitud,joyful,I am going to eat some BBQ later.  I am so happy for it.,That sounds so good and the perfect way to spend a Sunday.
143,Actitud,joyful,I will be seeing my son tomorrow after  a month.,My son comes back tomorrow!
144,Actitud,joyful,I am moving to new appartment. The new neighborhood is so nice. I am so happy that I found this appartment. ,That is so nice.  When do you move?
145,Actitud,joyful,I was pretty happy to find out I was having a girl,I had her 7 months ago
146,Actitud,joyful,i am so happy that i am going to be a grandma,Yep. Happy and healthy is a blessing
147,Actitud,joyful,I cant believe my daughter performed so well in the recital. She practiced so hard for it,I cant believe my daughter performed so well in the recital.
148,Actitud,joyful,I've had family visiting for the past couple of days_comma_ some cousins and an uncle and aunt that I haven't seen a long time. It's always great to be reunited with family_comma_ especially after you get over that first initial weird social hump of feeling each other out after not having spoken for a long time. It's crazy to see how much the younger cousins have physically changed! Anyway_comma_ it's been a blast playing games and catching up with them.,wow thats great
149,Actitud,joyful,I'm very proud of my daughters.,I am very proud of my daughters.
150,Actitud,joyful,I care a lot about all the little birds in my neighborhood. I am a sensitive soul and I just want to help every critter I see.,i dont want them to suffer either
151,Actitud,proud,I was held my head high when my mother received her Master's Degree after getting a GED after high school.,Yes_comma_ it is great! Even better she just received her Master's Degree at the tender age of 50!
152,Actitud,confident,For some reason if I get a good pump at the gym early in the morning_comma_ I feel like I can tackle any task on my to-do list for the day.,That's awesome. do you usually exercise in the mornings?
153,Actitud,confident,I feel I can do things on my own. I didn't always feel this way_comma_ so it's nice I am empowered now and can accomplish things on my own.,My resolve I guess? Nothing changed for the better but inside me at least I know I can do it on my own because it's 1000 times better than the alternative. I'll do whatever it takes.
154,Actitud,confident,Going to a job interview soon and I think I got this!,It is great to be confident. I am sure you will knock the interview out of the park!
155,Actitud,confident,My friend speaks 4 languages. I'm sure they'll get that interpreter job at the embassy.,Yea. English of course_comma_ then French_comma_ Spanisha and Chinese.
156,Actitud,confident,I recently decided to start blogging again and feel pretty good about it. I used to have a decent sized audience_comma_ so hopefully I can build it back up.,I'm sure if you can let people know that you're back blogging_comma_ they'd come back to see what you're up to now!  What do you blog about?
157,Actitud,confident,I think I can get everything I need to get accomplished before the end of summer.,What all do you have to get done?
158,Actitud,confident,I am as sure as the sun will rise tomorrow that I will get this job promotion!,Thank you! I have worked so hard for so many years and finally it shows that someone paid attention. :)
159,Actitud,confident,I had to take my final exam for a class last semester. I studied really hard for this exam. I went in sure that I was going to do great on it. I ended up getting the highest score in my class!,hard work pays off 
160,Actitud,confident,I recently went surfing and surfed waves everyone else was afraid to. I was the man_comma_,Yes_comma_ I've been surfing for ever. Only three of us in the water. 
161,Actitud,confident,I was very sure I was getting the promotion I asked for.,I knew I was going to get the promotion I was up for.
162,Actitud,confident,I want to lose weight and i'm sure i can do it,You can. It will take some persistence. How's it going so far?
163,Actitud,confident,We recently went on vacation with some friends to Disney world.  They had never been before and we are annual passholders so we have been several times over the last year.,We had a really good time on our vacation a couple of weeks ago.
164,Actitud,confident,I think I did very well in my work and will have a fantastic design to show my boss! I put so much effort into this it can't possibly be bad,That is a smart move by you.
165,Actitud,confident,I have my physics test tomorrow that I have been studying 10 days for_comma_ Never felt so ready in my life.,I have a physics test tomorrow. I think I can say that after 10 days of nonstop studying and copious amounts of adderall_comma_ I am finally ready.
166,Actitud,confident,I'm about to ask someone that I like out on a date. I'm pretty confident that she will say yes.,So there's a girl that I've been talking to lately... I'm thinking about asking her out.
167,Actitud,confident,I have to make a tuna casserole for tomorrow.  I am sure I can do it well.,I bet it will be great - I've always loved a good tuna casserole!
168,Actitud,confident,I know I can make a lotta money on here if I keep working.,Well keep looking something is out there for you
169,Actitud,confident,I knew it was going to be a good weekend last week. I just had a good feeling,ok
170,Actitud,confident,I remember going to State Football Championship. I told my teammates on the bus before we got off that if anybody isn't ready to leave this field with the trophy stay on the bus. The whole bus was quiet. The bus driver looked at me and said I think you guys need the listen to him he doesn't look like he's playing. We eventually won that game . ,WE won 60 - 3 
171,Actitud,confident,i went in knowing i was going to do great on that test,Awesome! So happy for you my friend
172,Actitud,confident, I knew I was going to pass my final. I studied all week,I was confident about my final test. I had studied all week hard
173,Actitud,confident,I went in to the interview knowing that I had what it takes to land the job. I had prepared to the fullest extent and had all the skills they were looking for.,Nice! You sound like you prepared very well
174,Actitud,confident,I interviewed for a job.  I know I gave great answers to their questions and walked away feeling like I had the job.,I interviewed for a job.  I know I gave great answers to their questions and walked away feeling like the job was mine.
175,Actitud,excited,I can't even fall asleep waiting to go on our vacation. ,Oh_comma_ well that is a fine thing indeed! I would be  jumping up and down!
176,Actitud,excited,My brother and a bunch of our friends planned to go to a 15-person cottage in July. I could not wait for all the fun and games we would experience!,It's very close to a lake_comma_ it probably takes a two minute hike down through a patch of trees and tall grass to get there.
177,Actitud,excited,I was cooking some food recently. I made a hard to make recipe and it worked!,That is trivia. When i am hyped_comma_ i cook lasagna. I know that is hard to cook_comma_ but i mastered it all on my own
178,Actitud,confident,This is gonna be a good year at school for me. Its going to be better than all the rest!,Thats a good outlook to have! What year are you on 1st_comma_ 2nd? 
179,Actitud,excited,Recently we decided to rescue another kitten. We were so thrilled to be adding another furry member to our family and save a life.,That is great! Adopt_comma_ don't shop! Always a great motto!
180,Actitud,excited,I finally thought my dog how to sit and give me her paw. I felt very accomplished and happy!,I finally thought my dog how to sit and give me her paw. I felt very accomplished and happy!
181,Actitud,excited,I was so thrilled to get concert tickets for a surprise show. It will be so fun!,The Strokes are playing this show on the fly in a month. It's so cool!
182,Actitud,excited,I'm going to a drink and paint party tomorrow. It should be pretty fun!,Wow_comma_ that sounds like a fun and interesting time_comma_ but it sounds like there are a high chance for things to go south and be a huge mess
183,Actitud,excited,Gareth Bale played his best in the champion's league final. I was thrilled after I watched his game.,Have you watched champion's league final?
184,Actitud,excited,I am going to meet up with a special friend I haven't seen for  years,That's pretty cool. I don't see my friends much since I moved.
185,Actitud,excited,I'm going to a drink and paint party tomorrow. It should be pretty fun!,My friend is having a drink and paint party. I've only been to one before but it was pretty fun. I can't wait.
186,Actitud,excited,I have plans so go to the beach with my wife for a week next month.,I have plans so go to the beach with my wife for a week next month
187,Actitud,excited,I'm going to building a gaming pc. This is my first time.,Wow. It can be difficult to put together but finding the parts is a lot of fun.
188,Actitud,joyful,I was very happy to get my new job,oh wow. we're practically neighbors.
189,Actitud,excited,I'm excited for Red Dead Redemption 2 to come out.  Even though it's a couple months away,No worries_comma_ we all have our hobbies!
190,Actitud,excited,I really had a fun time at our county fair a couple of days ago.,I took the family to our county fair a couple of days ago.
191,Actitud,excited,I felt this way when my father bought me a Super Nintendo for  my 9th birthday. We were very poor so it was unexpected!,You still remember what you got for it?  It must have been memorable!  What was it?
192,Actitud,excited,I'm taking my kids to Six Flags this weekend! It'll be a surprise for them!,This weekend I'm taking my kids to Six Flags
193,Actitud,excited,I can't wait until Halloween. I love scaring the little kids who come to my house_comma_ muhahah!,Ha! I've always loved the more festive Dia de los Muertos approach to the day rather than scare or gore! What's your favorite Halloween film?
194,Actitud,excited,i cant wait for next week!,What's going on next week?
195,Actitud,excited,A new skating rink is being built. Should be done in time for Winter skating!,That's great! I may look it up and go to their grand opening as well.
196,Actitud,excited,I've never had a lust for life like I do these days.  I literally wake up every day stoked that I'm living my dreams and can't wait to see how much money I can make,Yes you have no idea...still grinding it out everyday but it's totally worth it
197,Actitud,excited,I am so full of anticipation!  School starts on Monday!,that's a long time. You should be used to it
198,Actitud,excited,I am super hype for the new super smash bros_comma_ it looks so so good!,It comes out in December right? It would make a good holiday present!
199,Actitud,excited,I will finally be getting a new phone soon_comma_ and I can't wait because my old one is almost dead.,I have a lot of anticipation in me right now. I will finally be able to get a new phone after all these years.
200,Actitud,excited,Just got a house for 10k. It's really broken down_comma_ but I hope it'll be nice after we fix it up.,thats cool.  i hope it works out for you
201,Actitud,joyful,I'm happy my package just arrived,im glad it came earlier
202,Actitud,trusting,If I'm going to be in a relationship I need girl I can depend on_comma_ not some effed up crazy damaged goods type of girl,Yes_comma_ glad you agree....I was an idiot and mistook a deadly combo of pity and infatuation for love...but now I know what to avoid and what I want so I'm thankful
203,Actitud,joyful,i got a surprise gift in the mail,one time on my birthday i never expect much to me is just a regular day _comma_ then i get a package in the mail it was copic markers my friend mailed them to me from another state i was so happy
204,Actitud,prepared,We went through hurricane irma last year. We got everything we needed and put metal shutter on all the windows and decided to stay. , i must have been terrifying_comma_ I am glad you both made it through it
205,Actitud,prepared,I have been training for months for the race.,I'm sure all the work will be worth it in the end!
206,Actitud,prepared,I am all packed for my vacation.  I don't believe I have forgotten anything for the trip but you never know.,I'm leaving for my vacation soon.  I have everything all packed and ready to go.
207,Actitud,prepared,College is starting in 3 weeks_comma_ and I have my apartment all settled_comma_ my classes picked out_comma_ and my student loans scheduled. I feel like I'm on track to start the semester in a way where I'm not hurried or confused_comma_ and it feels good.,Hey... that's okay. I'm 28 and just now about to finish my 4-year degree. My brother finished his at 36. There's always a reason for the path you take. Maybe it led to better things. Don't ever just consider yourself a statistic. Good luck!
208,Actitud,prepared,I had been grinding at home trying to build my website when this girl I hadn't heard from since high school called. She said she was in town and wanted to catch up.  Deciding I needed a break from work I turned off my laptop_comma_ threw on some fresh khakis and air nikes and 2 condoms just in case.  Turned out it's always better safe than sorry.,They're known to cause erectile dysfunction? There's chemicals in the laces_comma_ dude! A conspiracy I tell you! Done by OBAMA!
209,Actitud,prepared,im ready for next week!,what's happening next week?
210,Actitud,prepared,I went into that interviewing knowing i could answer any question they threw at me,yea im sure i'll get the job
211,Actitud,prepared,Getting ready to file quarterly taxes and I have been very diligent with organization this year so I am prepared,How much stuff did you have to go through?
212,Actitud,prepared,I had a big presentation that I was very nervous about. Luckily_comma_ I made sure to practice and get everything together before time,I am so happy everything went well for you.
213,Actitud,prepared,Last week when I was coming back to my home_comma_ a man approached me. But_comma_ I had a gun. I felt I was ready.,I had a gun. I felt I was ready. If anything would have happened_comma_ I could have used it.
214,Actitud,prepared,I think I got everything I need for my job interview tomorrow. I got my fancy clothes and answers prepared for common questions they usually throw at u.,I think I got everything I need for my job interview tomorrow. I got my fancy clothes and answers prepared for common questions they usually throw at u.
215,Actitud,prepared,When I went into labor with my son_comma_ it was quite the ordeal. He was coming way too early and we had to rush to get him out. Thankfully_comma_ I had everything already packed beforehand!,Is he healthy?
216,Actitud,prepared,I@ve done lots of research for an interview tis week,I have an interview this week
217,Actitud,prepared,I've got all my fishing gear packed up. I'm ready for tomorrow morning.,I've got all my fishing gear packed up. I'm ready for tomorrow morning.
218,Actitud,prepared,I'm spent all summer getting ready to write my thesis. I can't wait to get time to start.,I spent all summer getting ready to write my thesis. I can't wait to get time to start.
219,Actitud,prepared,ready to leave this hood ,That sounds like a plan.
220,Actitud,prepared,I am having some financial issues. I am selling almost everything before the bailiff come.,I am having some financial issues. I am selling almost everything before the bailiff come.
221,Actitud,prepared,I'm looking forward to presenting to my client_comma_ I spent a lot of time on that powerpoint,I'm looking forward to presenting to my client_comma_ I spent a lot of time on that powerpoint
222,Actitud,prepared,I knew I was going to pass my drivers test. I just knew I would do well,I knew I was going to pass my drivers test. I knew I would do well
223,Actitud,hopeful,My daughter starts public school for the first time in 3 years. I think she is going to do well,My daughter starts public school for the first time in 3 years! I think she is going to do great but she's a little bit nervous.
224,Actitud,prepared,It was my first time taking the DMV test. I went there rather early and aced the test.,Yes it was even though I was a bit nervous.
225,Actitud,prepared,We had a big storm last summer_comma_ so this year I bought a ton of supplies in case we lost power or had flooding. Last year our basement got very damaged. ,Yeah its all repaired now. I also bought lots of food in case we loose power.
226,Actitud,prepared,when I had my test to get a new certification at work_comma_ I felt great about it because I had workd really hard and studied.,I had my test for a new certification at work.  I really wasn't that nervous for it though.
227,Actitud,hopeful,I am confident my brother will beat his cancer.,I am confident my brother will beat this cancer.
228,Actitud,hopeful,I am feeling more positive about the future today. I am really trying to hold on to that feeling no matter what. It's hard!,That is good!  Why have you been feeling down about the future before?
229,Actitud,hopeful,Before I do feel that I will not make it in life_comma_ but later I felt expectant of my future,I expected something good_comma_ that was why things are working well for me now
230,Actitud,hopeful,I really want to win the lottery someday_comma_ maybe i will? ,That would pretty amazing. What will you do with the winning?
231,Actitud,hopeful,My husband and I are going to couples counseling. I am really positive that we can fix things and be happy.,Oh no. I'm sorry to hear you are going through a rough patch.
232,Actitud,hopeful,Nephew plays football.  I hope he does great this year!,Yeah this is true!  I'll definitely take your advice! Thank you so much!
233,Actitud,hopeful,I am hoping to win the lottery this week!,I am hoping as well
234,Actitud,hopeful,that i will find a better job ,I am staying very positive that this year even if it is coming close to an end I will find a better job! 
235,Actitud,hopeful,I'm meeting a girl for a date at the zoo this afternoon.,What's your favorite exhibit at the zoo?
236,Actitud,hopeful,I am feeling this way in hopes that I get into grad school.,I really hope I get accepted into grad school.
237,Actitud,hopeful,I have a promotion coming up in the next few weeks. I am hopeful that I will get a raise,that's awesome! I hope you will get a promotion. what do you do for work?
238,Actitud,hopeful,I am hoping the Eagles can win it all again this season!,Why do you like the eagles?
239,Actitud,hopeful,I just got a new manager at work. She is really young but seems to be full of good ideals.,I plan to steer clear. I'm going to relocate in January so I just need to lay low. I hope she does a great job.
240,Actitud,hopeful,I'll be getting a raise in February.,It'll be around 25%.
241,Actitud,hopeful,Getting a colonoscopy done.  I hope it turns out okay,My appointment is coming up
242,Actitud,hopeful,I pray American will be great again.,Me too_comma_ he's so real. He loves what I love. MMA_comma_ poker_comma_ guns_comma_ WWE_comma_ hahahah
243,Actitud,hopeful,I recently applied for a job at a new company. Getting this job would but such a step up for me and my family. It would really be great if I got it.,Well I hope you get it. Good luck!
244,Actitud,hopeful,I'm trying to save up money to buy a home by next year. If all goes well It can happen.,I am so excited. I'm thinking of all the things I want to do to it and I don't even know what it looks like yet.
245,Actitud,hopeful,I'm going to see a film tonight and I am really crossing my fingers its good.,I think it's called the Happytime Murders. Some murder mystery/comedy with puppets.
246,Actitud,hopeful,We are wanting to buy a new house in the next year. I'm really hoping that it works out for us. We have needed something a little bigger for a while now.,Yes. I have 4 kids and we are living in a 3 bedroom and 1 bathroom right now. We definitely need another bathroom. lol
247,Actitud,hopeful,I borrowed some money from my friend. I've a confidence I'll repay this month to him.,What a good friend to lend you money in your time of need. You should thank him and take him to dinner after everything is sorted.
248,Actitud,hopeful,Vacation trip coming up hope it's awesome,Yeah I know!  It's going to be awesome!  Enjoy your day_comma_ friend!
249,Actitud,joyful,I'm pretty happy that my daughters have a day off from school today.,Well_comma_ my daughters have a day off from school due to our state elections.
250,Actitud,trusting,I am waiting on my friend to come over. They are bringing me a medicine for my pet.,I'm sorry. That must make you sad.
251,Actitud,trusting,I let people so much in my life and they ended up betraying my confidence i had in them.,I can sympathize with you. I've had a lot of betrayal in the past. The ONLY thing to do is to continue looking for trustworthy individuals. 
252,Actitud,trusting,When my dad wanted to help me get a car_comma_ I trusted him. I knew he would help me a lot,That is nice of him_comma_ that is a good dad right there!
253,Actitud,faithful,I fully trust in my intuition and dreams.  They have gotten me this far and I'm going all the way to the top,These days I'm trusting my intuition and following my gut to achieve my goals.  They've gotten me this far and haven't let me down yet
254,Actitud,faithful,I've failed a lot of diets in the past_comma_ but this time I've been able to stay dedicated for the past four months. I'm seeing great progress now!,Yeah_comma_ that sounds like a really good idea!
255,Actitud,faithful,When the guy I'm now married to and I met for the first time I was actually dating someone else. I thought that my now husband would just be a really good friend to me. I stayed with my ex-boyfriend for a while after_comma_ and even when I knew I wanted to date my now husband I never did anything to betray my ex.,Well that's good. Sounds like it all worked out pretty well.
256,Actitud,faithful,One day my neighbor helped me in a risky situation. So I'm loyal to their family always.,Yeah_comma_ They helped me in the risky situation when I was alone.
257,Actitud,faithful,I have been with my car insurance company for 30 years.,I have been with my car insurance company for 30 years.
258,Actitud,faithful,god has done so much for me in my life. i owe everything to him,and i know he's going to come back for me and take me away from this place
259,Actitud,faithful,I had a girl try to hook up with me_comma_ but i didnt do anything because I love my wife.,This attractive girl at the bar was trying to get me to go home with her the other night
260,Actitud,faithful,3,A key to a long relationship is persistence_comma_ so keep at it! 
261,Actitud,faithful,Some one owed me some money,I thought he would not pay back after a long time
262,Actitud,faithful,I just celebrated 25 years at my job.,You should've made them buy another cake!
263,Actitud,faithful,I have always  been faithful to my girlfiend of almost 3 years,So many people cheat nowadays. That's good to hear!
264,Actitud,faithful,I'm hoping I can reach diamond next season in overwatch. I've been practicing a ridiculous amount,I would say it's my favorite fps now by a mile. Cod became fecal matter 5 or 6 years ago. I'm hoping I can finally stop being a pleb and hit diamond next season
265,Actitud,faithful,I feel very committed to my work. No matter how I feel_comma_ I have to press on and complete it. It's been a rough week and my will power is very strong to still work through all this,yes. It's been a rough week and my will power is very strong to still work through all this
266,Actitud,faithful,I feel this way because I have hope that I will get into grad school.,That sounds interesting_comma_ when do you learn if you got in?
267,Actitud,faithful,When I am in nature I feel good that this world is exactly as it should be. Everything is moving a long to Gods desires.,Why do cities make you feel that way?
268,Actitud,faithful,I love my girlfriend so much. I think im going to marry her.,Congratulations and thats OK I do that a lot too.
269,Actitud,faithful,I would never cheat on my wife like my brother cheated on his wife,Cheating  on your spouse is a despicable thing to do.
270,Actitud,faithful,When my spouse was out of town for work_comma_ a friend stopped by to visit. This friend offered to kiss me_comma_ but I declined and asked the friend to leave. I only have interest in my spouse in this way.,I said no and made the friend leave. I only like my spouse.
