,Topic,Subject,Question,Answer
0,Actitud,prepared,I had been grinding at home trying to build my website when this girl I hadn't heard from since high school called. She said she was in town and wanted to catch up.  Deciding I needed a break from work I turned off my laptop_comma_ threw on some fresh khakis and air nikes and 2 condoms just in case.  Turned out it's always better safe than sorry.,They're known to cause erectile dysfunction? There's chemicals in the laces_comma_ dude! A conspiracy I tell you! Done by OBAMA!
1,Actitud,prepared,We had a big storm last summer_comma_ so this year I bought a ton of supplies in case we lost power or had flooding. Last year our basement got very damaged. ,Yeah its all repaired now. I also bought lots of food in case we loose power.
2,Actitud,prepared,Last week when I was coming back to my home_comma_ a man approached me. But_comma_ I had a gun. I felt I was ready.,I had a gun. I felt I was ready. If anything would have happened_comma_ I could have used it.
3,Actitud,prepared,We went through hurricane irma last year. We got everything we needed and put metal shutter on all the windows and decided to stay. , i must have been terrifying_comma_ I am glad you both made it through it
4,Actitud,prepared,I have been training for months for the race.,I'm sure all the work will be worth it in the end!
5,Actitud,prepared,I am all packed for my vacation.  I don't believe I have forgotten anything for the trip but you never know.,I'm leaving for my vacation soon.  I have everything all packed and ready to go.
6,Actitud,prepared,College is starting in 3 weeks_comma_ and I have my apartment all settled_comma_ my classes picked out_comma_ and my student loans scheduled. I feel like I'm on track to start the semester in a way where I'm not hurried or confused_comma_ and it feels good.,Hey... that's okay. I'm 28 and just now about to finish my 4-year degree. My brother finished his at 36. There's always a reason for the path you take. Maybe it led to better things. Don't ever just consider yourself a statistic. Good luck!
7,Actitud,prepared,im ready for next week!,what's happening next week?
8,Actitud,prepared,I went into that interviewing knowing i could answer any question they threw at me,yea im sure i'll get the job
9,Actitud,prepared,Getting ready to file quarterly taxes and I have been very diligent with organization this year so I am prepared,How much stuff did you have to go through?
10,Actitud,prepared,I had a big presentation that I was very nervous about. Luckily_comma_ I made sure to practice and get everything together before time,I am so happy everything went well for you.
11,Actitud,prepared,I think I got everything I need for my job interview tomorrow. I got my fancy clothes and answers prepared for common questions they usually throw at u.,I think I got everything I need for my job interview tomorrow. I got my fancy clothes and answers prepared for common questions they usually throw at u.
12,Actitud,prepared,It was my first time taking the DMV test. I went there rather early and aced the test.,Yes it was even though I was a bit nervous.
13,Actitud,prepared,When I went into labor with my son_comma_ it was quite the ordeal. He was coming way too early and we had to rush to get him out. Thankfully_comma_ I had everything already packed beforehand!,Is he healthy?
14,Actitud,prepared,I@ve done lots of research for an interview tis week,I have an interview this week
15,Actitud,prepared,I've got all my fishing gear packed up. I'm ready for tomorrow morning.,I've got all my fishing gear packed up. I'm ready for tomorrow morning.
16,Actitud,prepared,I'm spent all summer getting ready to write my thesis. I can't wait to get time to start.,I spent all summer getting ready to write my thesis. I can't wait to get time to start.
17,Actitud,prepared,ready to leave this hood ,That sounds like a plan.
18,Actitud,prepared,I am having some financial issues. I am selling almost everything before the bailiff come.,I am having some financial issues. I am selling almost everything before the bailiff come.
19,Actitud,prepared,I'm looking forward to presenting to my client_comma_ I spent a lot of time on that powerpoint,I'm looking forward to presenting to my client_comma_ I spent a lot of time on that powerpoint
20,Actitud,prepared,I knew I was going to pass my drivers test. I just knew I would do well,I knew I was going to pass my drivers test. I knew I would do well
21,Actitud,hopeful,My daughter starts public school for the first time in 3 years. I think she is going to do well,My daughter starts public school for the first time in 3 years! I think she is going to do great but she's a little bit nervous.
22,Actitud,prepared,when I had my test to get a new certification at work_comma_ I felt great about it because I had workd really hard and studied.,I had my test for a new certification at work.  I really wasn't that nervous for it though.
23,Actitud,faithful,I was on a business trip last week spending some time at a local bar. There was a girl who was being flirty with me. I had to tell her that I was married and I couldn't play with her.,Last week on a business trip I spent some time at the bar. There was this girl who was really flirty with me. I had to tell her that I couldn't play with her because I was married.
24,Actitud,hopeful,I am confident my brother will beat his cancer.,I am confident my brother will beat this cancer.
25,Actitud,hopeful,I borrowed some money from my friend. I've a confidence I'll repay this month to him.,What a good friend to lend you money in your time of need. You should thank him and take him to dinner after everything is sorted.
26,Actitud,hopeful,I just applied for a new job.  After the interview_comma_ I'm very optimistic that I will get the position,I do!  I'm feeling very optimistic about it
27,Actitud,hopeful,It's birthday soon. I want to be a better person.,Birthday wishes come true. You will have to work at it still though.
28,Actitud,hopeful,I am feeling more positive about the future today. I am really trying to hold on to that feeling no matter what. It's hard!,That is good!  Why have you been feeling down about the future before?
29,Actitud,hopeful,Before I do feel that I will not make it in life_comma_ but later I felt expectant of my future,I expected something good_comma_ that was why things are working well for me now
30,Actitud,hopeful,I really want to win the lottery someday_comma_ maybe i will? ,That would pretty amazing. What will you do with the winning?
31,Actitud,hopeful,My husband and I are going to couples counseling. I am really positive that we can fix things and be happy.,Oh no. I'm sorry to hear you are going through a rough patch.
32,Actitud,hopeful,Nephew plays football.  I hope he does great this year!,Yeah this is true!  I'll definitely take your advice! Thank you so much!
33,Actitud,hopeful,I am hoping to win the lottery this week!,I am hoping as well
34,Actitud,hopeful,that i will find a better job ,I am staying very positive that this year even if it is coming close to an end I will find a better job! 
35,Actitud,hopeful,I'm meeting a girl for a date at the zoo this afternoon.,What's your favorite exhibit at the zoo?
36,Actitud,hopeful,I am feeling this way in hopes that I get into grad school.,I really hope I get accepted into grad school.
37,Actitud,hopeful,I have a promotion coming up in the next few weeks. I am hopeful that I will get a raise,that's awesome! I hope you will get a promotion. what do you do for work?
38,Actitud,hopeful,I am hoping the Eagles can win it all again this season!,Why do you like the eagles?
39,Actitud,hopeful,I just got a new manager at work. She is really young but seems to be full of good ideals.,I plan to steer clear. I'm going to relocate in January so I just need to lay low. I hope she does a great job.
40,Actitud,hopeful,I'll be getting a raise in February.,It'll be around 25%.
41,Actitud,hopeful,Getting a colonoscopy done.  I hope it turns out okay,My appointment is coming up
42,Actitud,hopeful,I pray American will be great again.,Me too_comma_ he's so real. He loves what I love. MMA_comma_ poker_comma_ guns_comma_ WWE_comma_ hahahah
43,Actitud,hopeful,I recently applied for a job at a new company. Getting this job would but such a step up for me and my family. It would really be great if I got it.,Well I hope you get it. Good luck!
44,Actitud,hopeful,I'm trying to save up money to buy a home by next year. If all goes well It can happen.,I am so excited. I'm thinking of all the things I want to do to it and I don't even know what it looks like yet.
45,Actitud,hopeful,I'm going to see a film tonight and I am really crossing my fingers its good.,I think it's called the Happytime Murders. Some murder mystery/comedy with puppets.
46,Actitud,hopeful,We are wanting to buy a new house in the next year. I'm really hoping that it works out for us. We have needed something a little bigger for a while now.,Yes. I have 4 kids and we are living in a 3 bedroom and 1 bathroom right now. We definitely need another bathroom. lol
47,Actitud,hopeful,Vacation trip coming up hope it's awesome,Yeah I know!  It's going to be awesome!  Enjoy your day_comma_ friend!
48,Actitud,trusting,I am waiting on my friend to come over. They are bringing me a medicine for my pet.,I'm sorry. That must make you sad.
49,Actitud,trusting,I let people so much in my life and they ended up betraying my confidence i had in them.,I can sympathize with you. I've had a lot of betrayal in the past. The ONLY thing to do is to continue looking for trustworthy individuals. 
50,Actitud,trusting,When my dad wanted to help me get a car_comma_ I trusted him. I knew he would help me a lot,That is nice of him_comma_ that is a good dad right there!
51,Actitud,faithful,When the guy I'm now married to and I met for the first time I was actually dating someone else. I thought that my now husband would just be a really good friend to me. I stayed with my ex-boyfriend for a while after_comma_ and even when I knew I wanted to date my now husband I never did anything to betray my ex.,Well that's good. Sounds like it all worked out pretty well.
52,Actitud,faithful,One day my neighbor helped me in a risky situation. So I'm loyal to their family always.,Yeah_comma_ They helped me in the risky situation when I was alone.
53,Actitud,faithful,I have been with my car insurance company for 30 years.,I have been with my car insurance company for 30 years.
54,Actitud,faithful,god has done so much for me in my life. i owe everything to him,and i know he's going to come back for me and take me away from this place
55,Actitud,faithful,I had a girl try to hook up with me_comma_ but i didnt do anything because I love my wife.,This attractive girl at the bar was trying to get me to go home with her the other night
56,Actitud,faithful,3,A key to a long relationship is persistence_comma_ so keep at it! 
57,Actitud,faithful,Some one owed me some money,I thought he would not pay back after a long time
58,Actitud,faithful,I just celebrated 25 years at my job.,You should've made them buy another cake!
59,Actitud,faithful,I have always  been faithful to my girlfiend of almost 3 years,So many people cheat nowadays. That's good to hear!
60,Actitud,faithful,I'm hoping I can reach diamond next season in overwatch. I've been practicing a ridiculous amount,I would say it's my favorite fps now by a mile. Cod became fecal matter 5 or 6 years ago. I'm hoping I can finally stop being a pleb and hit diamond next season
61,Actitud,faithful,I feel very committed to my work. No matter how I feel_comma_ I have to press on and complete it. It's been a rough week and my will power is very strong to still work through all this,yes. It's been a rough week and my will power is very strong to still work through all this
62,Actitud,faithful,I feel this way because I have hope that I will get into grad school.,That sounds interesting_comma_ when do you learn if you got in?
63,Actitud,faithful,When I am in nature I feel good that this world is exactly as it should be. Everything is moving a long to Gods desires.,Why do cities make you feel that way?
64,Actitud,faithful,I love my girlfriend so much. I think im going to marry her.,Congratulations and thats OK I do that a lot too.
65,Actitud,faithful,I would never cheat on my wife like my brother cheated on his wife,Cheating  on your spouse is a despicable thing to do.
66,Actitud,faithful,When my spouse was out of town for work_comma_ a friend stopped by to visit. This friend offered to kiss me_comma_ but I declined and asked the friend to leave. I only have interest in my spouse in this way.,I said no and made the friend leave. I only like my spouse.
67,Actitud,faithful,I was married to my wife for thirty years_comma_ and even though she has passed I can't bring myself to date anyone else.,Well_comma_ if that's how you feel then maybe it is best if you stay in the dugout and don't play the field. No shame in that.
68,Actitud,faithful,Getting married this fall,It's lovely. Be a happy couple. live long together!
69,Actitud,excited,My spouse bought me a diamond necklace for my birthday.,Yes I was_comma_ I felt love and appreciated. 
70,Actitud,prepared,One year we had a scary hurricane warning_comma_ but thankfully with plenty of time to get ready for it. So I got batteries_comma_ beer_comma_ non-perishable foods. I was totally ready!,Wouldn't you know it totally missed my city. I was a little let down to be honest_comma_ though glad we were safe.
71,Actitud,joyful,My best friend will come visit me on Friday_comma_ so I am feeling pretty good.,My best friend is coming to visit me this Friday.
72,Actitud,faithful,I've failed a lot of diets in the past_comma_ but this time I've been able to stay dedicated for the past four months. I'm seeing great progress now!,Yeah_comma_ that sounds like a really good idea!
73,Actitud,faithful,I fully trust in my intuition and dreams.  They have gotten me this far and I'm going all the way to the top,These days I'm trusting my intuition and following my gut to achieve my goals.  They've gotten me this far and haven't let me down yet
74,Actitud,faithful,I've never cheated on my wife,uh oh how does Facebook help? lol
75,Actitud,faithful,i have faith my brother will do alright,Well at least you were able to introduce him to your friend. I hope everything works out for him!
76,Actitud,trusting,I was walking around SF zoo the other day and realized that animals are such genuine creature and I like them like humans_comma_,Have you ever been to the zoo just to realize that animals can be just as good as humans?
77,Actitud,trusting,The first time I went on a motorcycle_comma_ I was scared. But I knew my husband wouldn't do anything to hurt me. I trusted him with my life.,It must be nice to have that kind of trust for someone_comma_ and motorcycles can be fun!
78,Actitud,trusting,When I was a little kid I used to put my faith in everybody.  I learned later on_comma_ as I matured that you can't rely on other people too much because only you know what is best for you in life while everyone else will try to use you if they see you doing too well in life,I understand. Do you like Tony Montana in the movie Scarface?
79,Actitud,trusting,Once I was working on a big project with a bunch of people and made a mistake. One of the other people working on the project covered for me even though they didn't need to. ,did it boost your confidence and faith in mankind?
80,Actitud,trusting,I like my new manager. He is so kind and a good listener. I feel that I can trust him with any issue that I have.,I hate that too. Most of the managers are like that. They never listen and they can be rude.
81,Actitud,trusting,My co-worker is in charge of finishing up our big project. I am putting all my faith in them.,I have a co-worker putting the finishing touches on a big project and work_comma_ and I am really putting all my faith in him.
82,Actitud,trusting,I knew my dad would help me with my test. He was good at math,I knew my dad would help me with my test. He was good with math
83,Actitud,trusting,I can tell my best friend anything!,I usually ask her for advice and tell her embarrassing stories because she never snitches!
84,Actitud,trusting,When I had many problems or I was sad_comma_ I knew God was with me and the things were going to improve.,Can you facetime them?
85,Actitud,trusting,I let my son drive the car for the first time.,You must be so proud of him!
86,Actitud,trusting,I have faith that I will get pregnant soon. Why is it so hard? Isn't that what a women's body is built to do?,Yeah_comma_ more people are having these issues these days. I think it may be true that someone may be poisoning us through the water and food or something! It is a scary world!
87,Actitud,trusting,I trust my wife with my life,thats a good bond how long have you been together? 
88,Actitud,trusting,My nephew is learning how to drive and asked to use my car to take the driving test this weekend. ,Yeah. I feel he wont let me down. 
89,Actitud,trusting,I wanted to go out but needed someone to watch my kids. No one had ever babysat before. I let my sister watch them because I knew she would do a good job. ,Oh that's so great - and now you can feel comfortable leaving them with her more often!
90,Actitud,trusting,I went skydiving. I had to trust in the tandem partner I had to not kill me.,That's so awesome. I don't think I would have the courage now. Will you do it again?
91,Actitud,trusting,I believed that my son would behave responsibly when I left him home alone for the weekend.,Wow_comma_ that would have scared me_comma_ how did it go?
92,Actitud,trusting,I was working on a boat_comma_ and I had to hope that my friend didn't screw something up while I had my hands in the engine.,Gosh I hate it when I have to work on complicated parts in my boat engine_comma_ when my friend is helping me.
93,Actitud,trusting,i felt trusting when my dad and my mon care for me,Well as a fellow human being_comma_ I agree that when parents care for their children_comma_ it creates a lifelasting bond between the two parties.
94,Actitud,trusting,My daughter has grown up so much. She is finally able tobabysit her younger siblings,my daughter has matured so well
95,Actitud,trusting,My mom said she'd go to the doctor the next time she started feeling weird heart palpitations again. I'm about a thousand miles away from her_comma_ so I can't force her to go. But I'm worried about her_comma_ as she's always avoided the doctor_comma_ and always been in poor health. Hope she does the right thing.,"Sort of.. we have a neighbor that's been by her for 10 years_comma_ and they've been friends for a long time. But she's older herself_comma_ and has her own worries_comma_ so it's not like I can put more on her plate. My mother is just stubborn. I love her to death_comma_ but she's kind of a ""What will be_comma_ will be"" type person_comma_ and just assumes life will happen and you can_comma_ nor should_comma_ do anything to get in the way of it."
96,Actitud,faithful,I am very faithful to my employer.,My employer provides me with lots of training and support so I have become very faithful to them.
97,Actitud,faithful,I was invited to church this last weekend. I went and felt very optimistic in the church.,I went to church with a friend recently.
98,Actitud,trusting,My partner and I both work 24-hour shifts and tend to alternate shifts (I'll be at home hwen she's at work and she'll be at home when I'm at work). This can lead to some insecurities sometimes because not only are we away from each other alot_comma_ but we have a lot of time by ourselves where anyone could come over if they want to. I feel so lucky knowing that my wife has my best interest in mind. ,Ahh! We both enjoy it. Thanks for the thank you_comma_ though! :) 
99,Actitud,proud,I just got a steam cleaner and used it for the first time yesterday. My carpets came out so clean!,I was in the market for a steam cleaner and did tons of research til I chose the best one.
100,Actitud,proud,I had a big final exam that I studied really hard for. I passed with an A and finished with a 4.0 for the semester. I couldnt be happier.,I did. I even ended up with a 4.0 for the whole semester. I was very happy I was able to achieve that.
101,Actitud,confident,I started my driving class last week. I'll finish the class within a month and drive the car without any help of others.,Are you going to buy a car?
102,Actitud,proud,I was held my head high when my mother received her Master's Degree after getting a GED after high school.,You know she inspires me. She always reminds me of what hard work can do for you.
103,Actitud,proud,My son just graduated from college. I cannot believe how fast time went.,Awesome. That is a huge accomplishment.
104,Actitud,proud,I won first place in the marathon last weekend. I trained hard and deserved the win,That's pretty awesome. Do you usually run marathons?
105,Actitud,proud,My niece is visiting and we have a pool.  She has not had access to a pool for most of her childhood ad does not know how to swim.  She is figuring it out very quickly though and her confidence is increasing as her skills do.  It's very exciting to watch her skills and confidence soar and she feels it too.,My niece can't swim but has is staying with us for a bit and we have a pool.  Her skills are increasing and her confidence is soaring!
106,Actitud,proud,Nephew playing football this year,That's exciting!  I hope he's doing well in school!
107,Actitud,proud,It makes me feel good when I see my friends realizing their dreams.,Some people get jealous when other people are doing well_comma_ so you are truely a good friend
108,Actitud,proud,I watched two of my daughters as they graduated from high school.,Oh_comma_ that's wonderful!  Tell them congratulations for me! You must be bursting with pride!  
109,Actitud,proud,My brother is getting married. I am so happy for him,I am not_comma_ I did not want to jinx it
110,Actitud,proud,I made an amazing pizza yesterday. Iwas very proud of it.,I love pizza. Did you make it by yourself or with friends?
111,Actitud,proud,My grandson just graduated high school. He was developmentally slow so we were amazed that he actaully graduated a year early!,You must be so proud. That really is a great accomplishment that he has made. Is he going to college?
112,Actitud,proud,my daughter passed her drivers test on the first try,really scary.
113,Actitud,proud,One time in welding school I got 2 of my teachers a gig with a major contractor on FT benning building ADA code railing for th new hospital and centers and stuff_comma_,One time in welding school I got 2 of my teachers a gig with a major contractor on FT Benning building ADA code railing for th new hospital and centers and stuff_comma_
114,Actitud,proud,I was happy when my brother graduated college. I was just happy for him,I was happy when my brother finished college. He really did deserve it
115,Actitud,proud,My school is low income_comma_ but we score in the top 5% statewide.,Yep. We get looked down on so much_comma_ but I think some schools are gonna rethink their attitudes now.
116,Actitud,proud,I won a teaching award last year for my work with at-risk youth. ,It's nice to be recognized. What do you do for a living?
117,Actitud,proud,Finally got some yard work done _comma_ Love the smell of fresh cut grass.,I like getting things done in the yard_comma_but I feel so dirty afterwards.
118,Actitud,proud,My little boy got on the bus this morning. He made me so happy for him.,That's so sweet. 
119,Actitud,proud,My daughter got is going to university. I'm so happy. ,Thank you_comma_ I'm so proud
120,Actitud,proud,My son won first place at his first spelling bee.,That's great!  Sounds like he's a smart kid!
121,Actitud,proud,My daughter win a medal for dancing in a competition. I glad to see her as a dancer.,I'm impressed_comma_ where did she win the medal?
122,Actitud,proud,My dog learned all of his tricks!,Oh great. That is so fun . My baby died a few years ago. But he was over 14 _comma_ so. 
123,Actitud,joyful,Get to hang out and play cards with my girlfriend and her parents. Her parents are actually pretty laid back and fun to be around_comma_ so I'm looking forward to it. Glad I don't have to deal with overbearing in-laws like some people.,That's good. Were you nervous at first?
124,Actitud,joyful,When my first child was born I have never experienced so much happiness in my life.,Thank you! It is hard at times tho when getting little sleep.
125,Actitud,joyful,My company will give us a bonus because the quarter was good. I am happy.,I just went on a vaction with my kids. Its was so relaxing. Have fun
126,Actitud,joyful,I felt so happy seeing my high school friends last month. We were at our reunion,True! All those old memories started rushing in
127,Actitud,prepared,One year we had a scary hurricane warning_comma_ but thankfully with plenty of time to get ready for it. So I got batteries_comma_ beer_comma_ non-perishable foods. I was totally ready!,Wouldn't you know it totally missed my city. I was a little let down to be honest_comma_ though glad we were safe.
128,Actitud,joyful,My best friend will come visit me on Friday_comma_ so I am feeling pretty good.,My best friend is coming to visit me this Friday.
129,Actitud,joyful,I care a lot about all the little birds in my neighborhood. I am a sensitive soul and I just want to help every critter I see.,i dont want them to suffer either
130,Actitud,joyful,I'm happy my package just arrived,im glad it came earlier
131,Actitud,joyful,I'm pretty happy that my daughters have a day off from school today.,Well_comma_ my daughters have a day off from school due to our state elections.
