,Topic,Subject,Question,Answer
271,Actitud,faithful,I was married to my wife for thirty years_comma_ and even though she has passed I can't bring myself to date anyone else.,Well_comma_ if that's how you feel then maybe it is best if you stay in the dugout and don't play the field. No shame in that.
272,Actitud,faithful,Getting married this fall,It's lovely. Be a happy couple. live long together!
273,Actitud,excited,My spouse bought me a diamond necklace for my birthday.,Yes I was_comma_ I felt love and appreciated. 
274,Actitud,faithful,I've never cheated on my wife,uh oh how does Facebook help? lol
275,Actitud,hopeful,It's birthday soon. I want to be a better person.,Birthday wishes come true. You will have to work at it still though.
276,Actitud,faithful,i have faith my brother will do alright,Well at least you were able to introduce him to your friend. I hope everything works out for him!
277,Actitud,faithful,I am very faithful to my employer.,My employer provides me with lots of training and support so I have become very faithful to them.
278,Actitud,trusting,I was walking around SF zoo the other day and realized that animals are such genuine creature and I like them like humans_comma_,Have you ever been to the zoo just to realize that animals can be just as good as humans?
279,Actitud,trusting,The first time I went on a motorcycle_comma_ I was scared. But I knew my husband wouldn't do anything to hurt me. I trusted him with my life.,It must be nice to have that kind of trust for someone_comma_ and motorcycles can be fun!
280,Actitud,trusting,When I was a little kid I used to put my faith in everybody.  I learned later on_comma_ as I matured that you can't rely on other people too much because only you know what is best for you in life while everyone else will try to use you if they see you doing too well in life,I understand. Do you like Tony Montana in the movie Scarface?
281,Actitud,trusting,If I'm going to be in a relationship I need girl I can depend on_comma_ not some effed up crazy damaged goods type of girl,Yes_comma_ glad you agree....I was an idiot and mistook a deadly combo of pity and infatuation for love...but now I know what to avoid and what I want so I'm thankful
282,Actitud,trusting,Once I was working on a big project with a bunch of people and made a mistake. One of the other people working on the project covered for me even though they didn't need to. ,did it boost your confidence and faith in mankind?
283,Actitud,trusting,I like my new manager. He is so kind and a good listener. I feel that I can trust him with any issue that I have.,I hate that too. Most of the managers are like that. They never listen and they can be rude.
284,Actitud,trusting,My co-worker is in charge of finishing up our big project. I am putting all my faith in them.,I have a co-worker putting the finishing touches on a big project and work_comma_ and I am really putting all my faith in him.
285,Actitud,trusting,I knew my dad would help me with my test. He was good at math,I knew my dad would help me with my test. He was good with math
286,Actitud,trusting,I can tell my best friend anything!,I usually ask her for advice and tell her embarrassing stories because she never snitches!
287,Actitud,trusting,When I had many problems or I was sad_comma_ I knew God was with me and the things were going to improve.,Can you facetime them?
288,Actitud,trusting,I let my son drive the car for the first time.,You must be so proud of him!
289,Actitud,trusting,I trust my wife with my life,thats a good bond how long have you been together? 
290,Actitud,trusting,My partner and I both work 24-hour shifts and tend to alternate shifts (I'll be at home hwen she's at work and she'll be at home when I'm at work). This can lead to some insecurities sometimes because not only are we away from each other alot_comma_ but we have a lot of time by ourselves where anyone could come over if they want to. I feel so lucky knowing that my wife has my best interest in mind. ,Ahh! We both enjoy it. Thanks for the thank you_comma_ though! :) 
291,Actitud,trusting,My nephew is learning how to drive and asked to use my car to take the driving test this weekend. ,Yeah. I feel he wont let me down. 
292,Actitud,trusting,I wanted to go out but needed someone to watch my kids. No one had ever babysat before. I let my sister watch them because I knew she would do a good job. ,Oh that's so great - and now you can feel comfortable leaving them with her more often!
293,Actitud,trusting,I went skydiving. I had to trust in the tandem partner I had to not kill me.,That's so awesome. I don't think I would have the courage now. Will you do it again?
294,Actitud,trusting,I believed that my son would behave responsibly when I left him home alone for the weekend.,Wow_comma_ that would have scared me_comma_ how did it go?
295,Actitud,trusting,I was working on a boat_comma_ and I had to hope that my friend didn't screw something up while I had my hands in the engine.,Gosh I hate it when I have to work on complicated parts in my boat engine_comma_ when my friend is helping me.
296,Actitud,trusting,i felt trusting when my dad and my mon care for me,Well as a fellow human being_comma_ I agree that when parents care for their children_comma_ it creates a lifelasting bond between the two parties.
297,Actitud,trusting,My daughter has grown up so much. She is finally able tobabysit her younger siblings,my daughter has matured so well
298,Actitud,trusting,My mom said she'd go to the doctor the next time she started feeling weird heart palpitations again. I'm about a thousand miles away from her_comma_ so I can't force her to go. But I'm worried about her_comma_ as she's always avoided the doctor_comma_ and always been in poor health. Hope she does the right thing.,"Sort of.. we have a neighbor that's been by her for 10 years_comma_ and they've been friends for a long time. But she's older herself_comma_ and has her own worries_comma_ so it's not like I can put more on her plate. My mother is just stubborn. I love her to death_comma_ but she's kind of a ""What will be_comma_ will be"" type person_comma_ and just assumes life will happen and you can_comma_ nor should_comma_ do anything to get in the way of it."
299,Actitud,faithful,I was invited to church this last weekend. I went and felt very optimistic in the church.,I went to church with a friend recently.
300,Actitud,hopeful,I just applied for a new job.  After the interview_comma_ I'm very optimistic that I will get the position,I do!  I'm feeling very optimistic about it
301,Actitud,faithful,I was on a business trip last week spending some time at a local bar. There was a girl who was being flirty with me. I had to tell her that I was married and I couldn't play with her.,Last week on a business trip I spent some time at the bar. There was this girl who was really flirty with me. I had to tell her that I couldn't play with her because I was married.
302,Actitud,proud,I just got a steam cleaner and used it for the first time yesterday. My carpets came out so clean!,I was in the market for a steam cleaner and did tons of research til I chose the best one.
303,Actitud,proud,It makes me feel good when I see my friends realizing their dreams.,Some people get jealous when other people are doing well_comma_ so you are truely a good friend
304,Actitud,proud,I watched two of my daughters as they graduated from high school.,Oh_comma_ that's wonderful!  Tell them congratulations for me! You must be bursting with pride!  
305,Actitud,proud,My brother is getting married. I am so happy for him,I am not_comma_ I did not want to jinx it
306,Actitud,proud,I made an amazing pizza yesterday. Iwas very proud of it.,I love pizza. Did you make it by yourself or with friends?
307,Actitud,proud,My grandson just graduated high school. He was developmentally slow so we were amazed that he actaully graduated a year early!,You must be so proud. That really is a great accomplishment that he has made. Is he going to college?
308,Actitud,proud,my daughter passed her drivers test on the first try,really scary.
309,Actitud,proud,One time in welding school I got 2 of my teachers a gig with a major contractor on FT benning building ADA code railing for th new hospital and centers and stuff_comma_,One time in welding school I got 2 of my teachers a gig with a major contractor on FT Benning building ADA code railing for th new hospital and centers and stuff_comma_
310,Actitud,proud,I was happy when my brother graduated college. I was just happy for him,I was happy when my brother finished college. He really did deserve it
311,Actitud,proud,My school is low income_comma_ but we score in the top 5% statewide.,Yep. We get looked down on so much_comma_ but I think some schools are gonna rethink their attitudes now.
312,Actitud,proud,Nephew playing football this year,That's exciting!  I hope he's doing well in school!
313,Actitud,proud,I won a teaching award last year for my work with at-risk youth. ,It's nice to be recognized. What do you do for a living?
314,Actitud,proud,My little boy got on the bus this morning. He made me so happy for him.,That's so sweet. 
315,Actitud,proud,My daughter got is going to university. I'm so happy. ,Thank you_comma_ I'm so proud
316,Actitud,proud,My son won first place at his first spelling bee.,That's great!  Sounds like he's a smart kid!
317,Actitud,proud,My daughter win a medal for dancing in a competition. I glad to see her as a dancer.,I'm impressed_comma_ where did she win the medal?
318,Actitud,proud,My dog learned all of his tricks!,Oh great. That is so fun . My baby died a few years ago. But he was over 14 _comma_ so. 
319,Actitud,proud,I got all A's in my last semester.,Thanks! Yes_comma_ I think I did my best anyway.
320,Actitud,proud,I was held my head high when my mother received her Master's Degree after getting a GED after high school.,Yes_comma_ it is great! Even better she just received her Master's Degree at the tender age of 50!
321,Actitud,joyful,I was very happy to get my new job,oh wow. we're practically neighbors.
322,Actitud,confident,For some reason if I get a good pump at the gym early in the morning_comma_ I feel like I can tackle any task on my to-do list for the day.,That's awesome. do you usually exercise in the mornings?
323,Actitud,proud,Finally got some yard work done _comma_ Love the smell of fresh cut grass.,I like getting things done in the yard_comma_but I feel so dirty afterwards.
324,Actitud,proud,My niece is visiting and we have a pool.  She has not had access to a pool for most of her childhood ad does not know how to swim.  She is figuring it out very quickly though and her confidence is increasing as her skills do.  It's very exciting to watch her skills and confidence soar and she feels it too.,My niece can't swim but has is staying with us for a bit and we have a pool.  Her skills are increasing and her confidence is soaring!
325,Actitud,proud,I won first place in the marathon last weekend. I trained hard and deserved the win,That's pretty awesome. Do you usually run marathons?
326,Actitud,proud,My son just graduated from college. I cannot believe how fast time went.,Awesome. That is a huge accomplishment.
327,Actitud,trusting,I have faith that I will get pregnant soon. Why is it so hard? Isn't that what a women's body is built to do?,Yeah_comma_ more people are having these issues these days. I think it may be true that someone may be poisoning us through the water and food or something! It is a scary world!
328,Actitud,joyful,I remember as a child when I got my Nintendo 64 how happy and excited I was. Best christmas memory I have.,Yea _comma_ I still play it sometimes for funs sake.
329,Actitud,joyful,I won a year of unlimited pizza. I'm so psyched.,It will save you a lot of money too
330,Actitud,joyful,Going to disney world in december!,Oh that's exciting! Have you gone before?
331,Actitud,joyful,I felt this way after the birth of my son.,What did you name him?
332,Actitud,joyful,I'm very proud of my daughters.,I am very proud of my daughters.
333,Actitud,joyful,Took the kiddos to the lake,That sound fun! I love to eat fresh fish!
334,Actitud,prepared,Getting ready to file quarterly taxes and I have been very diligent with organization this year so I am prepared,I bought a big rubbermaid portable file box that has folders 
335,Actitud,joyful,I recently received my teaching certificate,thats so awesome good for you 
336,Actitud,joyful,I am going to eat some BBQ later.  I am so happy for it.,That sounds so good and the perfect way to spend a Sunday.
337,Actitud,joyful,I will be seeing my son tomorrow after  a month.,My son comes back tomorrow!
338,Actitud,joyful,I am moving to new appartment. The new neighborhood is so nice. I am so happy that I found this appartment. ,That is so nice.  When do you move?
339,Actitud,joyful,I was pretty happy to find out I was having a girl,I had her 7 months ago
340,Actitud,joyful,i am so happy that i am going to be a grandma,Yep. Happy and healthy is a blessing
341,Actitud,joyful,I cant believe my daughter performed so well in the recital. She practiced so hard for it,I cant believe my daughter performed so well in the recital.
342,Actitud,joyful,I've had family visiting for the past couple of days_comma_ some cousins and an uncle and aunt that I haven't seen a long time. It's always great to be reunited with family_comma_ especially after you get over that first initial weird social hump of feeling each other out after not having spoken for a long time. It's crazy to see how much the younger cousins have physically changed! Anyway_comma_ it's been a blast playing games and catching up with them.,wow thats great
343,Actitud,joyful,I felt so happy seeing my high school friends last month. We were at our reunion,True! All those old memories started rushing in
344,Actitud,joyful,My company will give us a bonus because the quarter was good. I am happy.,I just went on a vaction with my kids. Its was so relaxing. Have fun
345,Actitud,joyful,When my first child was born I have never experienced so much happiness in my life.,Thank you! It is hard at times tho when getting little sleep.
346,Actitud,joyful,Get to hang out and play cards with my girlfriend and her parents. Her parents are actually pretty laid back and fun to be around_comma_ so I'm looking forward to it. Glad I don't have to deal with overbearing in-laws like some people.,That's good. Were you nervous at first?
347,Actitud,proud,I was held my head high when my mother received her Master's Degree after getting a GED after high school.,You know she inspires me. She always reminds me of what hard work can do for you.
348,Actitud,confident,This is gonna be a good year at school for me. Its going to be better than all the rest!,Thats a good outlook to have! What year are you on 1st_comma_ 2nd? 
349,Actitud,excited,Recently we decided to rescue another kitten. We were so thrilled to be adding another furry member to our family and save a life.,That is great! Adopt_comma_ don't shop! Always a great motto!
350,Actitud,joyful,My dogs passed away 2 years ago. My family adopted me one this past weekend on my birthday.,My dogs passed away 2 years ago. My family adopted me one this past weekend on my birthday.
351,Actitud,excited,I was so thrilled to get concert tickets for a surprise show. It will be so fun!,The Strokes are playing this show on the fly in a month. It's so cool!
352,Actitud,confident,My friend speaks 4 languages. I'm sure they'll get that interpreter job at the embassy.,Yea. English of course_comma_ then French_comma_ Spanisha and Chinese.
353,Actitud,confident,I recently decided to start blogging again and feel pretty good about it. I used to have a decent sized audience_comma_ so hopefully I can build it back up.,I'm sure if you can let people know that you're back blogging_comma_ they'd come back to see what you're up to now!  What do you blog about?
354,Actitud,confident,I think I can get everything I need to get accomplished before the end of summer.,What all do you have to get done?
355,Actitud,confident,I am as sure as the sun will rise tomorrow that I will get this job promotion!,Thank you! I have worked so hard for so many years and finally it shows that someone paid attention. :)
356,Actitud,confident,I recently went surfing and surfed waves everyone else was afraid to. I was the man_comma_,Yes_comma_ I've been surfing for ever. Only three of us in the water. 
357,Actitud,confident,I was very sure I was getting the promotion I asked for.,I knew I was going to get the promotion I was up for.
358,Actitud,confident,I want to lose weight and i'm sure i can do it,You can. It will take some persistence. How's it going so far?
359,Actitud,confident,We recently went on vacation with some friends to Disney world.  They had never been before and we are annual passholders so we have been several times over the last year.,We had a really good time on our vacation a couple of weeks ago.
360,Actitud,confident,I think I did very well in my work and will have a fantastic design to show my boss! I put so much effort into this it can't possibly be bad,That is a smart move by you.
361,Actitud,confident,I have my physics test tomorrow that I have been studying 10 days for_comma_ Never felt so ready in my life.,I have a physics test tomorrow. I think I can say that after 10 days of nonstop studying and copious amounts of adderall_comma_ I am finally ready.
362,Actitud,confident,I'm about to ask someone that I like out on a date. I'm pretty confident that she will say yes.,So there's a girl that I've been talking to lately... I'm thinking about asking her out.
363,Actitud,confident,I have to make a tuna casserole for tomorrow.  I am sure I can do it well.,I bet it will be great - I've always loved a good tuna casserole!
364,Actitud,confident,I know I can make a lotta money on here if I keep working.,Well keep looking something is out there for you
365,Actitud,confident,I knew it was going to be a good weekend last week. I just had a good feeling,ok
366,Actitud,confident,I remember going to State Football Championship. I told my teammates on the bus before we got off that if anybody isn't ready to leave this field with the trophy stay on the bus. The whole bus was quiet. The bus driver looked at me and said I think you guys need the listen to him he doesn't look like he's playing. We eventually won that game . ,WE won 60 - 3 
367,Actitud,confident,i went in knowing i was going to do great on that test,Awesome! So happy for you my friend
368,Actitud,confident, I knew I was going to pass my final. I studied all week,I was confident about my final test. I had studied all week hard
369,Actitud,confident,I went in to the interview knowing that I had what it takes to land the job. I had prepared to the fullest extent and had all the skills they were looking for.,Nice! You sound like you prepared very well
370,Actitud,confident,I started my driving class last week. I'll finish the class within a month and drive the car without any help of others.,Are you going to buy a car?
371,Actitud,proud,I had a big final exam that I studied really hard for. I passed with an A and finished with a 4.0 for the semester. I couldnt be happier.,I did. I even ended up with a 4.0 for the whole semester. I was very happy I was able to achieve that.
372,Actitud,excited,I finally thought my dog how to sit and give me her paw. I felt very accomplished and happy!,I finally thought my dog how to sit and give me her paw. I felt very accomplished and happy!
373,Actitud,confident,Going to a job interview soon and I think I got this!,It is great to be confident. I am sure you will knock the interview out of the park!
374,Actitud,confident,I feel I can do things on my own. I didn't always feel this way_comma_ so it's nice I am empowered now and can accomplish things on my own.,My resolve I guess? Nothing changed for the better but inside me at least I know I can do it on my own because it's 1000 times better than the alternative. I'll do whatever it takes.
375,Actitud,confident,I had to take my final exam for a class last semester. I studied really hard for this exam. I went in sure that I was going to do great on it. I ended up getting the highest score in my class!,hard work pays off 
376,Actitud,excited,I can't even fall asleep waiting to go on our vacation. ,Oh_comma_ well that is a fine thing indeed! I would be  jumping up and down!
377,Actitud,excited,I'm going to a drink and paint party tomorrow. It should be pretty fun!,Wow_comma_ that sounds like a fun and interesting time_comma_ but it sounds like there are a high chance for things to go south and be a huge mess
378,Actitud,excited,Gareth Bale played his best in the champion's league final. I was thrilled after I watched his game.,Have you watched champion's league final?
379,Actitud,excited,I am going to meet up with a special friend I haven't seen for  years,That's pretty cool. I don't see my friends much since I moved.
380,Actitud,excited,I'm going to a drink and paint party tomorrow. It should be pretty fun!,My friend is having a drink and paint party. I've only been to one before but it was pretty fun. I can't wait.
381,Actitud,excited,I have plans so go to the beach with my wife for a week next month.,I have plans so go to the beach with my wife for a week next month
382,Actitud,confident,I interviewed for a job.  I know I gave great answers to their questions and walked away feeling like I had the job.,I interviewed for a job.  I know I gave great answers to their questions and walked away feeling like the job was mine.
383,Actitud,excited,I'm going to building a gaming pc. This is my first time.,Wow. It can be difficult to put together but finding the parts is a lot of fun.
384,Actitud,excited,I'm excited for Red Dead Redemption 2 to come out.  Even though it's a couple months away,No worries_comma_ we all have our hobbies!
385,Actitud,excited,Just got a house for 10k. It's really broken down_comma_ but I hope it'll be nice after we fix it up.,thats cool.  i hope it works out for you
386,Actitud,excited,I really had a fun time at our county fair a couple of days ago.,I took the family to our county fair a couple of days ago.
387,Actitud,excited,I'm taking my kids to Six Flags this weekend! It'll be a surprise for them!,This weekend I'm taking my kids to Six Flags
388,Actitud,excited,I felt this way when my father bought me a Super Nintendo for  my 9th birthday. We were very poor so it was unexpected!,You still remember what you got for it?  It must have been memorable!  What was it?
389,Actitud,excited,i cant wait for next week!,What's going on next week?
390,Actitud,excited,A new skating rink is being built. Should be done in time for Winter skating!,That's great! I may look it up and go to their grand opening as well.
391,Actitud,excited,I've never had a lust for life like I do these days.  I literally wake up every day stoked that I'm living my dreams and can't wait to see how much money I can make,Yes you have no idea...still grinding it out everyday but it's totally worth it
392,Actitud,excited,I am so full of anticipation!  School starts on Monday!,that's a long time. You should be used to it
393,Actitud,excited,I am super hype for the new super smash bros_comma_ it looks so so good!,It comes out in December right? It would make a good holiday present!
394,Actitud,excited,I will finally be getting a new phone soon_comma_ and I can't wait because my old one is almost dead.,I have a lot of anticipation in me right now. I will finally be able to get a new phone after all these years.
395,Actitud,excited,I was cooking some food recently. I made a hard to make recipe and it worked!,That is trivia. When i am hyped_comma_ i cook lasagna. I know that is hard to cook_comma_ but i mastered it all on my own
396,Actitud,excited,My brother and a bunch of our friends planned to go to a 15-person cottage in July. I could not wait for all the fun and games we would experience!,It's very close to a lake_comma_ it probably takes a two minute hike down through a patch of trees and tall grass to get there.
397,Actitud,excited,I can't wait until Halloween. I love scaring the little kids who come to my house_comma_ muhahah!,Ha! I've always loved the more festive Dia de los Muertos approach to the day rather than scare or gore! What's your favorite Halloween film?
398,Agente inteligente,Definicin de agente inteligente,What is the definition of an intelligent agent?,"An intelligent agent is an entity capable of perceiving its environment, processing such perceptions and responding or acting in its environment rationally, i.e., tending to maximize an expected result."
399,Agente inteligente,Definicin de agente inteligente,What is the goal of the project?,"The aim of this project is to develop intelligent agents for the production of high-quality, safe and efficient food."
400,Agente inteligente,Definicin de agente inteligente,What is the definition of an intelligent agent?,Intelligent agents are the future of technology.
401,Algoritmo,Ejemplo de algoritmo,What is the name of the algorithm that Facebook uses to find out what you're interested in?,Facebook has revealed that it is using Edgerank to find out what you're most likely to be interested in on the site.
402,Algoritmo,Caractersticas de los algoritmos,What is a computer program that uses instructions or rules to solve problems?,An algorithm is a computer program that uses instructions or rules to solve problems.
403,Algoritmo,Caractersticas de los algoritmos,What does Jeremy Hobson look at?,"The BBC's science correspondent, Jeremy Hobson, looks at the role of algorithms in computing."
404,Algoritmo,Partes del algoritmo,What is the name of the part of an algorithm?,An algorithm is a computer program that uses a set of instructions to solve a problem.
