,Unnamed: 0,Topic,Subject,Question,Answer
134,20386,Actitud,confident, I knew I was going to pass my final. I studied all week,I was confident about my final test. I had studied all week hard
135,3823,Actitud,prepared,One year we had a scary hurricane warning_comma_ but thankfully with plenty of time to get ready for it. So I got batteries_comma_ beer_comma_ non-perishable foods. I was totally ready!,Wouldn't you know it totally missed my city. I was a little let down to be honest_comma_ though glad we were safe.
136,70931,Actitud,prepared,Getting ready to file quarterly taxes and I have been very diligent with organization this year so I am prepared,I bought a big rubbermaid portable file box that has folders 
137,4134,Actitud,confident,I'm about to ask someone that I like out on a date. I'm pretty confident that she will say yes.,So there's a girl that I've been talking to lately... I'm thinking about asking her out.
138,24252,Actitud,proud,My niece is visiting and we have a pool.  She has not had access to a pool for most of her childhood ad does not know how to swim.  She is figuring it out very quickly though and her confidence is increasing as her skills do.  It's very exciting to watch her skills and confidence soar and she feels it too.,My niece can't swim but has is staying with us for a bit and we have a pool.  Her skills are increasing and her confidence is soaring!
139,60349,Actitud,trusting,If I'm going to be in a relationship I need girl I can depend on_comma_ not some effed up crazy damaged goods type of girl,Yes_comma_ glad you agree....I was an idiot and mistook a deadly combo of pity and infatuation for love...but now I know what to avoid and what I want so I'm thankful
140,71053,Actitud,faithful,I just celebrated 25 years at my job.,You should've made them buy another cake!
141,56574,Actitud,joyful,I cant believe my daughter performed so well in the recital. She practiced so hard for it,I cant believe my daughter performed so well in the recital.
142,25102,Actitud,proud,I watched two of my daughters as they graduated from high school.,Oh_comma_ that's wonderful!  Tell them congratulations for me! You must be bursting with pride!  
143,11036,Actitud,confident,I was very sure I was getting the promotion I asked for.,I knew I was going to get the promotion I was up for.
144,7517,Actitud,hopeful,I just got a new manager at work. She is really young but seems to be full of good ideals.,I plan to steer clear. I'm going to relocate in January so I just need to lay low. I hope she does a great job.
145,50575,Actitud,proud,It makes me feel good when I see my friends realizing their dreams.,Some people get jealous when other people are doing well_comma_ so you are truely a good friend
146,1,Realidad aumentada,Definición de realidad aumentada,What is the definition of augmented reality?,"The BBC's technology correspondent, Chris McGrath, explains how augmented reality can be used to enhance our daily lives."
147,2,Big data,Uso de big data,What is the term for the collection and analysis of large amounts of data?,Big Data is the collection and analysis of large amounts of data.
148,18,Algoritmo,Historia del algoritmo,What is the name of the film that celebrates Euclid?,"The ancient Greek mathematician Euclid is celebrated in the film The Big Bang Theory, which opens in the UK on Friday."
149,12230,Actitud,prepared,I am all packed for my vacation.  I don't believe I have forgotten anything for the trip but you never know.,I'm leaving for my vacation soon.  I have everything all packed and ready to go.
150,25102,Actitud,proud,I watched two of my daughters as they graduated from high school.,Oh_comma_ that's wonderful!  Tell them congratulations for me! You must be bursting with pride!  
151,72360,Actitud,confident,Going to a job interview soon and I think I got this!,It is great to be confident. I am sure you will knock the interview out of the park!
152,4107,Actitud,excited,I have plans so go to the beach with my wife for a week next month.,I have plans so go to the beach with my wife for a week next month
153,18557,Actitud,joyful,I was pretty happy to find out I was having a girl,I had her 7 months ago
154,2345,Actitud,joyful,My dogs passed away 2 years ago. My family adopted me one this past weekend on my birthday.,My dogs passed away 2 years ago. My family adopted me one this past weekend on my birthday.
155,2,Turing completo,Definición de turing completo,What is the name of the computer system developed by researchers at the University of Bristol?,"A computer system that could be used to ""Turing complete"" has been developed by researchers at the University of Bristol."
156,27441,Actitud,confident,My friend speaks 4 languages. I'm sure they'll get that interpreter job at the embassy.,Yea. English of course_comma_ then French_comma_ Spanisha and Chinese.
157,25720,Actitud,confident,This is gonna be a good year at school for me. Its going to be better than all the rest!,Thats a good outlook to have! What year are you on 1st_comma_ 2nd? 
158,4107,Actitud,excited,I have plans so go to the beach with my wife for a week next month.,I have plans so go to the beach with my wife for a week next month
159,9,Algoritmo,Input del algoritmo,What is the name of the algoritm?,A cooking class is a chance for students to learn how to prepare a meal.
160,26550,Actitud,proud,My dog learned all of his tricks!,Oh great. That is so fun . My baby died a few years ago. But he was over 14 _comma_ so. 
161,1,Prolog,Definición de Prolog,What is the name of the tutorial that shows you how to solve a factorial in Prolog?,"In this tutorial, I will show you how to solve a factorial in the Prolog language."
162,8199,Actitud,confident,I want to lose weight and i'm sure i can do it,You can. It will take some persistence. How's it going so far?
163,2,Función Hash,Definición de función hash,What is the definition of a hash function?,A Hash Function is a mathematical function that transforms a set of data into an alphanumeric code of fixed length.
164,3321,Actitud,joyful,I felt so happy seeing my high school friends last month. We were at our reunion,True! All those old memories started rushing in
165,2,Máquina de Turing,Definición de máquina de Turing,What was the name of the machine that was seen at Bletchley Park?,"The BBC's science correspondent, Jeremy Vine, has been to the World War Two code-breaking centre at Bletchley Park to see the Turing machine."
166,35267,Actitud,proud,My school is low income_comma_ but we score in the top 5% statewide.,Yep. We get looked down on so much_comma_ but I think some schools are gonna rethink their attitudes now.
167,38260,Actitud,faithful,I had a girl try to hook up with me_comma_ but i didnt do anything because I love my wife.,This attractive girl at the bar was trying to get me to go home with her the other night
168,3,Modelo,Definición de modelo,What is the definition of a model?,AI is a branch of science that aims to improve the way we think about and use data.
169,15667,Actitud,excited,I am going to meet up with a special friend I haven't seen for  years,That's pretty cool. I don't see my friends much since I moved.
170,2,Tabla Hash,Definición de tabla hash,What is the definition of tabla hash?,The hash table is a very useful tool for searching for data.
171,73954,Actitud,prepared,It was my first time taking the DMV test. I went there rather early and aced the test.,Yes it was even though I was a bit nervous.
172,29853,Actitud,trusting,I am waiting on my friend to come over. They are bringing me a medicine for my pet.,I'm sorry. That must make you sad.
173,1,Aprendizaje federado,Definición de aprendizaje federado,What is the name of the new way of learning at the University of Cambridge?,"The University of Cambridge has developed a new way of learning, called Federated Learning."
174,49483,Actitud,proud,My daughter got is going to university. I'm so happy. ,Thank you_comma_ I'm so proud
175,22137,Actitud,excited,I can't wait until Halloween. I love scaring the little kids who come to my house_comma_ muhahah!,Ha! I've always loved the more festive Dia de los Muertos approach to the day rather than scare or gore! What's your favorite Halloween film?
176,27622,Actitud,excited,I'm going to building a gaming pc. This is my first time.,Wow. It can be difficult to put together but finding the parts is a lot of fun.
177,29853,Actitud,trusting,I am waiting on my friend to come over. They are bringing me a medicine for my pet.,I'm sorry. That must make you sad.
178,1,Turing completo,Definición de turing completo,What was the name of Alan Turing's work?,Alan Turing was a British computer scientist who developed the complete Turing complete.
179,1777,Actitud,excited,I felt this way when my father bought me a Super Nintendo for  my 9th birthday. We were very poor so it was unexpected!,You still remember what you got for it?  It must have been memorable!  What was it?
180,16148,Actitud,excited,I will finally be getting a new phone soon_comma_ and I can't wait because my old one is almost dead.,I have a lot of anticipation in me right now. I will finally be able to get a new phone after all these years.
181,30659,Actitud,faithful,I would never cheat on my wife like my brother cheated on his wife,Cheating  on your spouse is a despicable thing to do.
182,5076,Actitud,joyful,I'm happy my package just arrived,im glad it came earlier
183,5272,Actitud,prepared,I'm spent all summer getting ready to write my thesis. I can't wait to get time to start.,I spent all summer getting ready to write my thesis. I can't wait to get time to start.
184,1,Algoritmo,Clasificación de los algoritmos,What is one of the main functions of computer systems?,The following are some of the main functions of computer systems.
185,3,Xenobot,Definición de xenobot,"What is the name of the xenobot that can swim, fly and crawl?","A team of scientists at the University of California, Berkeley, has developed a xenobot that can swim, fly and crawl."
186,51514,Actitud,proud,I was held my head high when my mother received her Master's Degree after getting a GED after high school.,You know she inspires me. She always reminds me of what hard work can do for you.
187,3725,Actitud,prepared,I had been grinding at home trying to build my website when this girl I hadn't heard from since high school called. She said she was in town and wanted to catch up.  Deciding I needed a break from work I turned off my laptop_comma_ threw on some fresh khakis and air nikes and 2 condoms just in case.  Turned out it's always better safe than sorry.,They're known to cause erectile dysfunction? There's chemicals in the laces_comma_ dude! A conspiracy I tell you! Done by OBAMA!
188,71584,Actitud,excited,My spouse bought me a diamond necklace for my birthday.,Yes I was_comma_ I felt love and appreciated. 
189,5,Algoritmo,Características de los algoritmos,What is the idea of an algorithm?,The idea of an algorithm is to create a set of rules that can be used to solve problems.
190,94,Actitud,confident,I recently went surfing and surfed waves everyone else was afraid to. I was the man_comma_,Yes_comma_ I've been surfing for ever. Only three of us in the water. 
191,72622,Actitud,hopeful,Getting a colonoscopy done.  I hope it turns out okay,My appointment is coming up
192,10111,Actitud,trusting,I can tell my best friend anything!,I usually ask her for advice and tell her embarrassing stories because she never snitches!
193,873,Actitud,hopeful,Before I do feel that I will not make it in life_comma_ but later I felt expectant of my future,I expected something good_comma_ that was why things are working well for me now
194,21771,Actitud,confident,i went in knowing i was going to do great on that test,Awesome! So happy for you my friend
195,8804,Actitud,trusting,My nephew is learning how to drive and asked to use my car to take the driving test this weekend. ,Yeah. I feel he wont let me down. 
196,8831,Actitud,excited,I can't even fall asleep waiting to go on our vacation. ,Oh_comma_ well that is a fine thing indeed! I would be  jumping up and down!
197,6791,Actitud,hopeful,I have a promotion coming up in the next few weeks. I am hopeful that I will get a raise,that's awesome! I hope you will get a promotion. what do you do for work?
198,1,Test de Turing,Definición de test de Turing,What is the name of the test that is used to test the intelligence of machines?,"The BBC's science correspondent, Richard Galpin, explains how the Turing test is used to test the intelligence of machines."
199,19807,Actitud,faithful,I was married to my wife for thirty years_comma_ and even though she has passed I can't bring myself to date anyone else.,Well_comma_ if that's how you feel then maybe it is best if you stay in the dugout and don't play the field. No shame in that.
200,2,Metadatos,Definición de metadatos,What is the definition of metadata?,Metadata is a collection of information that accompanies data.
201,14062,Actitud,excited,I finally thought my dog how to sit and give me her paw. I felt very accomplished and happy!,I finally thought my dog how to sit and give me her paw. I felt very accomplished and happy!
202,32324,Actitud,trusting,I knew my dad would help me with my test. He was good at math,I knew my dad would help me with my test. He was good with math
203,2,Sobreajuste,Definición de sobreajuste,What is the definition of sobreajuste?,A new study suggests that a neural network can be overfitted.
204,54219,Actitud,confident,I knew it was going to be a good weekend last week. I just had a good feeling,ok
205,60349,Actitud,trusting,If I'm going to be in a relationship I need girl I can depend on_comma_ not some effed up crazy damaged goods type of girl,Yes_comma_ glad you agree....I was an idiot and mistook a deadly combo of pity and infatuation for love...but now I know what to avoid and what I want so I'm thankful
206,1,Grafo,Definición de grafo,What is the definition of a graph?,"A graph is a representation of a system or set, by means of graphical schemes."
207,58332,Actitud,excited,Gareth Bale played his best in the champion's league final. I was thrilled after I watched his game.,Have you watched champion's league final?
208,68890,Actitud,faithful,When my spouse was out of town for work_comma_ a friend stopped by to visit. This friend offered to kiss me_comma_ but I declined and asked the friend to leave. I only have interest in my spouse in this way.,I said no and made the friend leave. I only like my spouse.
209,69586,Actitud,faithful,When the guy I'm now married to and I met for the first time I was actually dating someone else. I thought that my now husband would just be a really good friend to me. I stayed with my ex-boyfriend for a while after_comma_ and even when I knew I wanted to date my now husband I never did anything to betray my ex.,Well that's good. Sounds like it all worked out pretty well.
210,14784,Actitud,faithful,I have always  been faithful to my girlfiend of almost 3 years,So many people cheat nowadays. That's good to hear!
211,64737,Actitud,faithful,god has done so much for me in my life. i owe everything to him,and i know he's going to come back for me and take me away from this place
212,44470,Actitud,hopeful,We are wanting to buy a new house in the next year. I'm really hoping that it works out for us. We have needed something a little bigger for a while now.,Yes. I have 4 kids and we are living in a 3 bedroom and 1 bathroom right now. We definitely need another bathroom. lol
213,1,Árbol de decisión,Definición de árbol de decisión,What is the name of the prediction model used in artificial intelligence?,"A decision tree is a prediction model used in many fields including artificial intelligence, economics and computer science."
214,21849,Actitud,hopeful,Vacation trip coming up hope it's awesome,Yeah I know!  It's going to be awesome!  Enjoy your day_comma_ friend!
215,3,Unidad de Procesamiento Gráfico (GPU),Definición de Unidad de Procesamiento Gráfico (GPU),What is the definition of a graphics processing unit?,"A graphics processing unit (GPU) or graphics processor is a coprocessor dedicated to graphics processing or floating point operations, to lighten the workload of the central processor/CPU in applications such as video games or interactive 3D applications."
216,41360,Actitud,faithful,I was on a business trip last week spending some time at a local bar. There was a girl who was being flirty with me. I had to tell her that I was married and I couldn't play with her.,Last week on a business trip I spent some time at the bar. There was this girl who was really flirty with me. I had to tell her that I couldn't play with her because I was married.
217,3321,Actitud,joyful,I felt so happy seeing my high school friends last month. We were at our reunion,True! All those old memories started rushing in
218,33205,Actitud,excited,I really had a fun time at our county fair a couple of days ago.,I took the family to our county fair a couple of days ago.
219,42686,Actitud,trusting,My daughter has grown up so much. She is finally able tobabysit her younger siblings,my daughter has matured so well
220,72947,Actitud,hopeful,I'm going to see a film tonight and I am really crossing my fingers its good.,I think it's called the Happytime Murders. Some murder mystery/comedy with puppets.
221,32209,Actitud,hopeful,I am feeling this way in hopes that I get into grad school.,I really hope I get accepted into grad school.
222,5983,Actitud,joyful,I recently received my teaching certificate,thats so awesome good for you 
223,1,Agente inteligente,Definición de agente inteligente,What is the definition of an intelligent agent?,"An intelligent agent is an entity capable of perceiving its environment, processing such perceptions and responding or acting in its environment rationally, i.e., tending to maximize an expected result."
224,33016,Actitud,prepared,We had a big storm last summer_comma_ so this year I bought a ton of supplies in case we lost power or had flooding. Last year our basement got very damaged. ,Yeah its all repaired now. I also bought lots of food in case we loose power.
225,2,Bot,Definición de bot,What is the definition of a bot?,A bot is a software application that is programmed to perform certain tasks.
226,35267,Actitud,proud,My school is low income_comma_ but we score in the top 5% statewide.,Yep. We get looked down on so much_comma_ but I think some schools are gonna rethink their attitudes now.
227,31842,Actitud,excited,I'm excited for Red Dead Redemption 2 to come out.  Even though it's a couple months away,No worries_comma_ we all have our hobbies!
228,31430,Actitud,prepared,I knew I was going to pass my drivers test. I just knew I would do well,I knew I was going to pass my drivers test. I knew I would do well
229,30156,Actitud,trusting,I was working on a boat_comma_ and I had to hope that my friend didn't screw something up while I had my hands in the engine.,Gosh I hate it when I have to work on complicated parts in my boat engine_comma_ when my friend is helping me.
230,6238,Actitud,confident,I started my driving class last week. I'll finish the class within a month and drive the car without any help of others.,Are you going to buy a car?
231,2,Xenobot,Definición de xenobot,What is the definition of xenobot?,"Meet the Xenobots, the latest in a long line of living robots."
232,0,Sugar code,Definición de sugar code,What is the definition of a sugar code?,"In this video, you will learn how to write code using sugar."
233,49728,Actitud,joyful,I am going to eat some BBQ later.  I am so happy for it.,That sounds so good and the perfect way to spend a Sunday.
234,3,Metaverso,Definición de metaverso,What is the definition of metaverso?,"The Metaverse is a new technology developed by the University of California, Los Angeles (UCLA)."
235,5,Aprendizaje por refuerzo,Funcionalidad del aprendizaje por refuerzo,What is the main feature of the aprendizaje?,In this paper we show how to train a group of unsupervised learning algorithms.
236,14784,Actitud,faithful,I have always  been faithful to my girlfiend of almost 3 years,So many people cheat nowadays. That's good to hear!
237,1,Internet de las Cosas (IoT),Características de Internet de las Cosas (IoT),What is the term for the Internet of Things?,The Internet of Things (IoT) is a growing trend in the technology industry.
238,260,Actitud,proud,Finally got some yard work done _comma_ Love the smell of fresh cut grass.,I like getting things done in the yard_comma_but I feel so dirty afterwards.
239,14062,Actitud,excited,I finally thought my dog how to sit and give me her paw. I felt very accomplished and happy!,I finally thought my dog how to sit and give me her paw. I felt very accomplished and happy!
240,28072,Actitud,excited,I was so thrilled to get concert tickets for a surprise show. It will be so fun!,The Strokes are playing this show on the fly in a month. It's so cool!
