,Topic,Subject,Question,Answer
0,Actitud,proud,My brother is getting married. I am so happy for him,I am not_comma_ I did not want to jinx it
1,Actitud,hopeful,Getting a colonoscopy done.  I hope it turns out okay,My appointment is coming up
2,Algoritmo,Input del algoritmo,What is the name of the command that specifies the steps to be taken when a given command is executed?,The following example shows how to use the following commands to specify the steps to be taken when a given command is executed.
3,Árbol de Merkle,Definición de árbol de Merkle,What is the definition of a Merkle hash tree?,"A Merkle hash tree is a tree of data structures, binary or otherwise, with the labels or values of its child nodes."
4,Actitud,proud,My son just graduated from college. I cannot believe how fast time went.,Awesome. That is a huge accomplishment.
5,Actitud,proud,One time in welding school I got 2 of my teachers a gig with a major contractor on FT benning building ADA code railing for th new hospital and centers and stuff_comma_,One time in welding school I got 2 of my teachers a gig with a major contractor on FT Benning building ADA code railing for th new hospital and centers and stuff_comma_
6,Actitud,confident,I think I can get everything I need to get accomplished before the end of summer.,What all do you have to get done?
7,Actitud,confident,i went in knowing i was going to do great on that test,Awesome! So happy for you my friend
8,Variables dummy,Definición de variables dummy,What is the definition of a variable dummy?,This article will show you how to create a dummy variable in Python.
9,Actitud,trusting,I was working on a boat_comma_ and I had to hope that my friend didn't screw something up while I had my hands in the engine.,Gosh I hate it when I have to work on complicated parts in my boat engine_comma_ when my friend is helping me.
10,Actitud,trusting,My co-worker is in charge of finishing up our big project. I am putting all my faith in them.,I have a co-worker putting the finishing touches on a big project and work_comma_ and I am really putting all my faith in him.
11,Actitud,faithful,i have faith my brother will do alright,Well at least you were able to introduce him to your friend. I hope everything works out for him!
12,Actitud,hopeful,I am confident my brother will beat his cancer.,I am confident my brother will beat this cancer.
13,Actitud,excited,I felt this way when my father bought me a Super Nintendo for  my 9th birthday. We were very poor so it was unexpected!,You still remember what you got for it?  It must have been memorable!  What was it?
14,Actitud,faithful,i have faith my brother will do alright,Well at least you were able to introduce him to your friend. I hope everything works out for him!
15,Actitud,joyful,I won a year of unlimited pizza. I'm so psyched.,It will save you a lot of money too
16,Actitud,excited,I am going to meet up with a special friend I haven't seen for  years,That's pretty cool. I don't see my friends much since I moved.
17,Actitud,joyful,My company will give us a bonus because the quarter was good. I am happy.,I just went on a vaction with my kids. Its was so relaxing. Have fun
18,Actitud,proud,I just got a steam cleaner and used it for the first time yesterday. My carpets came out so clean!,I was in the market for a steam cleaner and did tons of research til I chose the best one.
19,Actitud,faithful,I'm hoping I can reach diamond next season in overwatch. I've been practicing a ridiculous amount,I would say it's my favorite fps now by a mile. Cod became fecal matter 5 or 6 years ago. I'm hoping I can finally stop being a pleb and hit diamond next season
20,Actitud,trusting,Once I was working on a big project with a bunch of people and made a mistake. One of the other people working on the project covered for me even though they didn't need to. ,did it boost your confidence and faith in mankind?
21,Actitud,excited,I am so full of anticipation!  School starts on Monday!,that's a long time. You should be used to it
22,Actitud,prepared,when I had my test to get a new certification at work_comma_ I felt great about it because I had workd really hard and studied.,I had my test for a new certification at work.  I really wasn't that nervous for it though.
23,Subajuste,Causa de subajuste,What is the name of the condition that a 3D printer must be maintained?,We have been using a 3D printer for many years and have been finding that it is a very expensive machine to maintain.
24,Actitud,prepared,I knew I was going to pass my drivers test. I just knew I would do well,I knew I was going to pass my drivers test. I knew I would do well
25,Actitud,confident,My friend speaks 4 languages. I'm sure they'll get that interpreter job at the embassy.,Yea. English of course_comma_ then French_comma_ Spanisha and Chinese.
26,Actitud,confident,I have to make a tuna casserole for tomorrow.  I am sure I can do it well.,I bet it will be great - I've always loved a good tuna casserole!
27,Actitud,prepared,ready to leave this hood ,That sounds like a plan.
28,Test de Turing,Definición de test de Turing,What is the name of the team that Nick Thorpe has been working with to test the theory that machines can mimic human speech?,"The BBC's science correspondent, Nick Thorpe, has been working with artificial intelligence researcher, Alan Turing, to test the theory that machines can mimic human speech."
29,Actitud,confident,I recently decided to start blogging again and feel pretty good about it. I used to have a decent sized audience_comma_ so hopefully I can build it back up.,I'm sure if you can let people know that you're back blogging_comma_ they'd come back to see what you're up to now!  What do you blog about?
30,Actitud,hopeful,that i will find a better job ,I am staying very positive that this year even if it is coming close to an end I will find a better job! 
31,Sobreajuste,Definición de sobreajuste,What is the definition of sobreajuste?,A new study suggests that a neural network can be overfitted.
32,Internet de las Cosas (IoT),Ejemplo de Internet de las Cosas (IoT),What is the name of the internet?,"A new type of shoe is being developed by the University of California, Berkeley."
33,Actitud,trusting,I was walking around SF zoo the other day and realized that animals are such genuine creature and I like them like humans_comma_,Have you ever been to the zoo just to realize that animals can be just as good as humans?
34,Actitud,faithful,I'm hoping I can reach diamond next season in overwatch. I've been practicing a ridiculous amount,I would say it's my favorite fps now by a mile. Cod became fecal matter 5 or 6 years ago. I'm hoping I can finally stop being a pleb and hit diamond next season
35,Actitud,prepared,I think I got everything I need for my job interview tomorrow. I got my fancy clothes and answers prepared for common questions they usually throw at u.,I think I got everything I need for my job interview tomorrow. I got my fancy clothes and answers prepared for common questions they usually throw at u.
36,Actitud,hopeful,My daughter starts public school for the first time in 3 years. I think she is going to do well,My daughter starts public school for the first time in 3 years! I think she is going to do great but she's a little bit nervous.
37,Actitud,joyful,My dogs passed away 2 years ago. My family adopted me one this past weekend on my birthday.,My dogs passed away 2 years ago. My family adopted me one this past weekend on my birthday.
38,Actitud,trusting,I went skydiving. I had to trust in the tandem partner I had to not kill me.,That's so awesome. I don't think I would have the courage now. Will you do it again?
39,Actitud,trusting,If I'm going to be in a relationship I need girl I can depend on_comma_ not some effed up crazy damaged goods type of girl,Yes_comma_ glad you agree....I was an idiot and mistook a deadly combo of pity and infatuation for love...but now I know what to avoid and what I want so I'm thankful
40,Realidad aumentada,Definición de realidad aumentada,What is the definition of augmented reality?,The BBC's science and technology correspondent Nick Thorpe explains how augmented reality can be used to create new forms of media.
41,Árbol de decisión,Definición de árbol de decisión,What is the name of the prediction model used in artificial intelligence?,"A decision tree is a prediction model used in many fields including artificial intelligence, economics and computer science."
42,Actitud,faithful,3,A key to a long relationship is persistence_comma_ so keep at it! 
43,Actitud,hopeful,I'm meeting a girl for a date at the zoo this afternoon.,What's your favorite exhibit at the zoo?
44,Smart data,Definición de smart data,What is the name of the new type of data collection system?,"The British government has announced that it will be introducing a new type of data collection system called Smart Data, which will be able to collect a lot of data in a short time, but will also be able to analyse it."
45,Actitud,proud,My son won first place at his first spelling bee.,That's great!  Sounds like he's a smart kid!
46,Actitud,trusting,My daughter has grown up so much. She is finally able tobabysit her younger siblings,my daughter has matured so well
47,Xenobot,Definición de xenobot,"What is the name of the xenobot that can swim, fly and crawl?","A team of scientists at the University of California, Berkeley, has developed a xenobot that can swim, fly and crawl."
48,Actitud,confident,I went in to the interview knowing that I had what it takes to land the job. I had prepared to the fullest extent and had all the skills they were looking for.,Nice! You sound like you prepared very well
49,Actitud,excited,I have plans so go to the beach with my wife for a week next month.,I have plans so go to the beach with my wife for a week next month
50,Sobreajuste,Definición de sobreajuste,What is the definition of overfitting?,The term 'overfitting' is a common term used in machine learning to describe problems with models that are too complex to be understood by humans.
51,Actitud,confident,I'm about to ask someone that I like out on a date. I'm pretty confident that she will say yes.,So there's a girl that I've been talking to lately... I'm thinking about asking her out.
52,Actitud,excited,i cant wait for next week!,What's going on next week?
53,Tabla Hash,Definición de tabla hash,What is the definition of tabla hash?,A hash table is a data structure that associates keys or keys with values.
54,Actitud,hopeful,I am feeling this way in hopes that I get into grad school.,I really hope I get accepted into grad school.
55,Actitud,confident,I'm about to ask someone that I like out on a date. I'm pretty confident that she will say yes.,So there's a girl that I've been talking to lately... I'm thinking about asking her out.
56,Actitud,hopeful,I really want to win the lottery someday_comma_ maybe i will? ,That would pretty amazing. What will you do with the winning?
57,Actitud,prepared,I've got all my fishing gear packed up. I'm ready for tomorrow morning.,I've got all my fishing gear packed up. I'm ready for tomorrow morning.
58,Autoencoder,Definición de autoencoder,What is the goal of the project?,The research group in this project is developing an autoencoder for the decoding of audio signals.
59,Bot,Tipos de bot,What is a bot?,Bots are software programs designed to monitor and control other people's online activities.
60,Agente inteligente,Definición de agente inteligente,What is the goal of the project?,"The aim of this project is to develop intelligent agents for the production of high-quality, safe and efficient food."
61,Árbol,Definición de árbol,What is the definition of a directory tree?,"A directory tree is a collection of data structures, usually consisting of a row of characters, which are arranged in a hierarchy."
62,Actitud,hopeful,I borrowed some money from my friend. I've a confidence I'll repay this month to him.,What a good friend to lend you money in your time of need. You should thank him and take him to dinner after everything is sorted.
63,Trabajo,Trabajo,What do you do for a living?,I am responsible for promoting learning about AI through conversations.
64,Actitud,excited,A new skating rink is being built. Should be done in time for Winter skating!,That's great! I may look it up and go to their grand opening as well.
65,Actitud,confident,I think I did very well in my work and will have a fantastic design to show my boss! I put so much effort into this it can't possibly be bad,That is a smart move by you.
66,Actitud,confident,I think I can get everything I need to get accomplished before the end of summer.,What all do you have to get done?
67,Actitud,confident,I have to make a tuna casserole for tomorrow.  I am sure I can do it well.,I bet it will be great - I've always loved a good tuna casserole!
68,Actitud,confident,I have my physics test tomorrow that I have been studying 10 days for_comma_ Never felt so ready in my life.,I have a physics test tomorrow. I think I can say that after 10 days of nonstop studying and copious amounts of adderall_comma_ I am finally ready.
69,Actitud,confident,I recently went surfing and surfed waves everyone else was afraid to. I was the man_comma_,Yes_comma_ I've been surfing for ever. Only three of us in the water. 
70,Aprendizaje por refuerzo,Definición de aprendizaje por refuerzo,What is the name of the new type of machine learning?,The research group at the University of Bristol has developed a new type of machine learning called reinforcement learning.
71,Actitud,joyful,Get to hang out and play cards with my girlfriend and her parents. Her parents are actually pretty laid back and fun to be around_comma_ so I'm looking forward to it. Glad I don't have to deal with overbearing in-laws like some people.,That's good. Were you nervous at first?
72,Actitud,faithful,I was married to my wife for thirty years_comma_ and even though she has passed I can't bring myself to date anyone else.,Well_comma_ if that's how you feel then maybe it is best if you stay in the dugout and don't play the field. No shame in that.
73,Actitud,excited,I have plans so go to the beach with my wife for a week next month.,I have plans so go to the beach with my wife for a week next month
74,Actitud,hopeful,I'm meeting a girl for a date at the zoo this afternoon.,What's your favorite exhibit at the zoo?
75,Actitud,hopeful,I'm going to see a film tonight and I am really crossing my fingers its good.,I think it's called the Happytime Murders. Some murder mystery/comedy with puppets.
76,Tabla Hash,Definición de tabla hash,What is the definition of tabla hash?,Hash tables are a popular way to store large amounts of data.
77,Actitud,hopeful,I am hoping to win the lottery this week!,I am hoping as well
78,Actitud,prepared,Last week when I was coming back to my home_comma_ a man approached me. But_comma_ I had a gun. I felt I was ready.,I had a gun. I felt I was ready. If anything would have happened_comma_ I could have used it.
79,Actitud,joyful,i am so happy that i am going to be a grandma,Yep. Happy and healthy is a blessing
80,Aprendizaje automático,Definición de aprendizaje automático,What does Sue Perkins explain about machine learning?,"The BBC's artificial intelligence expert, Sue Perkins, explains how machine learning works."
81,Actitud,proud,I won first place in the marathon last weekend. I trained hard and deserved the win,That's pretty awesome. Do you usually run marathons?
82,Actitud,hopeful,It's birthday soon. I want to be a better person.,Birthday wishes come true. You will have to work at it still though.
83,Actitud,prepared,I am having some financial issues. I am selling almost everything before the bailiff come.,I am having some financial issues. I am selling almost everything before the bailiff come.
84,Actitud,excited,I can't even fall asleep waiting to go on our vacation. ,Oh_comma_ well that is a fine thing indeed! I would be  jumping up and down!
85,Actitud,prepared,I had been grinding at home trying to build my website when this girl I hadn't heard from since high school called. She said she was in town and wanted to catch up.  Deciding I needed a break from work I turned off my laptop_comma_ threw on some fresh khakis and air nikes and 2 condoms just in case.  Turned out it's always better safe than sorry.,They're known to cause erectile dysfunction? There's chemicals in the laces_comma_ dude! A conspiracy I tell you! Done by OBAMA!
86,Actitud,joyful,I recently received my teaching certificate,thats so awesome good for you 
87,Árbol,Definición de árbol,What is the definition of a tree?,In this course we will be learning how to use a tree in a variety of ways.
88,Actitud,excited,Just got a house for 10k. It's really broken down_comma_ but I hope it'll be nice after we fix it up.,thats cool.  i hope it works out for you
89,Actitud,prepared,I have been training for months for the race.,I'm sure all the work will be worth it in the end!
90,Actitud,excited,I was so thrilled to get concert tickets for a surprise show. It will be so fun!,The Strokes are playing this show on the fly in a month. It's so cool!
91,Modelos generativos,Definición de modelos generativos,What is the definition of a model that is used to train computers?,Generative models are a new way of training computers.
92,Actitud,proud,My son just graduated from college. I cannot believe how fast time went.,Awesome. That is a huge accomplishment.
93,Unidad de Procesamiento Gráfico (GPU),Definición de Unidad de Procesamiento Gráfico (GPU),What is the name of the computer chip that is used for computing?,The GPU is a type of computer chip that is used for computing.
94,Actitud,proud,I got all A's in my last semester.,Thanks! Yes_comma_ I think I did my best anyway.
95,Actitud,proud,I watched two of my daughters as they graduated from high school.,Oh_comma_ that's wonderful!  Tell them congratulations for me! You must be bursting with pride!  
96,Actitud,proud,I made an amazing pizza yesterday. Iwas very proud of it.,I love pizza. Did you make it by yourself or with friends?
97,Actitud,proud,my daughter passed her drivers test on the first try,really scary.
98,Actitud,proud,It makes me feel good when I see my friends realizing their dreams.,Some people get jealous when other people are doing well_comma_ so you are truely a good friend
99,Metaverso,Definición de metaverso,What is the definition of metaverso?,"The Metaverse is a new technology developed by the University of California, Los Angeles (UCLA)."
100,Actitud,hopeful,I have a promotion coming up in the next few weeks. I am hopeful that I will get a raise,that's awesome! I hope you will get a promotion. what do you do for work?
101,Actitud,proud,I watched two of my daughters as they graduated from high school.,Oh_comma_ that's wonderful!  Tell them congratulations for me! You must be bursting with pride!  
102,Actitud,hopeful,Before I do feel that I will not make it in life_comma_ but later I felt expectant of my future,I expected something good_comma_ that was why things are working well for me now
103,Actitud,prepared,I'm spent all summer getting ready to write my thesis. I can't wait to get time to start.,I spent all summer getting ready to write my thesis. I can't wait to get time to start.
104,Modelos generativos,Definición de modelos generativos,What is the name of the model we present?,We present a generative model for unsupervised learning of large-scale data sets.
105,Actitud,prepared,When I went into labor with my son_comma_ it was quite the ordeal. He was coming way too early and we had to rush to get him out. Thankfully_comma_ I had everything already packed beforehand!,Is he healthy?
106,Actitud,proud,My grandson just graduated high school. He was developmentally slow so we were amazed that he actaully graduated a year early!,You must be so proud. That really is a great accomplishment that he has made. Is he going to college?
107,Actitud,hopeful,It's birthday soon. I want to be a better person.,Birthday wishes come true. You will have to work at it still though.
108,Actitud,faithful,When the guy I'm now married to and I met for the first time I was actually dating someone else. I thought that my now husband would just be a really good friend to me. I stayed with my ex-boyfriend for a while after_comma_ and even when I knew I wanted to date my now husband I never did anything to betray my ex.,Well that's good. Sounds like it all worked out pretty well.
109,Actitud,trusting,Once I was working on a big project with a bunch of people and made a mistake. One of the other people working on the project covered for me even though they didn't need to. ,did it boost your confidence and faith in mankind?
110,Actitud,excited,My brother and a bunch of our friends planned to go to a 15-person cottage in July. I could not wait for all the fun and games we would experience!,It's very close to a lake_comma_ it probably takes a two minute hike down through a patch of trees and tall grass to get there.
111,Ciencia de datos,Ejemplo de ciencia de datos,What is the main focus of the NCA's new approach?,"The UK's National Crime Agency (NCA) has developed a new approach to identifying cyber threats, using machine learning to identify patterns in data."
112,Big data,Uso de big data,What is the term for the collection and analysis of large amounts of data?,Big Data is the collection and analysis of large amounts of data.
113,Actitud,faithful,Getting married this fall,It's lovely. Be a happy couple. live long together!
114,Actitud,trusting,The first time I went on a motorcycle_comma_ I was scared. But I knew my husband wouldn't do anything to hurt me. I trusted him with my life.,It must be nice to have that kind of trust for someone_comma_ and motorcycles can be fun!
115,Función Hash,Definición de función hash,What is the definition of a cryptographic hash function?,This page describes the use of a cryptographic hash function in the Python programming language.
116,Modelo,Definición de modelo,What is the definition of a model?,AI is a branch of science that aims to improve the way we think about and use data.
117,Actitud,hopeful,I am hoping to win the lottery this week!,I am hoping as well
118,Bot,Definición de bot,What is the definition of a bot?,A bot is a software application that is programmed to perform certain tasks.
119,Actitud,trusting,I let my son drive the car for the first time.,You must be so proud of him!
120,Actitud,trusting,I let people so much in my life and they ended up betraying my confidence i had in them.,I can sympathize with you. I've had a lot of betrayal in the past. The ONLY thing to do is to continue looking for trustworthy individuals. 
121,Actitud,proud,I was held my head high when my mother received her Master's Degree after getting a GED after high school.,You know she inspires me. She always reminds me of what hard work can do for you.
122,Saludo,Saludo,What is your name?,"My name is Sara, and what is yours?"
123,Actitud,trusting,I like my new manager. He is so kind and a good listener. I feel that I can trust him with any issue that I have.,I hate that too. Most of the managers are like that. They never listen and they can be rude.
124,Actitud,confident,I want to lose weight and i'm sure i can do it,You can. It will take some persistence. How's it going so far?
125,Actitud,proud,I was held my head high when my mother received her Master's Degree after getting a GED after high school.,You know she inspires me. She always reminds me of what hard work can do for you.
126,Actitud,trusting,I have faith that I will get pregnant soon. Why is it so hard? Isn't that what a women's body is built to do?,Yeah_comma_ more people are having these issues these days. I think it may be true that someone may be poisoning us through the water and food or something! It is a scary world!
127,Actitud,excited,I will finally be getting a new phone soon_comma_ and I can't wait because my old one is almost dead.,I have a lot of anticipation in me right now. I will finally be able to get a new phone after all these years.
128,Actitud,confident,I am as sure as the sun will rise tomorrow that I will get this job promotion!,Thank you! I have worked so hard for so many years and finally it shows that someone paid attention. :)
129,Actitud,trusting,When I had many problems or I was sad_comma_ I knew God was with me and the things were going to improve.,Can you facetime them?
130,Actitud,prepared,I think I got everything I need for my job interview tomorrow. I got my fancy clothes and answers prepared for common questions they usually throw at u.,I think I got everything I need for my job interview tomorrow. I got my fancy clothes and answers prepared for common questions they usually throw at u.
131,Actitud,proud,I had a big final exam that I studied really hard for. I passed with an A and finished with a 4.0 for the semester. I couldnt be happier.,I did. I even ended up with a 4.0 for the whole semester. I was very happy I was able to achieve that.
132,Blockchain,Blockchain example,What type of technology is expected to be the fastest growing segment of the global market?,The telecommunications sector is expected to be one of the fastest growing segments in the global blockchain market.
133,Actitud,faithful,3,A key to a long relationship is persistence_comma_ so keep at it! 
134,Actitud,proud,I was happy when my brother graduated college. I was just happy for him,I was happy when my brother finished college. He really did deserve it
135,Prolog,Definición de Prolog,What is the name of the language Vine is working on with Le Gall?,"The BBC's science correspondent, Jeremy Vine, has been working with French computer scientist and mathematician, Pierre-Yves Le Gall, to develop a language for artificial intelligence."
