,Unnamed: 0,Topic,Subject,Question,Answer
0,28250,Actitud,joyful,Going to disney world in december!,Oh that's exciting! Have you gone before?
1,42265,Actitud,excited,I was cooking some food recently. I made a hard to make recipe and it worked!,That is trivia. When i am hyped_comma_ i cook lasagna. I know that is hard to cook_comma_ but i mastered it all on my own
2,43708,Actitud,proud,Nephew playing football this year,That's exciting!  I hope he's doing well in school!
3,1,Tabla Hash,Definición de tabla hash,What is the definition of tabla hash?,A hash table is a data structure that associates keys or keys with values.
4,32869,Actitud,joyful,Took the kiddos to the lake,That sound fun! I love to eat fresh fish!
5,6499,Actitud,trusting,I trust my wife with my life,thats a good bond how long have you been together? 
6,49643,Actitud,prepared,I have been training for months for the race.,I'm sure all the work will be worth it in the end!
7,71479,Actitud,faithful,I fully trust in my intuition and dreams.  They have gotten me this far and I'm going all the way to the top,These days I'm trusting my intuition and following my gut to achieve my goals.  They've gotten me this far and haven't let me down yet
8,26174,Actitud,excited,Just got a house for 10k. It's really broken down_comma_ but I hope it'll be nice after we fix it up.,thats cool.  i hope it works out for you
9,69757,Actitud,confident,I recently decided to start blogging again and feel pretty good about it. I used to have a decent sized audience_comma_ so hopefully I can build it back up.,I'm sure if you can let people know that you're back blogging_comma_ they'd come back to see what you're up to now!  What do you blog about?
10,27622,Actitud,excited,I'm going to building a gaming pc. This is my first time.,Wow. It can be difficult to put together but finding the parts is a lot of fun.
11,1,Reglas de asociación,Definición de reglas de asociación,What is the definition of a grouping rule?,The association rule is a set of rules that govern the way items are grouped and stored.
12,32048,Actitud,hopeful,I am hoping to win the lottery this week!,I am hoping as well
13,35433,Actitud,faithful,One day my neighbor helped me in a risky situation. So I'm loyal to their family always.,Yeah_comma_ They helped me in the risky situation when I was alone.
14,3,Internet de las Cosas (IoT),Ejemplo de Internet de las Cosas (IoT),What is the name of the internet?,"A new type of shoe is being developed by the University of California, Berkeley."
15,27441,Actitud,confident,My friend speaks 4 languages. I'm sure they'll get that interpreter job at the embassy.,Yea. English of course_comma_ then French_comma_ Spanisha and Chinese.
16,2,Unidad de Procesamiento Gráfico (GPU),Definición de Unidad de Procesamiento Gráfico (GPU),What is the definition of a graphics processing unit?,A graphics processing unit (GPU) is a piece of computer hardware that handles computer graphics operations.
17,22149,Actitud,confident,I went in to the interview knowing that I had what it takes to land the job. I had prepared to the fullest extent and had all the skills they were looking for.,Nice! You sound like you prepared very well
18,67246,Actitud,proud,I just got a steam cleaner and used it for the first time yesterday. My carpets came out so clean!,I was in the market for a steam cleaner and did tons of research til I chose the best one.
19,2221,Actitud,excited,I'm going to a drink and paint party tomorrow. It should be pretty fun!,Wow_comma_ that sounds like a fun and interesting time_comma_ but it sounds like there are a high chance for things to go south and be a huge mess
20,49280,Actitud,prepared,I@ve done lots of research for an interview tis week,I have an interview this week
21,44745,Actitud,prepared,ready to leave this hood ,That sounds like a plan.
22,42881,Actitud,prepared,I've got all my fishing gear packed up. I'm ready for tomorrow morning.,I've got all my fishing gear packed up. I'm ready for tomorrow morning.
23,63774,Actitud,trusting,I wanted to go out but needed someone to watch my kids. No one had ever babysat before. I let my sister watch them because I knew she would do a good job. ,Oh that's so great - and now you can feel comfortable leaving them with her more often!
24,2,Internet de las Cosas (IoT),Características de Internet de las Cosas (IoT),What is the term for the use of sensors and actuators in the home?,The use of sensors and actuators in the home is increasing.
25,71030,Actitud,faithful,i have faith my brother will do alright,Well at least you were able to introduce him to your friend. I hope everything works out for him!
26,66467,Actitud,faithful,I am very faithful to my employer.,My employer provides me with lots of training and support so I have become very faithful to them.
27,50022,Actitud,hopeful,I'm meeting a girl for a date at the zoo this afternoon.,What's your favorite exhibit at the zoo?
28,46864,Actitud,confident,For some reason if I get a good pump at the gym early in the morning_comma_ I feel like I can tackle any task on my to-do list for the day.,That's awesome. do you usually exercise in the mornings?
29,1,Máquina de Turing,Definición de máquina de Turing,What is the name of the lecture by Alan Turing?,"On the 80th anniversary of the Turing machine's creation, the University of California, Berkeley, is marking the occasion with a series of lectures by computer scientist Alan Turing, who was the man who first proposed the idea of a computer."
30,43499,Actitud,hopeful,I am hoping the Eagles can win it all again this season!,Why do you like the eagles?
31,69903,Actitud,proud,my daughter passed her drivers test on the first try,really scary.
32,8,Algoritmo,Características de los algoritmos,What is the aim of this paper?,The aim of this paper is to show how to design algorithms for the problem of the distribution of the number of points of a series of triplets.
33,2,Ciencia de datos,Definición de ciencia de datos,What is the topic of the PhD program at the University of Bristol?,The University of Bristol is offering a PhD in data science.
34,1,Smart data,Definición de smart data,What is the name of the new type of data collection system?,"The British government has announced that it will be introducing a new type of data collection system called Smart Data, which will be able to collect a lot of data in a short time, but will also be able to analyse it."
35,39085,Actitud,excited,I am super hype for the new super smash bros_comma_ it looks so so good!,It comes out in December right? It would make a good holiday present!
36,14,Algoritmo,Ejemplo de algoritmo,What is the name of the algorithm used by Google?,Google has been accused of manipulating its search results to favour its own products and services over those of rivals such as Yahoo and Bing.
37,70934,Actitud,prepared,Getting ready to file quarterly taxes and I have been very diligent with organization this year so I am prepared,How much stuff did you have to go through?
38,17298,Actitud,joyful,I care a lot about all the little birds in my neighborhood. I am a sensitive soul and I just want to help every critter I see.,i dont want them to suffer either
39,1,Modelos generativos,Ejemplo de modelos generativos,What is an example of a model-based learning method?,Image-based learning is a promising new way to train computers.
40,36506,Actitud,prepared,I went into that interviewing knowing i could answer any question they threw at me,yea im sure i'll get the job
41,70152,Actitud,joyful,I remember as a child when I got my Nintendo 64 how happy and excited I was. Best christmas memory I have.,Yea _comma_ I still play it sometimes for funs sake.
42,1,Variables dummy,Definición de variables dummy,What is the definition of a variable dummy?,This article will show you how to create a dummy variable in Python.
43,4,Trabajo,Trabajo,What is your occupation?,I am a chatbot in charge of fostering learning about AI.
44,17001,Actitud,faithful,Some one owed me some money,I thought he would not pay back after a long time
45,30156,Actitud,trusting,I was working on a boat_comma_ and I had to hope that my friend didn't screw something up while I had my hands in the engine.,Gosh I hate it when I have to work on complicated parts in my boat engine_comma_ when my friend is helping me.
46,3,Modelos generativos,Definición de modelos generativos,What is the name of the model we present?,We present a generative model for unsupervised learning of large-scale data sets.
47,55,Actitud,joyful,I was very happy to get my new job,oh wow. we're practically neighbors.
48,6499,Actitud,trusting,I trust my wife with my life,thats a good bond how long have you been together? 
49,2,Agente inteligente,Definición de agente inteligente,What is the definition of an intelligent agent?,Intelligent agents are the future of technology.
50,2,Blockchain,Definición de blockchain,What is the name of the new technology being used to help businesses manage their digital assets?,A new technology is being used to help businesses manage their digital assets.
51,19561,Actitud,confident,I have my physics test tomorrow that I have been studying 10 days for_comma_ Never felt so ready in my life.,I have a physics test tomorrow. I think I can say that after 10 days of nonstop studying and copious amounts of adderall_comma_ I am finally ready.
52,5,Ciencia de datos,Expertos en ciencia de datos,What is the term for a computer scientist who uses data to solve problems?,Data science is a branch of computer science that uses data to solve problems.
53,1,Función Hash,Definición de función hash,What is the definition of a hash function?,A hash function is a function that converts one or more input elements into another element.
54,3,Bot,Ejemplo de bot,What is a bot?,A bot is a computer program that is capable of playing a video game.
55,1,Ciencia de datos,Definición de ciencia de datos,What is the term for data science?,Data science is a branch of science that uses data to solve problems.
56,35399,Actitud,proud,I won first place in the marathon last weekend. I trained hard and deserved the win,That's pretty awesome. Do you usually run marathons?
57,47804,Actitud,prepared,Last week when I was coming back to my home_comma_ a man approached me. But_comma_ I had a gun. I felt I was ready.,I had a gun. I felt I was ready. If anything would have happened_comma_ I could have used it.
58,6238,Actitud,confident,I started my driving class last week. I'll finish the class within a month and drive the car without any help of others.,Are you going to buy a car?
59,63372,Actitud,trusting,The first time I went on a motorcycle_comma_ I was scared. But I knew my husband wouldn't do anything to hurt me. I trusted him with my life.,It must be nice to have that kind of trust for someone_comma_ and motorcycles can be fun!
60,3725,Actitud,prepared,I had been grinding at home trying to build my website when this girl I hadn't heard from since high school called. She said she was in town and wanted to catch up.  Deciding I needed a break from work I turned off my laptop_comma_ threw on some fresh khakis and air nikes and 2 condoms just in case.  Turned out it's always better safe than sorry.,They're known to cause erectile dysfunction? There's chemicals in the laces_comma_ dude! A conspiracy I tell you! Done by OBAMA!
61,1,Árbol de Merkle,Definición de árbol de Merkle,What is the definition of a Merkle hash tree?,"A Merkle hash tree is a tree of data structures, binary or otherwise, with the labels or values of its child nodes."
62,63366,Actitud,trusting,I went skydiving. I had to trust in the tandem partner I had to not kill me.,That's so awesome. I don't think I would have the courage now. Will you do it again?
63,10111,Actitud,trusting,I can tell my best friend anything!,I usually ask her for advice and tell her embarrassing stories because she never snitches!
64,65984,Actitud,trusting,When I had many problems or I was sad_comma_ I knew God was with me and the things were going to improve.,Can you facetime them?
65,5272,Actitud,prepared,I'm spent all summer getting ready to write my thesis. I can't wait to get time to start.,I spent all summer getting ready to write my thesis. I can't wait to get time to start.
66,0,Bot,Ejemplo de bot,What is the name of the bot used in the election?,"The United States is currently holding elections to choose a new president, and the use of bots in the campaign has been a major issue."
67,71283,Actitud,trusting,I let my son drive the car for the first time.,You must be so proud of him!
68,41811,Actitud,confident,I think I did very well in my work and will have a fantastic design to show my boss! I put so much effort into this it can't possibly be bad,That is a smart move by you.
69,3,Aprendizaje por refuerzo,Definición de aprendizaje por refuerzo,What is the name of the new type of machine learning?,The research group at the University of Bristol has developed a new type of machine learning called reinforcement learning.
70,1,Blockchain,Ejemplo de blockchain,What is the name of the technology that allows the transfer of information between computers?,Blockchain is a technology that allows the transfer of information between computers.
71,0,Aprendizaje automático,Definición de aprendizaje automático,What does Sue Perkins explain about machine learning?,"The BBC's artificial intelligence expert, Sue Perkins, explains how machine learning works."
72,68237,Actitud,confident,I know I can make a lotta money on here if I keep working.,Well keep looking something is out there for you
73,70152,Actitud,joyful,I remember as a child when I got my Nintendo 64 how happy and excited I was. Best christmas memory I have.,Yea _comma_ I still play it sometimes for funs sake.
74,31049,Actitud,proud,My son won first place at his first spelling bee.,That's great!  Sounds like he's a smart kid!
75,75141,Actitud,proud,My son just graduated from college. I cannot believe how fast time went.,Awesome. That is a huge accomplishment.
76,2220,Actitud,excited,I'm going to a drink and paint party tomorrow. It should be pretty fun!,My friend is having a drink and paint party. I've only been to one before but it was pretty fun. I can't wait.
77,3,Blockchain,Definición de blockchain,What is the definition of blockchain?,The Blockchain Foundation is a non-profit organisation that promotes the use of Blockchain technology.
78,3,Ciencia de datos,Definición de ciencia de datos,What is the definition of data science?,The term data science has been used by many universities and research institutions for a long time.
79,66467,Actitud,faithful,I am very faithful to my employer.,My employer provides me with lots of training and support so I have become very faithful to them.
80,2221,Actitud,excited,I'm going to a drink and paint party tomorrow. It should be pretty fun!,Wow_comma_ that sounds like a fun and interesting time_comma_ but it sounds like there are a high chance for things to go south and be a huge mess
81,71030,Actitud,faithful,i have faith my brother will do alright,Well at least you were able to introduce him to your friend. I hope everything works out for him!
82,42691,Actitud,joyful,Get to hang out and play cards with my girlfriend and her parents. Her parents are actually pretty laid back and fun to be around_comma_ so I'm looking forward to it. Glad I don't have to deal with overbearing in-laws like some people.,That's good. Were you nervous at first?
83,69586,Actitud,faithful,When the guy I'm now married to and I met for the first time I was actually dating someone else. I thought that my now husband would just be a really good friend to me. I stayed with my ex-boyfriend for a while after_comma_ and even when I knew I wanted to date my now husband I never did anything to betray my ex.,Well that's good. Sounds like it all worked out pretty well.
84,69386,Actitud,confident,I remember going to State Football Championship. I told my teammates on the bus before we got off that if anybody isn't ready to leave this field with the trophy stay on the bus. The whole bus was quiet. The bus driver looked at me and said I think you guys need the listen to him he doesn't look like he's playing. We eventually won that game . ,WE won 60 - 3 
85,1,Aprendizaje por refuerzo,Ejemplos de aprendizaje por refuerzo,What is the name of the tool that is used to learn how to use a website?,This is a very useful tool for learning how to use a website.
86,58332,Actitud,excited,Gareth Bale played his best in the champion's league final. I was thrilled after I watched his game.,Have you watched champion's league final?
87,18510,Actitud,joyful,My company will give us a bonus because the quarter was good. I am happy.,I just went on a vaction with my kids. Its was so relaxing. Have fun
88,11572,Actitud,faithful,When I am in nature I feel good that this world is exactly as it should be. Everything is moving a long to Gods desires.,Why do cities make you feel that way?
89,32018,Actitud,joyful,i got a surprise gift in the mail,one time on my birthday i never expect much to me is just a regular day _comma_ then i get a package in the mail it was copic markers my friend mailed them to me from another state i was so happy
90,3823,Actitud,prepared,One year we had a scary hurricane warning_comma_ but thankfully with plenty of time to get ready for it. So I got batteries_comma_ beer_comma_ non-perishable foods. I was totally ready!,Wouldn't you know it totally missed my city. I was a little let down to be honest_comma_ though glad we were safe.
91,64737,Actitud,faithful,god has done so much for me in my life. i owe everything to him,and i know he's going to come back for me and take me away from this place
92,68890,Actitud,faithful,When my spouse was out of town for work_comma_ a friend stopped by to visit. This friend offered to kiss me_comma_ but I declined and asked the friend to leave. I only have interest in my spouse in this way.,I said no and made the friend leave. I only like my spouse.
93,2,Árbol,Definición de árbol,What is the definition of a tree?,In this course we will be learning how to use a tree in a variety of ways.
94,43499,Actitud,hopeful,I am hoping the Eagles can win it all again this season!,Why do you like the eagles?
95,52822,Actitud,proud,My daughter win a medal for dancing in a competition. I glad to see her as a dancer.,I'm impressed_comma_ where did she win the medal?
96,2345,Actitud,joyful,My dogs passed away 2 years ago. My family adopted me one this past weekend on my birthday.,My dogs passed away 2 years ago. My family adopted me one this past weekend on my birthday.
97,2,Subajuste,Definición de subajuste,What is the definition of a subajustment?,The failure of a system to work properly is called underfitting.
98,1,Unidad de Procesamiento Gráfico (GPU),Definición de Unidad de Procesamiento Gráfico (GPU),What is the term for a graphics processing unit?,"GPU- accelerated computing is the use of a graphics processing unit (GPU) in conjunction with a CPU to accelerate the performance of deep learning, analytics and engineering applications."
99,3909,Actitud,joyful,I will be seeing my son tomorrow after  a month.,My son comes back tomorrow!
100,41778,Actitud,faithful,I feel very committed to my work. No matter how I feel_comma_ I have to press on and complete it. It's been a rough week and my will power is very strong to still work through all this,yes. It's been a rough week and my will power is very strong to still work through all this
101,6117,Actitud,trusting,When my dad wanted to help me get a car_comma_ I trusted him. I knew he would help me a lot,That is nice of him_comma_ that is a good dad right there!
102,31842,Actitud,excited,I'm excited for Red Dead Redemption 2 to come out.  Even though it's a couple months away,No worries_comma_ we all have our hobbies!
103,37995,Actitud,faithful,I have been with my car insurance company for 30 years.,I have been with my car insurance company for 30 years.
104,36506,Actitud,prepared,I went into that interviewing knowing i could answer any question they threw at me,yea im sure i'll get the job
105,42691,Actitud,joyful,Get to hang out and play cards with my girlfriend and her parents. Her parents are actually pretty laid back and fun to be around_comma_ so I'm looking forward to it. Glad I don't have to deal with overbearing in-laws like some people.,That's good. Were you nervous at first?
106,3,Árbol,Definición de árbol,What is the definition of a tree?,A tree is a structure of data that is not empty or null.
107,42373,Actitud,joyful,I'm very proud of my daughters.,I am very proud of my daughters.
108,70029,Actitud,proud,I won a teaching award last year for my work with at-risk youth. ,It's nice to be recognized. What do you do for a living?
109,60140,Actitud,proud,My little boy got on the bus this morning. He made me so happy for him.,That's so sweet. 
110,30419,Actitud,hopeful,My husband and I are going to couples counseling. I am really positive that we can fix things and be happy.,Oh no. I'm sorry to hear you are going through a rough patch.
111,26941,Actitud,hopeful,I am feeling more positive about the future today. I am really trying to hold on to that feeling no matter what. It's hard!,That is good!  Why have you been feeling down about the future before?
112,47358,Actitud,prepared,im ready for next week!,what's happening next week?
113,0,Internet de las Cosas (IoT),Definición de Internet de las Cosas (IoT),What is the definition of the internet of things?,"The BBC's technology correspondent, Dan Biles, looks at the future of the internet of things."
114,15667,Actitud,excited,I am going to meet up with a special friend I haven't seen for  years,That's pretty cool. I don't see my friends much since I moved.
115,0,Metaverso,Ejemplo de metaverso,"What is the name of the method developed by scientists at the University of California, Los Angeles?","Scientists at the University of California, Los Angeles, have developed a way to stop people from falling ill if they get sick."
116,46413,Actitud,prepared,when I had my test to get a new certification at work_comma_ I felt great about it because I had workd really hard and studied.,I had my test for a new certification at work.  I really wasn't that nervous for it though.
117,71283,Actitud,trusting,I let my son drive the car for the first time.,You must be so proud of him!
118,63372,Actitud,trusting,The first time I went on a motorcycle_comma_ I was scared. But I knew my husband wouldn't do anything to hurt me. I trusted him with my life.,It must be nice to have that kind of trust for someone_comma_ and motorcycles can be fun!
119,27818,Actitud,hopeful,Nephew plays football.  I hope he does great this year!,Yeah this is true!  I'll definitely take your advice! Thank you so much!
120,2,Árbol de decisión,Definición de árbol de decisión,What is the name of the tree?,The tree is a very important part of any learning process.
121,2,Test de Turing,Definición de test de Turing,What test did DeepMind pass?,The BBC reports that a machine called DeepMind has passed the Turing test for the first time.
122,46864,Actitud,confident,For some reason if I get a good pump at the gym early in the morning_comma_ I feel like I can tackle any task on my to-do list for the day.,That's awesome. do you usually exercise in the mornings?
123,26941,Actitud,hopeful,I am feeling more positive about the future today. I am really trying to hold on to that feeling no matter what. It's hard!,That is good!  Why have you been feeling down about the future before?
124,41778,Actitud,faithful,I feel very committed to my work. No matter how I feel_comma_ I have to press on and complete it. It's been a rough week and my will power is very strong to still work through all this,yes. It's been a rough week and my will power is very strong to still work through all this
125,21849,Actitud,hopeful,Vacation trip coming up hope it's awesome,Yeah I know!  It's going to be awesome!  Enjoy your day_comma_ friend!
126,69386,Actitud,confident,I remember going to State Football Championship. I told my teammates on the bus before we got off that if anybody isn't ready to leave this field with the trophy stay on the bus. The whole bus was quiet. The bus driver looked at me and said I think you guys need the listen to him he doesn't look like he's playing. We eventually won that game . ,WE won 60 - 3 
127,26982,Actitud,confident,I feel I can do things on my own. I didn't always feel this way_comma_ so it's nice I am empowered now and can accomplish things on my own.,My resolve I guess? Nothing changed for the better but inside me at least I know I can do it on my own because it's 1000 times better than the alternative. I'll do whatever it takes.
128,28817,Actitud,trusting,I like my new manager. He is so kind and a good listener. I feel that I can trust him with any issue that I have.,I hate that too. Most of the managers are like that. They never listen and they can be rude.
129,10130,Actitud,trusting,I let people so much in my life and they ended up betraying my confidence i had in them.,I can sympathize with you. I've had a lot of betrayal in the past. The ONLY thing to do is to continue looking for trustworthy individuals. 
130,6117,Actitud,trusting,When my dad wanted to help me get a car_comma_ I trusted him. I knew he would help me a lot,That is nice of him_comma_ that is a good dad right there!
131,49643,Actitud,prepared,I have been training for months for the race.,I'm sure all the work will be worth it in the end!
132,72947,Actitud,hopeful,I'm going to see a film tonight and I am really crossing my fingers its good.,I think it's called the Happytime Murders. Some murder mystery/comedy with puppets.
133,75141,Actitud,proud,My son just graduated from college. I cannot believe how fast time went.,Awesome. That is a huge accomplishment.
