,Topic,Subject,Question,Answer
141,Actitud,hopeful,I have a promotion coming up in the next few weeks. I am hopeful that I will get a raise,that's awesome! I hope you will get a promotion. what do you do for work?
142,Actitud,proud,My little boy got on the bus this morning. He made me so happy for him.,That's so sweet. 
143,Actitud,proud,I was held my head high when my mother received her Master's Degree after getting a GED after high school.,You know she inspires me. She always reminds me of what hard work can do for you.
144,Actitud,hopeful,I have a promotion coming up in the next few weeks. I am hopeful that I will get a raise,that's awesome! I hope you will get a promotion. what do you do for work?
145,Modelos generativos,Definición de modelos generativos,What is the definition of a model that is used to train computers?,Generative models are a new way of training computers.
146,Actitud,faithful,god has done so much for me in my life. i owe everything to him,and i know he's going to come back for me and take me away from this place
147,Actitud,trusting,I was walking around SF zoo the other day and realized that animals are such genuine creature and I like them like humans_comma_,Have you ever been to the zoo just to realize that animals can be just as good as humans?
148,Actitud,confident,I know I can make a lotta money on here if I keep working.,Well keep looking something is out there for you
149,Actitud,hopeful,I'm going to see a film tonight and I am really crossing my fingers its good.,I think it's called the Happytime Murders. Some murder mystery/comedy with puppets.
150,Actitud,joyful,I was pretty happy to find out I was having a girl,I had her 7 months ago
151,Actitud,joyful,I care a lot about all the little birds in my neighborhood. I am a sensitive soul and I just want to help every critter I see.,i dont want them to suffer either
152,Trabajo,Trabajo,What is your occupation?,I am a chatbot in charge of fostering learning about AI.
153,Algoritmo,Historia del algoritmo,What is the name of the film that celebrates Euclid?,"The ancient Greek mathematician Euclid is celebrated in the film The Big Bang Theory, which opens in the UK on Friday."
154,Aprendizaje por refuerzo,Definición de aprendizaje por refuerzo,What is the definition of reinforcement learning?,This paper describes the use of reinforcement learning in software development.
155,Bot,Definición de bot,What is the definition of a bot?,A bot is a software application that is programmed to perform certain tasks.
156,Actitud,joyful,When my first child was born I have never experienced so much happiness in my life.,Thank you! It is hard at times tho when getting little sleep.
157,Actitud,excited,I finally thought my dog how to sit and give me her paw. I felt very accomplished and happy!,I finally thought my dog how to sit and give me her paw. I felt very accomplished and happy!
158,Actitud,prepared,I think I got everything I need for my job interview tomorrow. I got my fancy clothes and answers prepared for common questions they usually throw at u.,I think I got everything I need for my job interview tomorrow. I got my fancy clothes and answers prepared for common questions they usually throw at u.
159,Actitud,proud,I was happy when my brother graduated college. I was just happy for him,I was happy when my brother finished college. He really did deserve it
160,Actitud,prepared,We went through hurricane irma last year. We got everything we needed and put metal shutter on all the windows and decided to stay. , i must have been terrifying_comma_ I am glad you both made it through it
161,Actitud,excited,A new skating rink is being built. Should be done in time for Winter skating!,That's great! I may look it up and go to their grand opening as well.
162,Actitud,trusting,I wanted to go out but needed someone to watch my kids. No one had ever babysat before. I let my sister watch them because I knew she would do a good job. ,Oh that's so great - and now you can feel comfortable leaving them with her more often!
163,Subajuste,Definición de subajuste,What is the definition of a subajustment?,The failure of a system to work properly is called underfitting.
164,Actitud,faithful,I'm hoping I can reach diamond next season in overwatch. I've been practicing a ridiculous amount,I would say it's my favorite fps now by a mile. Cod became fecal matter 5 or 6 years ago. I'm hoping I can finally stop being a pleb and hit diamond next season
165,Actitud,excited,i cant wait for next week!,What's going on next week?
166,Actitud,faithful,I would never cheat on my wife like my brother cheated on his wife,Cheating  on your spouse is a despicable thing to do.
167,Actitud,confident,I think I can get everything I need to get accomplished before the end of summer.,What all do you have to get done?
168,Actitud,confident,I went in to the interview knowing that I had what it takes to land the job. I had prepared to the fullest extent and had all the skills they were looking for.,Nice! You sound like you prepared very well
169,Variables dummy,Definición de variables dummy,What is the term for variables dummy?,"The effect of a dummy variable on the outcome of a study is discussed in the paper ""Effects of a dummy variable on a study"" by the researchers at the University of Oxford."
170,Bot,Definición de bot,What is the definition of a bot?,A bot is a computer program capable of performing repetitive tasks.
171,Unidad de Procesamiento Gráfico (GPU),Definición de Unidad de Procesamiento Gráfico (GPU),What is the definition of a graphics processing unit?,A graphics processing unit (GPU) is a piece of computer hardware that handles computer graphics operations.
172,Actitud,hopeful,I'll be getting a raise in February.,It'll be around 25%.
173,Actitud,confident,I want to lose weight and i'm sure i can do it,You can. It will take some persistence. How's it going so far?
174,Actitud,prepared,I@ve done lots of research for an interview tis week,I have an interview this week
175,Actitud,trusting,My mom said she'd go to the doctor the next time she started feeling weird heart palpitations again. I'm about a thousand miles away from her_comma_ so I can't force her to go. But I'm worried about her_comma_ as she's always avoided the doctor_comma_ and always been in poor health. Hope she does the right thing.,"Sort of.. we have a neighbor that's been by her for 10 years_comma_ and they've been friends for a long time. But she's older herself_comma_ and has her own worries_comma_ so it's not like I can put more on her plate. My mother is just stubborn. I love her to death_comma_ but she's kind of a ""What will be_comma_ will be"" type person_comma_ and just assumes life will happen and you can_comma_ nor should_comma_ do anything to get in the way of it."
176,Saludo,Saludo,What's your name?,My name is Sara. What would you like to talk about?
177,Actitud,excited,Recently we decided to rescue another kitten. We were so thrilled to be adding another furry member to our family and save a life.,That is great! Adopt_comma_ don't shop! Always a great motto!
178,Actitud,excited,I'm going to a drink and paint party tomorrow. It should be pretty fun!,Wow_comma_ that sounds like a fun and interesting time_comma_ but it sounds like there are a high chance for things to go south and be a huge mess
179,Actitud,faithful,When the guy I'm now married to and I met for the first time I was actually dating someone else. I thought that my now husband would just be a really good friend to me. I stayed with my ex-boyfriend for a while after_comma_ and even when I knew I wanted to date my now husband I never did anything to betray my ex.,Well that's good. Sounds like it all worked out pretty well.
180,Actitud,hopeful,I am feeling more positive about the future today. I am really trying to hold on to that feeling no matter what. It's hard!,That is good!  Why have you been feeling down about the future before?
181,Autoencoder,Definición de autoencoder,What is the name of the new method developed?,A novel method for learning autoencoders has been developed.
182,Actitud,trusting,I believed that my son would behave responsibly when I left him home alone for the weekend.,Wow_comma_ that would have scared me_comma_ how did it go?
183,Actitud,faithful,Getting married this fall,It's lovely. Be a happy couple. live long together!
184,Actitud,hopeful,I'm meeting a girl for a date at the zoo this afternoon.,What's your favorite exhibit at the zoo?
185,Algoritmo,Input del algoritmo,What is the name of the algoritm?,A cooking class is a chance for students to learn how to prepare a meal.
186,Actitud,prepared,I am having some financial issues. I am selling almost everything before the bailiff come.,I am having some financial issues. I am selling almost everything before the bailiff come.
187,Actitud,trusting,I was working on a boat_comma_ and I had to hope that my friend didn't screw something up while I had my hands in the engine.,Gosh I hate it when I have to work on complicated parts in my boat engine_comma_ when my friend is helping me.
188,Actitud,excited,I really had a fun time at our county fair a couple of days ago.,I took the family to our county fair a couple of days ago.
189,Actitud,faithful,I've failed a lot of diets in the past_comma_ but this time I've been able to stay dedicated for the past four months. I'm seeing great progress now!,Yeah_comma_ that sounds like a really good idea!
190,Actitud,proud,Nephew playing football this year,That's exciting!  I hope he's doing well in school!
191,Actitud,proud,My daughter win a medal for dancing in a competition. I glad to see her as a dancer.,I'm impressed_comma_ where did she win the medal?
192,Actitud,prepared,ready to leave this hood ,That sounds like a plan.
193,Actitud,confident,I was very sure I was getting the promotion I asked for.,I knew I was going to get the promotion I was up for.
194,Actitud,hopeful,I'll be getting a raise in February.,It'll be around 25%.
195,Algoritmo,Clasificación de los algoritmos,What is the name of the paper that describes the classification of algorithms?,In this paper we describe the classification of algorithms.
196,Metadatos,Definición de metadatos,What is the definition of metadata?,Metadata is a term used in the software development industry.
197,Actitud,prepared,I had been grinding at home trying to build my website when this girl I hadn't heard from since high school called. She said she was in town and wanted to catch up.  Deciding I needed a break from work I turned off my laptop_comma_ threw on some fresh khakis and air nikes and 2 condoms just in case.  Turned out it's always better safe than sorry.,They're known to cause erectile dysfunction? There's chemicals in the laces_comma_ dude! A conspiracy I tell you! Done by OBAMA!
198,Actitud,proud,One time in welding school I got 2 of my teachers a gig with a major contractor on FT benning building ADA code railing for th new hospital and centers and stuff_comma_,One time in welding school I got 2 of my teachers a gig with a major contractor on FT Benning building ADA code railing for th new hospital and centers and stuff_comma_
199,Actitud,hopeful,It's birthday soon. I want to be a better person.,Birthday wishes come true. You will have to work at it still though.
200,Actitud,joyful,My company will give us a bonus because the quarter was good. I am happy.,I just went on a vaction with my kids. Its was so relaxing. Have fun
201,Actitud,trusting,i felt trusting when my dad and my mon care for me,Well as a fellow human being_comma_ I agree that when parents care for their children_comma_ it creates a lifelasting bond between the two parties.
202,Árbol de decisión,Definición de árbol de decisión,What is a decision tree diagram?,A decision tree diagram is a very useful tool for making decisions.
203,Smart data,Definición de smart data,What is the name of the new type of data collection system?,"The British government has announced that it will be introducing a new type of data collection system called Smart Data, which will be able to collect a lot of data in a short time, but will also be able to analyse it."
204,Sobreajuste,Definición de sobreajuste,What is the definition of sobreajuste?,A new study suggests that a neural network can be overfitted.
205,Actitud,hopeful,Before I do feel that I will not make it in life_comma_ but later I felt expectant of my future,I expected something good_comma_ that was why things are working well for me now
206,Actitud,hopeful,I am hoping the Eagles can win it all again this season!,Why do you like the eagles?
207,Actitud,faithful,I would never cheat on my wife like my brother cheated on his wife,Cheating  on your spouse is a despicable thing to do.
208,Actitud,confident,I think I did very well in my work and will have a fantastic design to show my boss! I put so much effort into this it can't possibly be bad,That is a smart move by you.
209,Actitud,prepared,I had a big presentation that I was very nervous about. Luckily_comma_ I made sure to practice and get everything together before time,I am so happy everything went well for you.
210,Actitud,hopeful,I am hoping to win the lottery this week!,I am hoping as well
211,Algoritmo,Clasificación de los algoritmos,What is one of the main functions of computer systems?,The following are some of the main functions of computer systems.
212,Actitud,excited,Gareth Bale played his best in the champion's league final. I was thrilled after I watched his game.,Have you watched champion's league final?
213,Actitud,confident,I feel I can do things on my own. I didn't always feel this way_comma_ so it's nice I am empowered now and can accomplish things on my own.,My resolve I guess? Nothing changed for the better but inside me at least I know I can do it on my own because it's 1000 times better than the alternative. I'll do whatever it takes.
214,Actitud,joyful,My best friend will come visit me on Friday_comma_ so I am feeling pretty good.,My best friend is coming to visit me this Friday.
215,Actitud,faithful,I fully trust in my intuition and dreams.  They have gotten me this far and I'm going all the way to the top,These days I'm trusting my intuition and following my gut to achieve my goals.  They've gotten me this far and haven't let me down yet
216,Saludo,Saludo,What is your name?,"My name is Sara, and what is yours?"
217,Actitud,faithful,I had a girl try to hook up with me_comma_ but i didnt do anything because I love my wife.,This attractive girl at the bar was trying to get me to go home with her the other night
218,Actitud,hopeful,I really want to win the lottery someday_comma_ maybe i will? ,That would pretty amazing. What will you do with the winning?
219,Actitud,excited,I have plans so go to the beach with my wife for a week next month.,I have plans so go to the beach with my wife for a week next month
220,Actitud,prepared,when I had my test to get a new certification at work_comma_ I felt great about it because I had workd really hard and studied.,I had my test for a new certification at work.  I really wasn't that nervous for it though.
221,Turing completo,Definición de turing completo,What was the name of Alan Turing's work?,Alan Turing was a British computer scientist who developed the complete Turing complete.
222,Big data,Uso de big data,What is the term for the collection and analysis of large amounts of data?,Big Data is the collection and analysis of large amounts of data.
223,Actitud,excited,i cant wait for next week!,What's going on next week?
224,Actitud,faithful,I love my girlfriend so much. I think im going to marry her.,Congratulations and thats OK I do that a lot too.
225,Aprendizaje por refuerzo,Ejemplos de aprendizaje por refuerzo,What is a reward for doing well?,"Researchers at the University of California, Berkeley, have developed a way to teach children to learn by giving them a reward for doing well."
226,Actitud,proud,I got all A's in my last semester.,Thanks! Yes_comma_ I think I did my best anyway.
227,Reglas de asociación,Definición de reglas de asociación,What is the definition of association rules?,In this paper we will look at the use of association rules in decision trees.
228,Actitud,hopeful,My daughter starts public school for the first time in 3 years. I think she is going to do well,My daughter starts public school for the first time in 3 years! I think she is going to do great but she's a little bit nervous.
229,Algoritmo,Características de los algoritmos,What does Jeremy Hobson look at?,"The BBC's science correspondent, Jeremy Hobson, looks at the challenges faced by researchers trying to develop algorithms for predicting the behaviour of natural disasters."
230,Internet de las Cosas (IoT),Características de Internet de las Cosas (IoT),What is the term for the Internet of Things?,The Internet of Things (IoT) is a growing trend in the technology industry.
231,Actitud,confident,I feel I can do things on my own. I didn't always feel this way_comma_ so it's nice I am empowered now and can accomplish things on my own.,My resolve I guess? Nothing changed for the better but inside me at least I know I can do it on my own because it's 1000 times better than the alternative. I'll do whatever it takes.
232,Metaverso,Ejemplo de metaverso,"What is the name of the method developed by scientists at the University of California, Los Angeles?","Scientists at the University of California, Los Angeles, have developed a way to stop people from falling ill if they get sick."
233,Actitud,confident,Going to a job interview soon and I think I got this!,It is great to be confident. I am sure you will knock the interview out of the park!
234,Actitud,trusting,I went skydiving. I had to trust in the tandem partner I had to not kill me.,That's so awesome. I don't think I would have the courage now. Will you do it again?
235,Actitud,faithful,god has done so much for me in my life. i owe everything to him,and i know he's going to come back for me and take me away from this place
236,Actitud,faithful,I was invited to church this last weekend. I went and felt very optimistic in the church.,I went to church with a friend recently.
237,Actitud,confident,My friend speaks 4 languages. I'm sure they'll get that interpreter job at the embassy.,Yea. English of course_comma_ then French_comma_ Spanisha and Chinese.
238,Actitud,hopeful,I just got a new manager at work. She is really young but seems to be full of good ideals.,I plan to steer clear. I'm going to relocate in January so I just need to lay low. I hope she does a great job.
239,Actitud,hopeful,It's birthday soon. I want to be a better person.,Birthday wishes come true. You will have to work at it still though.
240,Metadatos,Definición de metadatos,What is the definition of metadata?,Metadata is a word that has been used by many people to describe data.
241,Árbol de Merkle,Definición de árbol de Merkle,What is the definition of a hash tree?,"Hash trees are a great way to store data, but they can be a bit confusing."
242,Actitud,proud,Nephew playing football this year,That's exciting!  I hope he's doing well in school!
243,Actitud,proud,I was held my head high when my mother received her Master's Degree after getting a GED after high school.,You know she inspires me. She always reminds me of what hard work can do for you.
244,Metaverso,Ejemplo de metaverso,What is the name of the report published by the European Commission?,"The European Commission has published a report on the ""breakthrough"" technology of machine testing."
245,Actitud,excited,I've never had a lust for life like I do these days.  I literally wake up every day stoked that I'm living my dreams and can't wait to see how much money I can make,Yes you have no idea...still grinding it out everyday but it's totally worth it
246,Actitud,prepared,ready to leave this hood ,That sounds like a plan.
247,Algoritmo,Características de los algoritmos,What is a computer program that uses instructions or rules to solve problems?,An algorithm is a computer program that uses instructions or rules to solve problems.
248,Realidad aumentada,Definición de realidad aumentada,What is the definition of augmented reality?,"The BBC's technology correspondent, Chris McGrath, explains how augmented reality can be used to enhance our daily lives."
249,Realidad aumentada,Definición de realidad aumentada,What is the definition of augmented reality?,The BBC's science and technology correspondent Nick Thorpe explains how augmented reality can be used to create new forms of media.
250,Actitud,faithful,I have always  been faithful to my girlfiend of almost 3 years,So many people cheat nowadays. That's good to hear!
251,Árbol,Definición de árbol,What is the definition of a directory tree?,"A directory tree is a collection of data structures, usually consisting of a row of characters, which are arranged in a hierarchy."
252,Actitud,joyful,i got a surprise gift in the mail,one time on my birthday i never expect much to me is just a regular day _comma_ then i get a package in the mail it was copic markers my friend mailed them to me from another state i was so happy
253,Actitud,proud,One time in welding school I got 2 of my teachers a gig with a major contractor on FT benning building ADA code railing for th new hospital and centers and stuff_comma_,One time in welding school I got 2 of my teachers a gig with a major contractor on FT Benning building ADA code railing for th new hospital and centers and stuff_comma_
254,Actitud,proud,I made an amazing pizza yesterday. Iwas very proud of it.,I love pizza. Did you make it by yourself or with friends?
255,Actitud,joyful,I remember as a child when I got my Nintendo 64 how happy and excited I was. Best christmas memory I have.,Yea _comma_ I still play it sometimes for funs sake.
256,Actitud,joyful,I felt so happy seeing my high school friends last month. We were at our reunion,True! All those old memories started rushing in
257,Autoencoder,Definición de autoencoder,What is the goal of the project?,The research group in this project is developing an autoencoder for the decoding of audio signals.
258,Modelos generativos,Definición de modelos generativos,What is the name of the model we present?,We present a generative model for unsupervised learning of large-scale data sets.
259,Máquina de Turing,Definición de máquina de Turing,What is the name of the machine that is the most important in computer science?,The Turing machine and the complexity of its solutions are two of the most important topics in computer science.
260,Actitud,joyful,I felt this way after the birth of my son.,What did you name him?
261,Prolog,Definición de Prolog,What is the name of the language Vine is working on with Le Gall?,"The BBC's science correspondent, Jeremy Vine, has been working with French computer scientist and mathematician, Pierre-Yves Le Gall, to develop a language for artificial intelligence."
262,Actitud,joyful,I recently received my teaching certificate,thats so awesome good for you 
263,Actitud,prepared,Last week when I was coming back to my home_comma_ a man approached me. But_comma_ I had a gun. I felt I was ready.,I had a gun. I felt I was ready. If anything would have happened_comma_ I could have used it.
264,Ciencia de datos,Definición de ciencia de datos,What is the topic of the PhD program at the University of Bristol?,The University of Bristol is offering a PhD in data science.
265,Trabajo,Trabajo,What do you do for a living?,I am responsible for promoting learning about AI through conversations.
266,Actitud,confident,I knew it was going to be a good weekend last week. I just had a good feeling,ok
267,Actitud,excited,I'm excited for Red Dead Redemption 2 to come out.  Even though it's a couple months away,No worries_comma_ we all have our hobbies!
268,Actitud,faithful,I'm hoping I can reach diamond next season in overwatch. I've been practicing a ridiculous amount,I would say it's my favorite fps now by a mile. Cod became fecal matter 5 or 6 years ago. I'm hoping I can finally stop being a pleb and hit diamond next season
269,Subajuste,Causa de subajuste,What is the name of the condition that a 3D printer must be maintained?,We have been using a 3D printer for many years and have been finding that it is a very expensive machine to maintain.
270,Actitud,joyful,I won a year of unlimited pizza. I'm so psyched.,It will save you a lot of money too
271,Actitud,proud,I had a big final exam that I studied really hard for. I passed with an A and finished with a 4.0 for the semester. I couldnt be happier.,I did. I even ended up with a 4.0 for the whole semester. I was very happy I was able to achieve that.
272,Actitud,joyful,I was very happy to get my new job,oh wow. we're practically neighbors.
273,Actitud,confident,I remember going to State Football Championship. I told my teammates on the bus before we got off that if anybody isn't ready to leave this field with the trophy stay on the bus. The whole bus was quiet. The bus driver looked at me and said I think you guys need the listen to him he doesn't look like he's playing. We eventually won that game . ,WE won 60 - 3 
274,Actitud,proud,I got all A's in my last semester.,Thanks! Yes_comma_ I think I did my best anyway.
275,Actitud,confident,I think I can get everything I need to get accomplished before the end of summer.,What all do you have to get done?
276,Actitud,excited,I'm going to a drink and paint party tomorrow. It should be pretty fun!,Wow_comma_ that sounds like a fun and interesting time_comma_ but it sounds like there are a high chance for things to go south and be a huge mess
