,Topic,Subject,Question,Answer
136,Actitud,proud,I got all A's in my last semester.,Thanks! Yes_comma_ I think I did my best anyway.
137,Actitud,faithful,I was married to my wife for thirty years_comma_ and even though she has passed I can't bring myself to date anyone else.,Well_comma_ if that's how you feel then maybe it is best if you stay in the dugout and don't play the field. No shame in that.
138,Actitud,trusting,I have faith that I will get pregnant soon. Why is it so hard? Isn't that what a women's body is built to do?,Yeah_comma_ more people are having these issues these days. I think it may be true that someone may be poisoning us through the water and food or something! It is a scary world!
139,Actitud,faithful,I have always  been faithful to my girlfiend of almost 3 years,So many people cheat nowadays. That's good to hear!
140,Actitud,confident,My friend speaks 4 languages. I'm sure they'll get that interpreter job at the embassy.,Yea. English of course_comma_ then French_comma_ Spanisha and Chinese.
141,Actitud,joyful,Took the kiddos to the lake,That sound fun! I love to eat fresh fish!
142,Actitud,excited,I was cooking some food recently. I made a hard to make recipe and it worked!,That is trivia. When i am hyped_comma_ i cook lasagna. I know that is hard to cook_comma_ but i mastered it all on my own
143,Actitud,trusting,My co-worker is in charge of finishing up our big project. I am putting all my faith in them.,I have a co-worker putting the finishing touches on a big project and work_comma_ and I am really putting all my faith in him.
144,Actitud,trusting,When I was a little kid I used to put my faith in everybody.  I learned later on_comma_ as I matured that you can't rely on other people too much because only you know what is best for you in life while everyone else will try to use you if they see you doing too well in life,I understand. Do you like Tony Montana in the movie Scarface?
145,Algoritmo,Input del algoritmo,What is the name of the algorithm that is used to determine the results of a search?,"The internet is a huge and complex place, and the internet is a huge part of our daily lives."
146,Actitud,hopeful,I have a promotion coming up in the next few weeks. I am hopeful that I will get a raise,that's awesome! I hope you will get a promotion. what do you do for work?
147,Actitud,prepared,I have been training for months for the race.,I'm sure all the work will be worth it in the end!
148,Actitud,confident,I feel I can do things on my own. I didn't always feel this way_comma_ so it's nice I am empowered now and can accomplish things on my own.,My resolve I guess? Nothing changed for the better but inside me at least I know I can do it on my own because it's 1000 times better than the alternative. I'll do whatever it takes.
149,Actitud,hopeful,I just applied for a new job.  After the interview_comma_ I'm very optimistic that I will get the position,I do!  I'm feeling very optimistic about it
150,Actitud,proud,I made an amazing pizza yesterday. Iwas very proud of it.,I love pizza. Did you make it by yourself or with friends?
151,Actitud,proud,I was happy when my brother graduated college. I was just happy for him,I was happy when my brother finished college. He really did deserve it
152,Algoritmo,Ejemplo de algoritmo de recomendación,What is one way to get people to like your content?,"In the world of social media, recommendation algorithms are not the only way to get people to like your content."
153,Unidad de Procesamiento Gráfico (GPU),Definición de Unidad de Procesamiento Gráfico (GPU),What is the definition of a graphics processing unit?,A graphics processing unit (GPU) is a piece of computer hardware that handles computer graphics operations.
154,Modelo,Definición de modelo,What is the definition of a model?,This paper describes how to train an artificial intelligence model to predict the likelihood of a given event.
155,Máquina de Turing,Definición de máquina de Turing,What is the name of the lecture by Alan Turing?,"On the 80th anniversary of the Turing machine's creation, the University of California, Berkeley, is marking the occasion with a series of lectures by computer scientist Alan Turing, who was the man who first proposed the idea of a computer."
156,Actitud,excited,I've never had a lust for life like I do these days.  I literally wake up every day stoked that I'm living my dreams and can't wait to see how much money I can make,Yes you have no idea...still grinding it out everyday but it's totally worth it
157,Actitud,excited,I can't wait until Halloween. I love scaring the little kids who come to my house_comma_ muhahah!,Ha! I've always loved the more festive Dia de los Muertos approach to the day rather than scare or gore! What's your favorite Halloween film?
158,Actitud,faithful,god has done so much for me in my life. i owe everything to him,and i know he's going to come back for me and take me away from this place
159,Actitud,hopeful,I really want to win the lottery someday_comma_ maybe i will? ,That would pretty amazing. What will you do with the winning?
160,Actitud,proud,My school is low income_comma_ but we score in the top 5% statewide.,Yep. We get looked down on so much_comma_ but I think some schools are gonna rethink their attitudes now.
161,Actitud,prepared,Getting ready to file quarterly taxes and I have been very diligent with organization this year so I am prepared,I bought a big rubbermaid portable file box that has folders 
162,Actitud,faithful,I am very faithful to my employer.,My employer provides me with lots of training and support so I have become very faithful to them.
163,Reglas de asociación,Definición de reglas de asociación,What is the definition of association rules?,In this paper we will look at the use of association rules in decision trees.
164,Actitud,prepared,We went through hurricane irma last year. We got everything we needed and put metal shutter on all the windows and decided to stay. , i must have been terrifying_comma_ I am glad you both made it through it
165,Actitud,excited,I am super hype for the new super smash bros_comma_ it looks so so good!,It comes out in December right? It would make a good holiday present!
166,Grafo,Definición de grafo,What is the definition of grafo?,Graph theory is a branch of mathematics that deals with the relationship between data and people.
167,Actitud,joyful,I'm very proud of my daughters.,I am very proud of my daughters.
168,Actitud,confident,I remember going to State Football Championship. I told my teammates on the bus before we got off that if anybody isn't ready to leave this field with the trophy stay on the bus. The whole bus was quiet. The bus driver looked at me and said I think you guys need the listen to him he doesn't look like he's playing. We eventually won that game . ,WE won 60 - 3 
169,Autoencoder,Definición de autoencoder,What is the name of the new method developed?,A novel method for learning autoencoders has been developed.
170,Máquina de Turing,Definición de máquina de Turing,What was the name of the machine that was seen at Bletchley Park?,"The BBC's science correspondent, Jeremy Vine, has been to the World War Two code-breaking centre at Bletchley Park to see the Turing machine."
171,Árbol de decisión,Definición de árbol de decisión,What is a decision tree diagram?,A decision tree diagram is a very useful tool for making decisions.
172,Actitud,faithful,Getting married this fall,It's lovely. Be a happy couple. live long together!
173,Actitud,excited,I can't even fall asleep waiting to go on our vacation. ,Oh_comma_ well that is a fine thing indeed! I would be  jumping up and down!
174,Actitud,confident,I recently went surfing and surfed waves everyone else was afraid to. I was the man_comma_,Yes_comma_ I've been surfing for ever. Only three of us in the water. 
175,Actitud,proud,my daughter passed her drivers test on the first try,really scary.
176,Algoritmo,Clasificación de los algoritmos,What is one of the main functions of computer systems?,The following are some of the main functions of computer systems.
177,Actitud,trusting,I wanted to go out but needed someone to watch my kids. No one had ever babysat before. I let my sister watch them because I knew she would do a good job. ,Oh that's so great - and now you can feel comfortable leaving them with her more often!
178,Actitud,hopeful,I just applied for a new job.  After the interview_comma_ I'm very optimistic that I will get the position,I do!  I'm feeling very optimistic about it
179,Actitud,proud,My little boy got on the bus this morning. He made me so happy for him.,That's so sweet. 
180,Actitud,hopeful,I'll be getting a raise in February.,It'll be around 25%.
181,Ciencia de datos,Ventajas de la ciencia de datos,What is the term for the use of data to improve the way we work?,The use of data to improve the way we work has become a key factor in the success of many companies.
182,Actitud,faithful,god has done so much for me in my life. i owe everything to him,and i know he's going to come back for me and take me away from this place
183,Actitud,proud,I won a teaching award last year for my work with at-risk youth. ,It's nice to be recognized. What do you do for a living?
184,Actitud,joyful,I was pretty happy to find out I was having a girl,I had her 7 months ago
185,Variables dummy,Definición de variables dummy,What is the term for variables dummy?,"The effect of a dummy variable on the outcome of a study is discussed in the paper ""Effects of a dummy variable on a study"" by the researchers at the University of Oxford."
186,Actitud,hopeful,I'll be getting a raise in February.,It'll be around 25%.
187,Actitud,hopeful,My daughter starts public school for the first time in 3 years. I think she is going to do well,My daughter starts public school for the first time in 3 years! I think she is going to do great but she's a little bit nervous.
188,Actitud,faithful,I fully trust in my intuition and dreams.  They have gotten me this far and I'm going all the way to the top,These days I'm trusting my intuition and following my gut to achieve my goals.  They've gotten me this far and haven't let me down yet
189,Actitud,faithful,When I am in nature I feel good that this world is exactly as it should be. Everything is moving a long to Gods desires.,Why do cities make you feel that way?
190,Actitud,prepared,I've got all my fishing gear packed up. I'm ready for tomorrow morning.,I've got all my fishing gear packed up. I'm ready for tomorrow morning.
191,Actitud,faithful,I had a girl try to hook up with me_comma_ but i didnt do anything because I love my wife.,This attractive girl at the bar was trying to get me to go home with her the other night
192,Actitud,proud,My niece is visiting and we have a pool.  She has not had access to a pool for most of her childhood ad does not know how to swim.  She is figuring it out very quickly though and her confidence is increasing as her skills do.  It's very exciting to watch her skills and confidence soar and she feels it too.,My niece can't swim but has is staying with us for a bit and we have a pool.  Her skills are increasing and her confidence is soaring!
193,Actitud,proud,I won first place in the marathon last weekend. I trained hard and deserved the win,That's pretty awesome. Do you usually run marathons?
194,Actitud,excited,I'm going to building a gaming pc. This is my first time.,Wow. It can be difficult to put together but finding the parts is a lot of fun.
195,Test de Turing,Definición de test de Turing,What test did DeepMind pass?,The BBC reports that a machine called DeepMind has passed the Turing test for the first time.
196,Bot,Ejemplo de bot,What is the name of the bot used in the election?,"The United States is currently holding elections to choose a new president, and the use of bots in the campaign has been a major issue."
197,Actitud,joyful,I was very happy to get my new job,oh wow. we're practically neighbors.
198,Actitud,joyful,I am going to eat some BBQ later.  I am so happy for it.,That sounds so good and the perfect way to spend a Sunday.
199,Actitud,joyful,My dogs passed away 2 years ago. My family adopted me one this past weekend on my birthday.,My dogs passed away 2 years ago. My family adopted me one this past weekend on my birthday.
200,Actitud,excited,I'm going to a drink and paint party tomorrow. It should be pretty fun!,Wow_comma_ that sounds like a fun and interesting time_comma_ but it sounds like there are a high chance for things to go south and be a huge mess
201,Actitud,prepared,We had a big storm last summer_comma_ so this year I bought a ton of supplies in case we lost power or had flooding. Last year our basement got very damaged. ,Yeah its all repaired now. I also bought lots of food in case we loose power.
202,Subajuste,Definición de subajuste,What is the definition of a subajustment?,The failure of a system to work properly is called underfitting.
203,Trabajo,Trabajo,What do you do?,I am a chatbot to promote learning about AI
204,Blockchain,Ejemplo de blockchain,What is the name of the technology used in the banking sector?,The use of blockchain technology in the banking sector has been growing in recent years.
205,Actitud,excited,I really had a fun time at our county fair a couple of days ago.,I took the family to our county fair a couple of days ago.
206,Actitud,faithful,When my spouse was out of town for work_comma_ a friend stopped by to visit. This friend offered to kiss me_comma_ but I declined and asked the friend to leave. I only have interest in my spouse in this way.,I said no and made the friend leave. I only like my spouse.
207,Actitud,prepared,I@ve done lots of research for an interview tis week,I have an interview this week
208,Actitud,hopeful,I am hoping the Eagles can win it all again this season!,Why do you like the eagles?
209,Actitud,faithful,One day my neighbor helped me in a risky situation. So I'm loyal to their family always.,Yeah_comma_ They helped me in the risky situation when I was alone.
210,Actitud,joyful,I remember as a child when I got my Nintendo 64 how happy and excited I was. Best christmas memory I have.,Yea _comma_ I still play it sometimes for funs sake.
211,Saludo,Saludo,What's your name?,My name is Sara. What would you like to talk about?
212,Actitud,faithful,I was invited to church this last weekend. I went and felt very optimistic in the church.,I went to church with a friend recently.
213,Actitud,prepared,I went into that interviewing knowing i could answer any question they threw at me,yea im sure i'll get the job
214,Actitud,joyful,I'm pretty happy that my daughters have a day off from school today.,Well_comma_ my daughters have a day off from school due to our state elections.
215,Actitud,joyful,I'm very proud of my daughters.,I am very proud of my daughters.
216,Algoritmo,Clasificación de los algoritmos,What is the classification of data by?,In this paper we will discuss the classification of data by the following criteria:
217,Actitud,faithful,I love my girlfriend so much. I think im going to marry her.,Congratulations and thats OK I do that a lot too.
218,Actitud,confident,For some reason if I get a good pump at the gym early in the morning_comma_ I feel like I can tackle any task on my to-do list for the day.,That's awesome. do you usually exercise in the mornings?
219,Actitud,prepared,I@ve done lots of research for an interview tis week,I have an interview this week
220,Actitud,prepared,Getting ready to file quarterly taxes and I have been very diligent with organization this year so I am prepared,I bought a big rubbermaid portable file box that has folders 
221,Xenobot,Definición de xenobot,What is the name of the robot that was created from a living frog embryo?,A robot that has been designed from scratch from a living frog embryo has been unveiled at the European Society for the Study of Reproduction (ESSR) conference in Berlin.
222,Smart data,Definición de smart data,What is the term used to describe data that is ready to be used but not yet ready for use?,"The term ""smart data"" is used to describe data that is ready to be used, but which is not yet ready for use."
223,Actitud,proud,My dog learned all of his tricks!,Oh great. That is so fun . My baby died a few years ago. But he was over 14 _comma_ so. 
224,Actitud,joyful,When my first child was born I have never experienced so much happiness in my life.,Thank you! It is hard at times tho when getting little sleep.
225,Modelo,Definición de modelo,What is the goal of the project?,The aim of this project is to develop a new type of data analytics: a model.
226,Actitud,hopeful,We are wanting to buy a new house in the next year. I'm really hoping that it works out for us. We have needed something a little bigger for a while now.,Yes. I have 4 kids and we are living in a 3 bedroom and 1 bathroom right now. We definitely need another bathroom. lol
227,Metaverso,Ejemplo de metaverso,"What is the name of the method developed by scientists at the University of California, Los Angeles?","Scientists at the University of California, Los Angeles, have developed a way to stop people from falling ill if they get sick."
228,Actitud,excited,Recently we decided to rescue another kitten. We were so thrilled to be adding another furry member to our family and save a life.,That is great! Adopt_comma_ don't shop! Always a great motto!
229,Aprendizaje federado,Ejemplo de aprendizaje federado,What is the name of the project?,"Researchers at the University of California, Los Angeles, have developed a way to train artificial intelligence models that can be used in hospitals."
230,Computación Ecológica,Definición de computación Ecológica,What is the name of the initiative that promotes the use of green computing?,The World Green Computing Council (WGC) has launched a new initiative to promote the use of green computing in the world.
231,Actitud,prepared,I am all packed for my vacation.  I don't believe I have forgotten anything for the trip but you never know.,I'm leaving for my vacation soon.  I have everything all packed and ready to go.
232,Xenobot,Definición de xenobot,What is the definition of xenobot?,"Meet the Xenobots, the latest in a long line of living robots."
233,Actitud,proud,I was held my head high when my mother received her Master's Degree after getting a GED after high school.,Yes_comma_ it is great! Even better she just received her Master's Degree at the tender age of 50!
234,Actitud,trusting,I trust my wife with my life,thats a good bond how long have you been together? 
235,Actitud,trusting,I like my new manager. He is so kind and a good listener. I feel that I can trust him with any issue that I have.,I hate that too. Most of the managers are like that. They never listen and they can be rude.
236,Actitud,excited,I felt this way when my father bought me a Super Nintendo for  my 9th birthday. We were very poor so it was unexpected!,You still remember what you got for it?  It must have been memorable!  What was it?
237,Actitud,trusting,I am waiting on my friend to come over. They are bringing me a medicine for my pet.,I'm sorry. That must make you sad.
238,Actitud,hopeful,I'm trying to save up money to buy a home by next year. If all goes well It can happen.,I am so excited. I'm thinking of all the things I want to do to it and I don't even know what it looks like yet.
239,Actitud,prepared,We went through hurricane irma last year. We got everything we needed and put metal shutter on all the windows and decided to stay. , i must have been terrifying_comma_ I am glad you both made it through it
240,Bot,Definición de bot,What is the definition of a bot?,A bot is a computer program capable of performing repetitive tasks.
241,Algoritmo,Input del algoritmo,What is the name of the algoritm?,A cooking class is a chance for students to learn how to prepare a meal.
242,Actitud,joyful,Going to disney world in december!,Oh that's exciting! Have you gone before?
243,Actitud,proud,My daughter win a medal for dancing in a competition. I glad to see her as a dancer.,I'm impressed_comma_ where did she win the medal?
244,Big data,Definición de big data,What is the definition of big data?,"The term 'big data' has been around for a long time, but has now become more common."
245,Actitud,joyful,I was pretty happy to find out I was having a girl,I had her 7 months ago
246,Actitud,confident,I feel I can do things on my own. I didn't always feel this way_comma_ so it's nice I am empowered now and can accomplish things on my own.,My resolve I guess? Nothing changed for the better but inside me at least I know I can do it on my own because it's 1000 times better than the alternative. I'll do whatever it takes.
247,Blockchain,Definición de blockchain,What is the definition of blockchain?,The Blockchain technology is a new way of doing business.
248,Internet de las Cosas (IoT),Características de Internet de las Cosas (IoT),What is the term for the use of sensors and actuators in the home?,The use of sensors and actuators in the home is increasing.
249,Internet de las Cosas (IoT),Definición de Internet de las Cosas (IoT),What is the definition of the internet of things?,"The BBC's technology correspondent, Dan Biles, looks at the future of the internet of things."
250,Actitud,trusting,I can tell my best friend anything!,I usually ask her for advice and tell her embarrassing stories because she never snitches!
251,Turing completo,Definición de turing completo,What was the name of Alan Turing's work?,Alan Turing was a British computer scientist who developed the complete Turing complete.
252,Actitud,faithful,I would never cheat on my wife like my brother cheated on his wife,Cheating  on your spouse is a despicable thing to do.
253,Actitud,prepared,I had a big presentation that I was very nervous about. Luckily_comma_ I made sure to practice and get everything together before time,I am so happy everything went well for you.
254,Actitud,excited,I'm taking my kids to Six Flags this weekend! It'll be a surprise for them!,This weekend I'm taking my kids to Six Flags
255,Actitud,trusting,When I was a little kid I used to put my faith in everybody.  I learned later on_comma_ as I matured that you can't rely on other people too much because only you know what is best for you in life while everyone else will try to use you if they see you doing too well in life,I understand. Do you like Tony Montana in the movie Scarface?
256,Actitud,faithful,I've never cheated on my wife,uh oh how does Facebook help? lol
257,Ciencia de datos,Definición de ciencia de datos,What is the definition of data science?,The term data science has been used by many universities and research institutions for a long time.
258,Agente inteligente,Definición de agente inteligente,What is the definition of an intelligent agent?,Intelligent agents are the future of technology.
259,Metadatos,Definición de metadatos,What is the definition of metadata?,Metadata is a word that has been used by many people to describe data.
260,Actitud,hopeful,Before I do feel that I will not make it in life_comma_ but later I felt expectant of my future,I expected something good_comma_ that was why things are working well for me now
261,Algoritmo,Clasificación de los algoritmos,What is the name of the paper that describes the classification of algorithms?,In this paper we describe the classification of algorithms.
262,Actitud,proud,One time in welding school I got 2 of my teachers a gig with a major contractor on FT benning building ADA code railing for th new hospital and centers and stuff_comma_,One time in welding school I got 2 of my teachers a gig with a major contractor on FT Benning building ADA code railing for th new hospital and centers and stuff_comma_
263,Actitud,joyful,I am going to eat some BBQ later.  I am so happy for it.,That sounds so good and the perfect way to spend a Sunday.
264,Realidad aumentada,Definición de realidad aumentada,What is the definition of augmented reality?,"The BBC's technology correspondent, Chris McGrath, explains how augmented reality can be used to enhance our daily lives."
265,Prolog,Definición de Prolog,What is the name of the tutorial that shows you how to solve a factorial in Prolog?,"In this tutorial, I will show you how to solve a factorial in the Prolog language."
266,Actitud,hopeful,I'm going to see a film tonight and I am really crossing my fingers its good.,I think it's called the Happytime Murders. Some murder mystery/comedy with puppets.
267,Actitud,trusting,I can tell my best friend anything!,I usually ask her for advice and tell her embarrassing stories because she never snitches!
268,Actitud,trusting,I believed that my son would behave responsibly when I left him home alone for the weekend.,Wow_comma_ that would have scared me_comma_ how did it go?
269,Reglas de asociación,Definición de reglas de asociación,What is the definition of a grouping rule?,The association rule is a set of rules that govern the way items are grouped and stored.
270,Actitud,joyful,I've had family visiting for the past couple of days_comma_ some cousins and an uncle and aunt that I haven't seen a long time. It's always great to be reunited with family_comma_ especially after you get over that first initial weird social hump of feeling each other out after not having spoken for a long time. It's crazy to see how much the younger cousins have physically changed! Anyway_comma_ it's been a blast playing games and catching up with them.,wow thats great
271,Actitud,proud,Nephew playing football this year,That's exciting!  I hope he's doing well in school!
