,Topic,Subject,Question,Answer
272,Actitud,faithful,When the guy I'm now married to and I met for the first time I was actually dating someone else. I thought that my now husband would just be a really good friend to me. I stayed with my ex-boyfriend for a while after_comma_ and even when I knew I wanted to date my now husband I never did anything to betray my ex.,Well that's good. Sounds like it all worked out pretty well.
273,Actitud,hopeful,My husband and I are going to couples counseling. I am really positive that we can fix things and be happy.,Oh no. I'm sorry to hear you are going through a rough patch.
274,Actitud,faithful,I fully trust in my intuition and dreams.  They have gotten me this far and I'm going all the way to the top,These days I'm trusting my intuition and following my gut to achieve my goals.  They've gotten me this far and haven't let me down yet
275,Actitud,excited,I'm going to a drink and paint party tomorrow. It should be pretty fun!,Wow_comma_ that sounds like a fun and interesting time_comma_ but it sounds like there are a high chance for things to go south and be a huge mess
276,Actitud,joyful,My company will give us a bonus because the quarter was good. I am happy.,I just went on a vaction with my kids. Its was so relaxing. Have fun
277,Metaverso,Ejemplo de metaverso,What is the name of the report published by the European Commission?,"The European Commission has published a report on the ""breakthrough"" technology of machine testing."
278,Actitud,joyful,I am moving to new appartment. The new neighborhood is so nice. I am so happy that I found this appartment. ,That is so nice.  When do you move?
279,Actitud,prepared,Last week when I was coming back to my home_comma_ a man approached me. But_comma_ I had a gun. I felt I was ready.,I had a gun. I felt I was ready. If anything would have happened_comma_ I could have used it.
280,Actitud,confident,Going to a job interview soon and I think I got this!,It is great to be confident. I am sure you will knock the interview out of the park!
281,Actitud,hopeful,Vacation trip coming up hope it's awesome,Yeah I know!  It's going to be awesome!  Enjoy your day_comma_ friend!
282,Actitud,faithful,I've failed a lot of diets in the past_comma_ but this time I've been able to stay dedicated for the past four months. I'm seeing great progress now!,Yeah_comma_ that sounds like a really good idea!
283,Actitud,trusting,My mom said she'd go to the doctor the next time she started feeling weird heart palpitations again. I'm about a thousand miles away from her_comma_ so I can't force her to go. But I'm worried about her_comma_ as she's always avoided the doctor_comma_ and always been in poor health. Hope she does the right thing.,"Sort of.. we have a neighbor that's been by her for 10 years_comma_ and they've been friends for a long time. But she's older herself_comma_ and has her own worries_comma_ so it's not like I can put more on her plate. My mother is just stubborn. I love her to death_comma_ but she's kind of a ""What will be_comma_ will be"" type person_comma_ and just assumes life will happen and you can_comma_ nor should_comma_ do anything to get in the way of it."
284,Modelos generativos,Ejemplo de modelos generativos,What is an example of a model-based learning method?,Image-based learning is a promising new way to train computers.
285,Actitud,faithful,I have always  been faithful to my girlfiend of almost 3 years,So many people cheat nowadays. That's good to hear!
286,Internet de las Cosas (IoT),Características de Internet de las Cosas (IoT),What is the term for the Internet of Things?,The Internet of Things (IoT) is a growing trend in the technology industry.
287,Actitud,excited,i cant wait for next week!,What's going on next week?
288,Trabajo,Trabajo,What is your occupation?,I am a chatbot in charge of fostering learning about AI.
289,Actitud,confident,I know I can make a lotta money on here if I keep working.,Well keep looking something is out there for you
290,Actitud,joyful,I remember as a child when I got my Nintendo 64 how happy and excited I was. Best christmas memory I have.,Yea _comma_ I still play it sometimes for funs sake.
291,Actitud,joyful,My best friend will come visit me on Friday_comma_ so I am feeling pretty good.,My best friend is coming to visit me this Friday.
292,Actitud,proud,Nephew playing football this year,That's exciting!  I hope he's doing well in school!
293,Algoritmo,Ejemplo de algoritmo,What is the name of the algorithm used by Google?,Google has been accused of manipulating its search results to favour its own products and services over those of rivals such as Yahoo and Bing.
294,Actitud,confident,I had to take my final exam for a class last semester. I studied really hard for this exam. I went in sure that I was going to do great on it. I ended up getting the highest score in my class!,hard work pays off 
295,Algoritmo,Características de los algoritmos,What does Jeremy Hobson look at?,"The BBC's science correspondent, Jeremy Hobson, looks at the role of algorithms in computing."
296,Actitud,prepared,We had a big storm last summer_comma_ so this year I bought a ton of supplies in case we lost power or had flooding. Last year our basement got very damaged. ,Yeah its all repaired now. I also bought lots of food in case we loose power.
297,Actitud,trusting,I went skydiving. I had to trust in the tandem partner I had to not kill me.,That's so awesome. I don't think I would have the courage now. Will you do it again?
298,Actitud,joyful,Going to disney world in december!,Oh that's exciting! Have you gone before?
299,Actitud,excited,I really had a fun time at our county fair a couple of days ago.,I took the family to our county fair a couple of days ago.
300,Actitud,faithful,I love my girlfriend so much. I think im going to marry her.,Congratulations and thats OK I do that a lot too.
301,Actitud,prepared,ready to leave this hood ,That sounds like a plan.
302,Actitud,prepared,I'm looking forward to presenting to my client_comma_ I spent a lot of time on that powerpoint,I'm looking forward to presenting to my client_comma_ I spent a lot of time on that powerpoint
303,Actitud,proud,It makes me feel good when I see my friends realizing their dreams.,Some people get jealous when other people are doing well_comma_ so you are truely a good friend
304,Actitud,excited,I am super hype for the new super smash bros_comma_ it looks so so good!,It comes out in December right? It would make a good holiday present!
305,Actitud,hopeful,We are wanting to buy a new house in the next year. I'm really hoping that it works out for us. We have needed something a little bigger for a while now.,Yes. I have 4 kids and we are living in a 3 bedroom and 1 bathroom right now. We definitely need another bathroom. lol
306,Aprendizaje por refuerzo,Ejemplos de aprendizaje por refuerzo,What is a reward for doing well?,"Researchers at the University of California, Berkeley, have developed a way to teach children to learn by giving them a reward for doing well."
307,Función Hash,Definición de función hash,What is the definition of a hash function?,A hash function is a function that converts one or more input elements into another element.
308,Actitud,hopeful,I am feeling more positive about the future today. I am really trying to hold on to that feeling no matter what. It's hard!,That is good!  Why have you been feeling down about the future before?
309,Actitud,prepared,I'm spent all summer getting ready to write my thesis. I can't wait to get time to start.,I spent all summer getting ready to write my thesis. I can't wait to get time to start.
310,Actitud,prepared,I had a big presentation that I was very nervous about. Luckily_comma_ I made sure to practice and get everything together before time,I am so happy everything went well for you.
311,Actitud,prepared,I went into that interviewing knowing i could answer any question they threw at me,yea im sure i'll get the job
312,Metadatos,Definición de metadatos,What is the definition of metadata?,Metadata is a term used in the software development industry.
313,Algoritmo,Características de los algoritmos,What is a computer program that uses instructions or rules to solve problems?,An algorithm is a computer program that uses instructions or rules to solve problems.
314,Actitud,prepared,I am all packed for my vacation.  I don't believe I have forgotten anything for the trip but you never know.,I'm leaving for my vacation soon.  I have everything all packed and ready to go.
315,Actitud,prepared,It was my first time taking the DMV test. I went there rather early and aced the test.,Yes it was even though I was a bit nervous.
316,Actitud,excited,I'm excited for Red Dead Redemption 2 to come out.  Even though it's a couple months away,No worries_comma_ we all have our hobbies!
317,Actitud,excited,Gareth Bale played his best in the champion's league final. I was thrilled after I watched his game.,Have you watched champion's league final?
318,Actitud,prepared,I'm looking forward to presenting to my client_comma_ I spent a lot of time on that powerpoint,I'm looking forward to presenting to my client_comma_ I spent a lot of time on that powerpoint
319,Actitud,confident,I went in to the interview knowing that I had what it takes to land the job. I had prepared to the fullest extent and had all the skills they were looking for.,Nice! You sound like you prepared very well
320,Actitud,prepared,When I went into labor with my son_comma_ it was quite the ordeal. He was coming way too early and we had to rush to get him out. Thankfully_comma_ I had everything already packed beforehand!,Is he healthy?
321,Unidad de Procesamiento Gráfico (GPU),Definición de Unidad de Procesamiento Gráfico (GPU),What is the term for a graphics processing unit?,"GPU- accelerated computing is the use of a graphics processing unit (GPU) in conjunction with a CPU to accelerate the performance of deep learning, analytics and engineering applications."
322,Actitud,proud,I had a big final exam that I studied really hard for. I passed with an A and finished with a 4.0 for the semester. I couldnt be happier.,I did. I even ended up with a 4.0 for the whole semester. I was very happy I was able to achieve that.
323,Actitud,faithful,I would never cheat on my wife like my brother cheated on his wife,Cheating  on your spouse is a despicable thing to do.
324,Actitud,confident,Going to a job interview soon and I think I got this!,It is great to be confident. I am sure you will knock the interview out of the park!
325,Algoritmo,Características de los algoritmos,What is the idea of an algorithm?,The idea of an algorithm is to create a set of rules that can be used to solve problems.
326,Actitud,prepared,It was my first time taking the DMV test. I went there rather early and aced the test.,Yes it was even though I was a bit nervous.
327,Actitud,trusting,I was walking around SF zoo the other day and realized that animals are such genuine creature and I like them like humans_comma_,Have you ever been to the zoo just to realize that animals can be just as good as humans?
328,Árbol,Definición de árbol,What is the definition of a tree?,A tree is a structure of data that is not empty or null.
329,Actitud,faithful,I had a girl try to hook up with me_comma_ but i didnt do anything because I love my wife.,This attractive girl at the bar was trying to get me to go home with her the other night
330,Actitud,proud,My grandson just graduated high school. He was developmentally slow so we were amazed that he actaully graduated a year early!,You must be so proud. That really is a great accomplishment that he has made. Is he going to college?
331,Grafo,Definición de grafo,What is the definition of a graph?,"A graph is a representation of a system or set, by means of graphical schemes."
332,Actitud,joyful,I felt this way after the birth of my son.,What did you name him?
333,Actitud,confident,I started my driving class last week. I'll finish the class within a month and drive the car without any help of others.,Are you going to buy a car?
334,Actitud,confident,I was very sure I was getting the promotion I asked for.,I knew I was going to get the promotion I was up for.
335,Actitud,trusting,i felt trusting when my dad and my mon care for me,Well as a fellow human being_comma_ I agree that when parents care for their children_comma_ it creates a lifelasting bond between the two parties.
336,Actitud,hopeful,Nephew plays football.  I hope he does great this year!,Yeah this is true!  I'll definitely take your advice! Thank you so much!
337,Actitud,joyful,i got a surprise gift in the mail,one time on my birthday i never expect much to me is just a regular day _comma_ then i get a package in the mail it was copic markers my friend mailed them to me from another state i was so happy
338,Actitud,faithful,I've never cheated on my wife,uh oh how does Facebook help? lol
339,Actitud,joyful,i am so happy that i am going to be a grandma,Yep. Happy and healthy is a blessing
340,Actitud,joyful,I felt so happy seeing my high school friends last month. We were at our reunion,True! All those old memories started rushing in
341,Algoritmo,Características de los algoritmos,What does Jeremy Hobson look at?,"The BBC's science correspondent, Jeremy Hobson, looks at the challenges faced by researchers trying to develop algorithms for predicting the behaviour of natural disasters."
342,Actitud,proud,My dog learned all of his tricks!,Oh great. That is so fun . My baby died a few years ago. But he was over 14 _comma_ so. 
343,Ciencia de datos,Definición de ciencia de datos,What is the topic of the PhD program at the University of Bristol?,The University of Bristol is offering a PhD in data science.
344,Actitud,trusting,I was working on a boat_comma_ and I had to hope that my friend didn't screw something up while I had my hands in the engine.,Gosh I hate it when I have to work on complicated parts in my boat engine_comma_ when my friend is helping me.
345,Actitud,trusting,When my dad wanted to help me get a car_comma_ I trusted him. I knew he would help me a lot,That is nice of him_comma_ that is a good dad right there!
346,Algoritmo,Historia del algoritmo,What is the name of the film that celebrates Euclid?,"The ancient Greek mathematician Euclid is celebrated in the film The Big Bang Theory, which opens in the UK on Friday."
347,Actitud,proud,I won a teaching award last year for my work with at-risk youth. ,It's nice to be recognized. What do you do for a living?
348,Actitud,prepared,im ready for next week!,what's happening next week?
349,Aprendizaje por refuerzo,Ejemplos de aprendizaje por refuerzo,What is the name of the tool that is used to learn how to use a website?,This is a very useful tool for learning how to use a website.
350,Sugar code,Definición de sugar code,What is the definition of a sugar code?,"In this video, you will learn how to write code using sugar."
351,Actitud,faithful,I feel very committed to my work. No matter how I feel_comma_ I have to press on and complete it. It's been a rough week and my will power is very strong to still work through all this,yes. It's been a rough week and my will power is very strong to still work through all this
352,Actitud,joyful,I care a lot about all the little birds in my neighborhood. I am a sensitive soul and I just want to help every critter I see.,i dont want them to suffer either
353,Actitud,joyful,I felt this way after the birth of my son.,What did you name him?
354,Actitud,confident,I was very sure I was getting the promotion I asked for.,I knew I was going to get the promotion I was up for.
355,Actitud,trusting,i felt trusting when my dad and my mon care for me,Well as a fellow human being_comma_ I agree that when parents care for their children_comma_ it creates a lifelasting bond between the two parties.
356,Máquina de Turing,Definición de máquina de Turing,What is the name of the machine that is the most important in computer science?,The Turing machine and the complexity of its solutions are two of the most important topics in computer science.
357,Turing completo,Definición de turing completo,What is the definition of a Turing Complete system?,"In this video, mathematician and computer scientist, Dr. John-Paul Sartre, explains why a Turing Complete system is a good idea."
358,Actitud,excited,I will finally be getting a new phone soon_comma_ and I can't wait because my old one is almost dead.,I have a lot of anticipation in me right now. I will finally be able to get a new phone after all these years.
359,Aprendizaje por refuerzo,Definición de aprendizaje por refuerzo,What is the definition of reinforcement learning?,This paper describes the use of reinforcement learning in software development.
360,Blockchain,Definición de blockchain,What is the definition of blockchain?,The Blockchain Foundation is a non-profit organisation that promotes the use of Blockchain technology.
361,Actitud,confident,This is gonna be a good year at school for me. Its going to be better than all the rest!,Thats a good outlook to have! What year are you on 1st_comma_ 2nd? 
362,Blockchain,Definición de blockchain,What is the definition of blockchain?,The Blockchain Foundation is a non-profit organisation that promotes the adoption of Blockchain technology.
363,Actitud,joyful,I cant believe my daughter performed so well in the recital. She practiced so hard for it,I cant believe my daughter performed so well in the recital.
364,Actitud,hopeful,that i will find a better job ,I am staying very positive that this year even if it is coming close to an end I will find a better job! 
365,Metaverso,Definición de metaverso,What is the definition of a metaverse?,The idea of a metaverse is a new way of exploring the universe.
366,Actitud,excited,I've never had a lust for life like I do these days.  I literally wake up every day stoked that I'm living my dreams and can't wait to see how much money I can make,Yes you have no idea...still grinding it out everyday but it's totally worth it
367,Actitud,prepared,College is starting in 3 weeks_comma_ and I have my apartment all settled_comma_ my classes picked out_comma_ and my student loans scheduled. I feel like I'm on track to start the semester in a way where I'm not hurried or confused_comma_ and it feels good.,Hey... that's okay. I'm 28 and just now about to finish my 4-year degree. My brother finished his at 36. There's always a reason for the path you take. Maybe it led to better things. Don't ever just consider yourself a statistic. Good luck!
368,Actitud,confident,I knew it was going to be a good weekend last week. I just had a good feeling,ok
369,Actitud,prepared,when I had my test to get a new certification at work_comma_ I felt great about it because I had workd really hard and studied.,I had my test for a new certification at work.  I really wasn't that nervous for it though.
370,Actitud,hopeful,I just got a new manager at work. She is really young but seems to be full of good ideals.,I plan to steer clear. I'm going to relocate in January so I just need to lay low. I hope she does a great job.
371,Actitud,confident,For some reason if I get a good pump at the gym early in the morning_comma_ I feel like I can tackle any task on my to-do list for the day.,That's awesome. do you usually exercise in the mornings?
372,Actitud,excited,I am going to meet up with a special friend I haven't seen for  years,That's pretty cool. I don't see my friends much since I moved.
373,Realidad aumentada,Definición de realidad aumentada,What is the definition of augmented reality?,The Augmented Reality Association (ARA) is a non-profit organisation that promotes the use of augmented reality in the hospitality industry.
374,Algoritmo,Definición de agente inteligente,What is the term for an algorithm?,"The term algorithm is a description of a set of rules that allows a problem to be solved, in a certain way, by means of systematic (not necessarily ordered) and finite operations."
375,Actitud,faithful,I was invited to church this last weekend. I went and felt very optimistic in the church.,I went to church with a friend recently.
376,Actitud,prepared,I am having some financial issues. I am selling almost everything before the bailiff come.,I am having some financial issues. I am selling almost everything before the bailiff come.
377,Árbol de Merkle,Definición de árbol de Merkle,What is the definition of a hash tree?,"Hash trees are a great way to store data, but they can be a bit confusing."
378,Actitud,confident,I want to lose weight and i'm sure i can do it,You can. It will take some persistence. How's it going so far?
379,Actitud,faithful,Some one owed me some money,I thought he would not pay back after a long time
380,Actitud,excited,I finally thought my dog how to sit and give me her paw. I felt very accomplished and happy!,I finally thought my dog how to sit and give me her paw. I felt very accomplished and happy!
381,Actitud,joyful,I care a lot about all the little birds in my neighborhood. I am a sensitive soul and I just want to help every critter I see.,i dont want them to suffer either
