,Topic,Subject,Question,Answer
0,Actitud,proud,I won first place in the marathon last weekend. I trained hard and deserved the win,That's pretty awesome. Do you usually run marathons?
1,Actitud,joyful,I am moving to new appartment. The new neighborhood is so nice. I am so happy that I found this appartment. ,That is so nice.  When do you move?
2,Blockchain,Definición de blockchain,What is the definition of blockchain?,The Blockchain Foundation is a non-profit organisation that promotes the adoption of Blockchain technology.
3,Árbol de decisión,Definición de árbol de decisión,What is the name of the prediction model used in artificial intelligence?,"A decision tree is a prediction model used in many fields including artificial intelligence, economics and computer science."
4,Actitud,confident,This is gonna be a good year at school for me. Its going to be better than all the rest!,Thats a good outlook to have! What year are you on 1st_comma_ 2nd? 
5,Actitud,joyful,I am going to eat some BBQ later.  I am so happy for it.,That sounds so good and the perfect way to spend a Sunday.
6,Actitud,trusting,I like my new manager. He is so kind and a good listener. I feel that I can trust him with any issue that I have.,I hate that too. Most of the managers are like that. They never listen and they can be rude.
7,Actitud,excited,My brother and a bunch of our friends planned to go to a 15-person cottage in July. I could not wait for all the fun and games we would experience!,It's very close to a lake_comma_ it probably takes a two minute hike down through a patch of trees and tall grass to get there.
8,Algoritmo,Características de los algoritmos,What does Jeremy Hobson look at?,"The BBC's science correspondent, Jeremy Hobson, looks at the role of algorithms in computing."
9,Actitud,excited,I can't wait until Halloween. I love scaring the little kids who come to my house_comma_ muhahah!,Ha! I've always loved the more festive Dia de los Muertos approach to the day rather than scare or gore! What's your favorite Halloween film?
10,Actitud,faithful,When the guy I'm now married to and I met for the first time I was actually dating someone else. I thought that my now husband would just be a really good friend to me. I stayed with my ex-boyfriend for a while after_comma_ and even when I knew I wanted to date my now husband I never did anything to betray my ex.,Well that's good. Sounds like it all worked out pretty well.
11,Actitud,proud,My brother is getting married. I am so happy for him,I am not_comma_ I did not want to jinx it
12,Actitud,excited,I have plans so go to the beach with my wife for a week next month.,I have plans so go to the beach with my wife for a week next month
13,Actitud,excited,I am super hype for the new super smash bros_comma_ it looks so so good!,It comes out in December right? It would make a good holiday present!
14,Actitud,proud,I won a teaching award last year for my work with at-risk youth. ,It's nice to be recognized. What do you do for a living?
15,Actitud,faithful,3,A key to a long relationship is persistence_comma_ so keep at it! 
16,Actitud,hopeful,I just applied for a new job.  After the interview_comma_ I'm very optimistic that I will get the position,I do!  I'm feeling very optimistic about it
17,Actitud,trusting,The first time I went on a motorcycle_comma_ I was scared. But I knew my husband wouldn't do anything to hurt me. I trusted him with my life.,It must be nice to have that kind of trust for someone_comma_ and motorcycles can be fun!
18,Actitud,confident,I have my physics test tomorrow that I have been studying 10 days for_comma_ Never felt so ready in my life.,I have a physics test tomorrow. I think I can say that after 10 days of nonstop studying and copious amounts of adderall_comma_ I am finally ready.
19,Actitud,faithful,I was married to my wife for thirty years_comma_ and even though she has passed I can't bring myself to date anyone else.,Well_comma_ if that's how you feel then maybe it is best if you stay in the dugout and don't play the field. No shame in that.
20,Actitud,hopeful,I borrowed some money from my friend. I've a confidence I'll repay this month to him.,What a good friend to lend you money in your time of need. You should thank him and take him to dinner after everything is sorted.
21,Actitud,faithful,I was married to my wife for thirty years_comma_ and even though she has passed I can't bring myself to date anyone else.,Well_comma_ if that's how you feel then maybe it is best if you stay in the dugout and don't play the field. No shame in that.
22,Actitud,trusting,I am waiting on my friend to come over. They are bringing me a medicine for my pet.,I'm sorry. That must make you sad.
23,Sugar code,Definición de sugar code,What is the definition of a sugar code?,"In this video, you will learn how to write code using sugar."
24,Actitud,excited,I will finally be getting a new phone soon_comma_ and I can't wait because my old one is almost dead.,I have a lot of anticipation in me right now. I will finally be able to get a new phone after all these years.
25,Actitud,confident,I recently went surfing and surfed waves everyone else was afraid to. I was the man_comma_,Yes_comma_ I've been surfing for ever. Only three of us in the water. 
26,Actitud,excited,I felt this way when my father bought me a Super Nintendo for  my 9th birthday. We were very poor so it was unexpected!,You still remember what you got for it?  It must have been memorable!  What was it?
27,Actitud,hopeful,I am hoping to win the lottery this week!,I am hoping as well
28,Algoritmo,Características de los algoritmos,What is the idea of an algorithm?,The idea of an algorithm is to create a set of rules that can be used to solve problems.
29,Actitud,prepared,I went into that interviewing knowing i could answer any question they threw at me,yea im sure i'll get the job
30,Actitud,prepared,I've got all my fishing gear packed up. I'm ready for tomorrow morning.,I've got all my fishing gear packed up. I'm ready for tomorrow morning.
31,Internet de las Cosas (IoT),Definición de Internet de las Cosas (IoT),What is the definition of the internet of things?,"The BBC's technology correspondent, Dan Biles, looks at the future of the internet of things."
32,Realidad aumentada,Definición de realidad aumentada,What is the definition of augmented reality?,The Augmented Reality Association (ARA) is a non-profit organisation that promotes the use of augmented reality in the hospitality industry.
33,Actitud,trusting,When my dad wanted to help me get a car_comma_ I trusted him. I knew he would help me a lot,That is nice of him_comma_ that is a good dad right there!
34,Actitud,prepared,It was my first time taking the DMV test. I went there rather early and aced the test.,Yes it was even though I was a bit nervous.
35,Actitud,trusting,My daughter has grown up so much. She is finally able tobabysit her younger siblings,my daughter has matured so well
36,Actitud,excited,I can't even fall asleep waiting to go on our vacation. ,Oh_comma_ well that is a fine thing indeed! I would be  jumping up and down!
37,Actitud,hopeful,that i will find a better job ,I am staying very positive that this year even if it is coming close to an end I will find a better job! 
38,Actitud,trusting,I went skydiving. I had to trust in the tandem partner I had to not kill me.,That's so awesome. I don't think I would have the courage now. Will you do it again?
39,Actitud,faithful,When my spouse was out of town for work_comma_ a friend stopped by to visit. This friend offered to kiss me_comma_ but I declined and asked the friend to leave. I only have interest in my spouse in this way.,I said no and made the friend leave. I only like my spouse.
40,Ciencia de datos,Ejemplo de ciencia de datos,What is the main focus of the NCA's new approach?,"The UK's National Crime Agency (NCA) has developed a new approach to identifying cyber threats, using machine learning to identify patterns in data."
41,Unidad de Procesamiento Gráfico (GPU),Definición de Unidad de Procesamiento Gráfico (GPU),What is the name of the computer chip that is used for computing?,The GPU is a type of computer chip that is used for computing.
42,Actitud,proud,I was held my head high when my mother received her Master's Degree after getting a GED after high school.,Yes_comma_ it is great! Even better she just received her Master's Degree at the tender age of 50!
43,Actitud,joyful,I was pretty happy to find out I was having a girl,I had her 7 months ago
44,Big data,Definición de big data,What is the definition of big data?,"The term 'big data' has been around for a long time, but has now become more common."
45,Actitud,excited,I am super hype for the new super smash bros_comma_ it looks so so good!,It comes out in December right? It would make a good holiday present!
46,Actitud,trusting,I have faith that I will get pregnant soon. Why is it so hard? Isn't that what a women's body is built to do?,Yeah_comma_ more people are having these issues these days. I think it may be true that someone may be poisoning us through the water and food or something! It is a scary world!
47,Metaverso,Definición de metaverso,What is the definition of metaverso?,"The Metaverse is a new technology developed by the University of California, Los Angeles (UCLA)."
48,Actitud,trusting,I was walking around SF zoo the other day and realized that animals are such genuine creature and I like them like humans_comma_,Have you ever been to the zoo just to realize that animals can be just as good as humans?
49,Actitud,trusting,If I'm going to be in a relationship I need girl I can depend on_comma_ not some effed up crazy damaged goods type of girl,Yes_comma_ glad you agree....I was an idiot and mistook a deadly combo of pity and infatuation for love...but now I know what to avoid and what I want so I'm thankful
50,Internet de las Cosas (IoT),Ejemplo de Internet de las Cosas (IoT),What is the name of the internet?,"A new type of shoe is being developed by the University of California, Berkeley."
51,Actitud,faithful,i have faith my brother will do alright,Well at least you were able to introduce him to your friend. I hope everything works out for him!
52,Actitud,prepared,I had a big presentation that I was very nervous about. Luckily_comma_ I made sure to practice and get everything together before time,I am so happy everything went well for you.
53,Internet de las Cosas (IoT),Características de Internet de las Cosas (IoT),What is the term for the use of sensors and actuators in the home?,The use of sensors and actuators in the home is increasing.
54,Actitud,confident,My friend speaks 4 languages. I'm sure they'll get that interpreter job at the embassy.,Yea. English of course_comma_ then French_comma_ Spanisha and Chinese.
55,Actitud,confident,I am as sure as the sun will rise tomorrow that I will get this job promotion!,Thank you! I have worked so hard for so many years and finally it shows that someone paid attention. :)
56,Actitud,confident,I was very sure I was getting the promotion I asked for.,I knew I was going to get the promotion I was up for.
57,Actitud,joyful,i am so happy that i am going to be a grandma,Yep. Happy and healthy is a blessing
58,Variables dummy,Definición de variables dummy,What is the definition of a variable dummy?,This article will show you how to create a dummy variable in Python.
59,Modelo,Definición de modelo,What is the definition of a model?,This paper describes how to train an artificial intelligence model to predict the likelihood of a given event.
60,Modelos generativos,Ejemplo de modelos generativos,What is an example of a model-based learning method?,Image-based learning is a promising new way to train computers.
61,Tabla Hash,Definición de tabla hash,What is the definition of tabla hash?,A hash table is a data structure that associates keys or keys with values.
62,Actitud,joyful,I'm pretty happy that my daughters have a day off from school today.,Well_comma_ my daughters have a day off from school due to our state elections.
63,Smart data,Definición de smart data,What is the term used to describe data that is ready to be used but not yet ready for use?,"The term ""smart data"" is used to describe data that is ready to be used, but which is not yet ready for use."
64,Actitud,proud,My dog learned all of his tricks!,Oh great. That is so fun . My baby died a few years ago. But he was over 14 _comma_ so. 
65,Actitud,confident,I started my driving class last week. I'll finish the class within a month and drive the car without any help of others.,Are you going to buy a car?
66,Actitud,confident,For some reason if I get a good pump at the gym early in the morning_comma_ I feel like I can tackle any task on my to-do list for the day.,That's awesome. do you usually exercise in the mornings?
67,Actitud,confident,i went in knowing i was going to do great on that test,Awesome! So happy for you my friend
68,Actitud,hopeful,I'm going to see a film tonight and I am really crossing my fingers its good.,I think it's called the Happytime Murders. Some murder mystery/comedy with puppets.
69,Actitud,proud,I won first place in the marathon last weekend. I trained hard and deserved the win,That's pretty awesome. Do you usually run marathons?
70,Grafo,Definición de grafo,What is the definition of a graph?,"A graph is a representation of a system or set, by means of graphical schemes."
71,Actitud,faithful,Getting married this fall,It's lovely. Be a happy couple. live long together!
72,Actitud,hopeful,I am confident my brother will beat his cancer.,I am confident my brother will beat this cancer.
73,Actitud,hopeful,I'm trying to save up money to buy a home by next year. If all goes well It can happen.,I am so excited. I'm thinking of all the things I want to do to it and I don't even know what it looks like yet.
74,Actitud,prepared,We went through hurricane irma last year. We got everything we needed and put metal shutter on all the windows and decided to stay. , i must have been terrifying_comma_ I am glad you both made it through it
75,Actitud,confident,I went in to the interview knowing that I had what it takes to land the job. I had prepared to the fullest extent and had all the skills they were looking for.,Nice! You sound like you prepared very well
76,Ciencia de datos,Ventajas de la ciencia de datos,What is the term for the use of data to improve the way we work?,The use of data to improve the way we work has become a key factor in the success of many companies.
77,Actitud,prepared,We had a big storm last summer_comma_ so this year I bought a ton of supplies in case we lost power or had flooding. Last year our basement got very damaged. ,Yeah its all repaired now. I also bought lots of food in case we loose power.
78,Actitud,excited,I'm going to building a gaming pc. This is my first time.,Wow. It can be difficult to put together but finding the parts is a lot of fun.
79,Actitud,excited,I'm taking my kids to Six Flags this weekend! It'll be a surprise for them!,This weekend I'm taking my kids to Six Flags
80,Xenobot,Definición de xenobot,What is the name of the robot that was created from a living frog embryo?,A robot that has been designed from scratch from a living frog embryo has been unveiled at the European Society for the Study of Reproduction (ESSR) conference in Berlin.
81,Actitud,prepared,I have been training for months for the race.,I'm sure all the work will be worth it in the end!
82,Actitud,prepared,Last week when I was coming back to my home_comma_ a man approached me. But_comma_ I had a gun. I felt I was ready.,I had a gun. I felt I was ready. If anything would have happened_comma_ I could have used it.
83,Actitud,confident,I have to make a tuna casserole for tomorrow.  I am sure I can do it well.,I bet it will be great - I've always loved a good tuna casserole!
84,Actitud,prepared,I think I got everything I need for my job interview tomorrow. I got my fancy clothes and answers prepared for common questions they usually throw at u.,I think I got everything I need for my job interview tomorrow. I got my fancy clothes and answers prepared for common questions they usually throw at u.
85,Actitud,confident,Going to a job interview soon and I think I got this!,It is great to be confident. I am sure you will knock the interview out of the park!
86,Actitud,prepared,It was my first time taking the DMV test. I went there rather early and aced the test.,Yes it was even though I was a bit nervous.
87,Tabla Hash,Definición de tabla hash,What is the definition of tabla hash?,Hash tables are a popular way to store large amounts of data.
88,Actitud,prepared,I am all packed for my vacation.  I don't believe I have forgotten anything for the trip but you never know.,I'm leaving for my vacation soon.  I have everything all packed and ready to go.
89,Actitud,excited,Just got a house for 10k. It's really broken down_comma_ but I hope it'll be nice after we fix it up.,thats cool.  i hope it works out for you
90,Actitud,trusting,When I had many problems or I was sad_comma_ I knew God was with me and the things were going to improve.,Can you facetime them?
91,Modelo,Definición de modelo,What is the definition of a model?,AI is a branch of science that aims to improve the way we think about and use data.
92,Actitud,joyful,My dogs passed away 2 years ago. My family adopted me one this past weekend on my birthday.,My dogs passed away 2 years ago. My family adopted me one this past weekend on my birthday.
93,Algoritmo,Ejemplo de algoritmo,What is the name of the algorithm used by Google?,Google has been accused of manipulating its search results to favour its own products and services over those of rivals such as Yahoo and Bing.
94,Actitud,excited,I really had a fun time at our county fair a couple of days ago.,I took the family to our county fair a couple of days ago.
95,Actitud,hopeful,My husband and I are going to couples counseling. I am really positive that we can fix things and be happy.,Oh no. I'm sorry to hear you are going through a rough patch.
96,Actitud,joyful,I'm very proud of my daughters.,I am very proud of my daughters.
97,Actitud,hopeful,Before I do feel that I will not make it in life_comma_ but later I felt expectant of my future,I expected something good_comma_ that was why things are working well for me now
98,Actitud,prepared,I've got all my fishing gear packed up. I'm ready for tomorrow morning.,I've got all my fishing gear packed up. I'm ready for tomorrow morning.
99,Reglas de asociación,Definición de reglas de asociación,What is the definition of a grouping rule?,The association rule is a set of rules that govern the way items are grouped and stored.
100,Actitud,proud,My dog learned all of his tricks!,Oh great. That is so fun . My baby died a few years ago. But he was over 14 _comma_ so. 
101,Actitud,hopeful,We are wanting to buy a new house in the next year. I'm really hoping that it works out for us. We have needed something a little bigger for a while now.,Yes. I have 4 kids and we are living in a 3 bedroom and 1 bathroom right now. We definitely need another bathroom. lol
102,Actitud,excited,I was so thrilled to get concert tickets for a surprise show. It will be so fun!,The Strokes are playing this show on the fly in a month. It's so cool!
103,Actitud,faithful,I love my girlfriend so much. I think im going to marry her.,Congratulations and thats OK I do that a lot too.
104,Modelo,Definición de modelo,What is the goal of the project?,The aim of this project is to develop a new type of data analytics: a model.
105,Actitud,confident,I recently decided to start blogging again and feel pretty good about it. I used to have a decent sized audience_comma_ so hopefully I can build it back up.,I'm sure if you can let people know that you're back blogging_comma_ they'd come back to see what you're up to now!  What do you blog about?
106,Actitud,confident,I'm about to ask someone that I like out on a date. I'm pretty confident that she will say yes.,So there's a girl that I've been talking to lately... I'm thinking about asking her out.
107,Actitud,joyful,My company will give us a bonus because the quarter was good. I am happy.,I just went on a vaction with my kids. Its was so relaxing. Have fun
108,Actitud,proud,My son just graduated from college. I cannot believe how fast time went.,Awesome. That is a huge accomplishment.
109,Actitud,trusting,My co-worker is in charge of finishing up our big project. I am putting all my faith in them.,I have a co-worker putting the finishing touches on a big project and work_comma_ and I am really putting all my faith in him.
110,Actitud,trusting,I trust my wife with my life,thats a good bond how long have you been together? 
111,Función Hash,Definición de función hash,What is the definition of a hash function?,A hash function is a function that converts one or more input elements into another element.
112,Metaverso,Definición de metaverso,What is the definition of a metaverse?,The idea of a metaverse is a new way of exploring the universe.
113,Actitud,prepared,I knew I was going to pass my drivers test. I just knew I would do well,I knew I was going to pass my drivers test. I knew I would do well
114,Actitud,excited,I am going to meet up with a special friend I haven't seen for  years,That's pretty cool. I don't see my friends much since I moved.
115,Algoritmo,Input del algoritmo,What is the name of the algorithm that is used to determine the results of a search?,"The internet is a huge and complex place, and the internet is a huge part of our daily lives."
116,Aprendizaje por refuerzo,Ejemplos de aprendizaje por refuerzo,What is the name of the tool that is used to learn how to use a website?,This is a very useful tool for learning how to use a website.
117,Actitud,excited,I can't even fall asleep waiting to go on our vacation. ,Oh_comma_ well that is a fine thing indeed! I would be  jumping up and down!
118,Turing completo,Definición de turing completo,What is the definition of a Turing Complete system?,"In this video, mathematician and computer scientist, Dr. John-Paul Sartre, explains why a Turing Complete system is a good idea."
119,Actitud,faithful,I feel very committed to my work. No matter how I feel_comma_ I have to press on and complete it. It's been a rough week and my will power is very strong to still work through all this,yes. It's been a rough week and my will power is very strong to still work through all this
120,Actitud,hopeful,I am feeling this way in hopes that I get into grad school.,I really hope I get accepted into grad school.
121,Actitud,confident,I want to lose weight and i'm sure i can do it,You can. It will take some persistence. How's it going so far?
122,Algoritmo,Clasificación de los algoritmos,What is the classification of data by?,In this paper we will discuss the classification of data by the following criteria:
123,Actitud,trusting,Once I was working on a big project with a bunch of people and made a mistake. One of the other people working on the project covered for me even though they didn't need to. ,did it boost your confidence and faith in mankind?
124,Actitud,joyful,I felt this way after the birth of my son.,What did you name him?
125,Actitud,excited,I am so full of anticipation!  School starts on Monday!,that's a long time. You should be used to it
126,Actitud,trusting,I can tell my best friend anything!,I usually ask her for advice and tell her embarrassing stories because she never snitches!
127,Actitud,prepared,I@ve done lots of research for an interview tis week,I have an interview this week
128,Actitud,proud,I won a teaching award last year for my work with at-risk youth. ,It's nice to be recognized. What do you do for a living?
129,Actitud,trusting,My co-worker is in charge of finishing up our big project. I am putting all my faith in them.,I have a co-worker putting the finishing touches on a big project and work_comma_ and I am really putting all my faith in him.
130,Actitud,proud,It makes me feel good when I see my friends realizing their dreams.,Some people get jealous when other people are doing well_comma_ so you are truely a good friend
131,Actitud,faithful,Some one owed me some money,I thought he would not pay back after a long time
132,Aprendizaje automático,Definición de aprendizaje automático,What does Sue Perkins explain about machine learning?,"The BBC's artificial intelligence expert, Sue Perkins, explains how machine learning works."
133,Actitud,prepared,I went into that interviewing knowing i could answer any question they threw at me,yea im sure i'll get the job
134,Actitud,excited,I will finally be getting a new phone soon_comma_ and I can't wait because my old one is almost dead.,I have a lot of anticipation in me right now. I will finally be able to get a new phone after all these years.
135,Trabajo,Trabajo,What do you do?,I am a chatbot to promote learning about AI
136,Actitud,excited,I am going to meet up with a special friend I haven't seen for  years,That's pretty cool. I don't see my friends much since I moved.
137,Actitud,faithful,I am very faithful to my employer.,My employer provides me with lots of training and support so I have become very faithful to them.
138,Aprendizaje por refuerzo,Definición de aprendizaje por refuerzo,What is the name of the new type of machine learning?,The research group at the University of Bristol has developed a new type of machine learning called reinforcement learning.
139,Actitud,joyful,i am so happy that i am going to be a grandma,Yep. Happy and healthy is a blessing
140,Actitud,trusting,I was working on a boat_comma_ and I had to hope that my friend didn't screw something up while I had my hands in the engine.,Gosh I hate it when I have to work on complicated parts in my boat engine_comma_ when my friend is helping me.
