,Topic,Question,Answer
255,Overadjustment,Researchers at MIT have found a way to overcome what problem of artificial intelligence models?,"Researchers at the Massachusetts Institute of Technology (MIT) have found a way to overcome the problem of ""overfitting"" of artificial intelligence models."
256,Turing Machine,"In our series of letters from Italian scientists, what are some of the most interesting machines?","In our series of letters from Italian scientists, we look at some of the most interesting Turing machines."
257,Grapho,What branch of mathematics deals with the structure of data?,Graph theory is a branch of mathematics that deals with the structure of data.
258,Subadjustment,What is the term for a problem that you don't know what to do about?,"If you’re working on a machine learning algorithm, you may have encountered a problem that you don’t know what to do about."
259,Turing Test,What test has DeepMind passed?,An artificial intelligence system called DeepMind has passed the Turing Test for the first time.
260,Smart agent.,There are many different types of what type of agent?,"There are many different types of intelligent agents, but they all have one thing in common - they all have one thing in common: they all have one thing in common - they all have one thing in common - they all have one thing in common - they all have one thing in common - they all have one"
261,Overadjustment,"What is the term for a neural network being ""overfitted"" to a set of examples?","Researchers at the Massachusetts Institute of Technology (MIT) have shown that a neural network can be ""overfitted"" to a set of examples."
262,Turing Test,What test did DeepMind pass for the first time?,"An artificial intelligence system called DeepMind has passed the Turing Test for the first time, the BBC reports."
263,Green computing,What has Research and Markets added to their offering?,"Research and Markets (http://www.researchandmarkets.com/reports/global-green-computing) has announced the addition of the ""Green Computing - Research and Markets"" report to their offering."
264,Autoencoder,What is the name of the type of artificial neural network?,Autoencoders are a particular type of artificial neural network that is divided into two part: the encoder and the decoder.
265,Smart agent.,There are many different types of what type of agent?,"There are many different types of intelligent agents, but they all have one thing in common - they all have one thing in common - they all have one thing in common - they all have one thing in common - they all all have one thing in common - they all have one thing in common - they all have"
266,Overadjustment,Researchers at MIT have found a way to overcome the problem of what?,"Researchers at the Massachusetts Institute of Technology (MIT) have found a way to overcome the problem of ""overfitting"" in machine learning."
267,Autoencoder,What is a type of artificial neural network used to learn the encodings of unlabelled data?,Autoencoders are a type of artificial neural network that are used to learn the encodings of unlabelled data.
268,Länder learning,"Federated Learning is a technique that allows you to train an algorithm in a way, using your own data.","Federated Learning is a technique that allows you to train an algorithm in a way, using your own data."
269,Subadjustment,What is a problem you might have with a machine learning algorithm?,"If you’re working on a machine learning algorithm, there’s a problem you might have."
270,Green computing,Research and Markets has added what report to their offering?,"Research and Markets (http://www.researchandmarkets.com/reports/global-green-computing) has announced the addition of the ""Green Computing"" report to their offering."
271,Green computing,What has Research and Markets added to their report?,"Research and Markets (http://www.researchandmarkets.com/reports/global-green-computing) has announced the addition of the ""Green Computing - Research and Markets"" report to their offering."
272,Variables dummy,What is a Variable called that is created when the original Variable cannot be used?,A Dummy Variable is a variable that is created when the original Variable cannot be used.
273,Full Turing,Ahmedou Ould-Abdallah looks at what type of system?,"In our series of letters from African journalists, film-maker and columnist Ahmedou Ould-Abdallah looks at some of the most famous Full Turing systems of modern times."
274,Overadjustment,Researchers at the Massachusetts Institute of Technology have found a way to overcome the problem of what?,"Researchers at the Massachusetts Institute of Technology (MIT) have found a way to overcome the problem of ""overfitting"" in artificial intelligence."
275,IoT,What does Ahmedou Ould-Abdallah call the internet of things?,"In our series of letters from African journalists, filmmaker and columnist Ahmedou Ould-Abdallah looks at how the internet of things (IoT) could change the way we live and work."
276,Hash function,What transforms a data set into a fixed-length numerical code?,A Hash Function is a mathematical function that transforms a data set into a fixed-length numerical code.
277,Autoencoder,What type of neural network is used to learn efficient encodings of unlabelled data?,Autoencoders are a type of artificial neural network that are used to learn efficient encodings of unlabelled data.
278,Prolog,"In this tutorial, you will learn how to use which language to write complex code?","In this tutorial, you will learn how to use the Prolog language to write complex code."
279,IoT,What is the internet of things?,"In our series of letters from African journalists, filmmaker and columnist Ahmedou Ould-Abdallah looks at how the internet of things (IoT) is changing our lives."
280,Xenobot,"What is the name of the living robot created at the University of California, Los Angeles?","Scientists at the University of California, Los Angeles, have created a new type of living robot called a Xenobot."
281,Green computing,What type of report did Research and Markets add to their offering?,"Research and Markets has announced the addition of the ""Green Computing"" report to their offering."
282,Algorithm,What is an example of how to make croquettes?,"An example of algorithm to make croquettes is the following: Step 1: Chop the ham into small pieces, Step 2: Put in a pan a little butter, a tablespoon of flour..."
283,Big data,Ahmed Rashid looks at what revolution in business?,"In our series of letters from African journalists, film-maker and columnist Ahmed Rashid looks at the big data revolution and how it is changing the way we do business."
284,Data science,What subject has the number of students studying increased in the past five years?,The number of students studying Data Science has increased significantly over the past five years.
285,Smart data,Big data and what other type of data can be used interchangeably?,"There are two main types of data: smart data and big data, both of which can be used interchangeably."
286,Tree,In this course we will learn how to use what to solve computer science problems?,In this course we are going to learn how to use a tree to solve some common problems in computer science.
287,Metaverse,What does a metaverse stand for?,"You may have heard of a metaverse, but what is it and what does it mean?"
288,Länder learning,What type of machine learning technique is Federated Learning?,"Federated Learning is a machine learning technique that allows you to train an algorithm in a way, using your own data."
289,Smart data,What type of data is big data?,There are two types of data: smart data and big data.
290,Subadjustment,What is the term for a subadjustment of a machine learning algorithm?,"If you’re working on a machine learning algorithm, you may have encountered a problem that you don’t know what to do with."
291,Sugar code,What is the name of the technique used in this tutorial?,"In this tutorial, we are going to learn how to write code using the Sugar Coding technique."
292,Metaverse,Scientists at MIT are working on a way to create what?,Scientists at the Massachusetts Institute of Technology (MIT) are working on a way to create metaverses.
293,Metaverse,What does virtual reality stand for?,"You may have heard of metaverses, or virtual reality."
294,Overadjustment,"Researchers at MIT have shown that a neural network can be ""overfitted"" to a set of examples?","Researchers at the Massachusetts Institute of Technology (MIT) have shown that a neural network can be ""overfitted"" to a set of examples."
295,Turing Machine,"Along with Turin machines, what type of machine was used by Italian researchers?","In our series of letters from Italian scientists, we look at some of the most important contributions made by Italian researchers to the field of artificial intelligence through the use of Turing Machines and Turin machines."
296,Generational models,What type of models can discriminate between fiction and reality?,In this paper we show how to train generative models that can discriminate between reality and fiction.
297,Augmented reality,What does AR stand for?,Augmented Reality (AR) and Virtual Reality (VR) are two of the most popular technologies in the world of technology.
298,Sugar code,"In this tutorial, we are going to learn how to write code using what?","In this tutorial, we are going to learn how to write code using the Sugar Coding."
299,Rules of association,What are a set of rules that can be used to classify data?,The association rules are a set of rules that can be used to classify data sets.
300,Blockchain,What could be used to make bank transfers without a central computer?,"If we talk about bank transfers, these could be done without the need for a centralized computer (a bank)."
301,GPU,What are general purpose graphics cards called?,Graphic cards that are used foranything other than graphical processing are called GP-GPUs or general purpose GPUs.
302,Turing Machine,What is one of the most important contributions made by Italian scientists to the field of Artificial Intelligence?,"In our series of letters from Italian scientists, we look at some of the most important contributions made by Italian researchers to the field of artificial intelligence."
303,Hash function,What is a mathematical function that transforms a data set into a fixed length numerical code?,A Hash Function is a mathematical function that transforms a data set into a fixed-length numerical code.
304,Smart data,"Along with big data, what type of data can be used interchangeably?","There are two main types of data: smart data and big data, both of which can be used interchangeably."
305,Subadjustment,What is the term for a subadjustment?,"If you’re working on a machine learning algorithm, there’s a problem you may have."
306,Bot,What is a computer program that performs repetitive tasks on the internet called?,"A bot is a computer program capable of performing repetitive tasks and usually operates on the Internet and simulates the behavior that a person would have, doing the same but automatically."
307,Turing Test,What does Ahmedou Ould-Abdallah consider in his letters?,"In our series of letters from African journalists, film-maker and columnist Ahmedou Ould-Abdallah considers the Turing Test."
308,Smart data,"Along with big data, what type of data is there?",There are two main types of data: smart data and big data.
309,Merkle Tree,What is another name for a Hash Tree?,A Hash Tree or Merkle Tree is a tree-type data structure in which: A) Each leaf node is with the result of applying a Hash to the data corresponding to that sheet A) Each internal node is with the result of applying a Hash Function to the concatenation of the tags of its descendants A
310,Algorithm,What is used to make croquettes?,"An example of algorithm to make croquettes is the following: Step 1: Chop the ham into small pieces, Step 2: Put in a pan a little butter, a tablespoon of flour..."
311,Länder learning,What is Federated Learning?,"Federated Learning is a machine learning technique that allows you to train an algorithm in a way, using your own data (Private and Local)."
312,Tree,"In this course, we will learn how to use what to solve some common problems in computer science?",In this course we are going to learn how to use a tree to solve some common problems in computer science.
313,Green computing,Research and Markets has added a report on what topic to their offering?,"Research and Markets (http://www.researchandmarkets.com/reports/global-green-computing) has announced the addition of the ""Green Computing - Research and Markets"" report to their offering."
314,Autoencoder,What is the name of the type of artificial neural network that is divided into two parts?,Autoencoders are a particular type of artificial neural network that is divided into two parts: the encoder and the decoder
315,Generational models,What type of models are shown to be able to distinguish between real and synthetic examples?,In this paper we show how to train generative models that can discriminate between real and synthetic examples.
316,Metadata,What is the term for the information that accompanies a data?,Metadata are the information that accompanies data.
317,Prolog,What language will I show you how to write complex code?,In this tutorial I will show you how to use the Prolog language to write complex code.
318,Smart data,Data that has been preprocessed or cured is called what?,"The term ""smart data"" is often used to refer to data that has been preprocessed or cured."
319,Hash table,"What is a data structure that relates a value called ""key"" to other or other elements?","A Hash Table is a data structure that relates a value called ""key"" to other or other elements."
320,Subadjustment,What is a problem you may have noticed?,"If you’re working on a machine learning algorithm, there’s a problem you may have noticed."
321,Metadata,What is the term for the information that accompanies data?,Metadata are the information that accompanies data.
322,Rules of association,What is a set of rules that can be used to classify data sets?,association rules are a set of rules that can be used to classify data sets.
323,Xenobot,"What is the name of the living robot created at the University of California, Los Angeles?","Scientists at the University of California, Los Angeles, have created a new type of living robot."
324,Xenobot,"What is the name of the robot created by scientists at the University of California, Berkeley?","Scientists at the University of California, Berkeley, have created a new type of living robot."
325,Variables dummy,What is the term for a variable that is created when the original Variable cannot be used?,A Dummy Variable is a variable that is created when the original Variable cannot be used.
326,Autoencoder,What is a particular type of artificial neural network that is divided into two parts?,Autoencoders are a particular type of artificial neural network that are divided into two parts: the encoder and the decoder.
327,Merkle Tree,What is another name for Hash Tree?,A Hash Tree or Merkle Tree is a tree-type data structure in which: A) Each leaf node is with the result of applying aHash to the data corresponding to that sheet.
328,Decision tree,What does Farai Sevenzo look at in a series of letters?,"In our series of letters from African journalists, film-maker and columnist Farai Sevenzo looks at the tree of decision."
329,Merkle Tree,What is another term for a Hash Tree?,"A Hash Tree or Merkle Tree is a tree-type data structure in which: A) Each leaf node is with the result of applying a Hash to the data corresponding to that sheet, and B) Each internal node is with the result of applying a Hash Function to the concatenation of the tags of its"
330,Metaverse,What is another name for virtual reality?,"You may have heard of metaverses, or virtual reality, or both."
331,Sugar code,"In this tutorial, you will learn how to write code using what programming language?","In this tutorial, you will learn how to write code using the Sugar Coding language."
332,Turing Machine,What is one of the most important contributions made by Italian scientists to the field of artificial intelligence?,"In our series of letters from Italian scientists, we look at some of the most important contributions made by Italian researchers to the field of artificial intelligence."
333,Bot,What is a computer program capable of performing repetitive tasks?,"A bot is a computer program capable of performing repetitive tasks and usually operates on the Internet and simulates the behaviour that a person would have, doing the same but automatically."
334,Reinforcing learning,What is a type of machine learning in which a reinforcement is given after a decision made by an algorithm?,Reinforcement learning is a type of machine learning by which after a decision made by an algorithm a reinforcement is given.
335,Generational models,What is a new type of artificial intelligence called?,"A new type of artificial intelligence, called generative models, is being developed."
336,Blockchain,What is a system for digital transfer?,"Blockchain is a system for digital transfer based on the distribution of information on several independent computers that record and validate such information, eliminating intermediaries."
337,Augmented reality,What is another name for virtual reality?,Augmented Reality (AR) and Virtual Reality (VR) are two of the most popular technologies in the world.
338,Turing Test,Ahmedou Ould-Abdallah looks at what test?,"In our series of letters from African journalists, film-maker and columnist Ahmedou Ould-Abdallah looks at the Turing Test."
339,Decision tree,What does Farai Sevenzo look at in his series of letters?,"In our series of letters from African journalists, film-maker and columnist Farai Sevenzo looks at the hierarchy of the human mind."
340,Tree,"In this course, we will look at how to use what to solve some common problems?",In this course we are going to look at how to use a tree to solve some common problems.
341,Metadata,What is information that accompanies data itself?,Metadata are information that accompanies data itself.
342,Länder learning,Federated Learning is a machine learning technique that allows you to train an algorithm using your own data?,"Federated Learning is a machine learning technique that allows you to train an algorithm in a way, using your own data."
343,Autoencoder,What is a type of artificial neural network?,Autoencoders are a type of artificial neural network that are divided into two parts: the encoder and the decoder.
344,Automatic learning,What branch of AI allows a computer to learn based on examples?,Machine learning is a branch within AI that allows a computer to learn based on examples.
345,Tree,"In this lesson, we will learn how to use what to solve common problems?",In this lesson we are going to learn how to use a tree to solve some common problems.
346,Merkle Tree,What is another name for Hash Tree?,A Hash Tree or Merkle Tree is a tree-type data structure in which: A) Each leaf node is with the result of applying a Hash Function to the data corresponding to that sheet.
347,Grapho,What branch of mathematics deals with the relationship between data and people?,Graph theory is a branch of mathematics that deals with the relationship between data and people.
348,Xenobot,"What is the name of the new type of robot created at the University of California, Irvine?","Scientists at the University of California, Irvine, have created a new type of robot."
349,Green computing,What is the name of the report that Research and Markets has added to its offering?,"Research and Markets (http://www.researchandmarkets.com/reports/global-green-computing) has announced the addition of the ""Green Computing"" report to its offering."
350,Sugar code,What is the name of the technique used in this tutorial?,"In this tutorial, you will learn how to write code using the Sugar Coding technique."
351,Data science,What field of study has increased in the last few years?,The number of students studying Data Science has increased significantly over the last few years.
352,Big data,What does Ahmedou Ould-Abdallah look at?,"In our series of letters from African journalists, filmmaker and columnist Ahmedou Ould-Abdallah looks at the role of Big Data in modern society."
353,Bot,What is a computer program that can perform repetitive tasks?,"A bot is a computer program capable of performing repetitive tasks and usually operates on the Internet and simulates the behavior that a person would have, doing the same but automatically."
354,Rules of association,What are rules that can be used to classify data sets?,association rules are a set of rules that can be used to classify data sets.
355,Hash table,What is a data structure that relates a value called a key to another or other Elements?,"A Hash Table is a data structure that relates a value called ""key"" to another or other Elements."
356,Metaverse,Scientists at MIT are working on a way to create what kind of universe?,Scientists at the Massachusetts Institute of Technology (MIT) are working on a way to create metaverses.
357,Prolog,What language will you learn to use to write code?,In this tutorial you will learn how to use the Prolog language to write code.
358,Metadata,What is the term for a file?,What is metadata?
359,Smart agent.,There are many different types of what type of agent?,"There are many different types of intelligent agents, but they all have one thing in common - they all have one thing in common - they all have one thing in common - they all have one thing in common - they all have one thing in common - they all have one thing in common - they all have one"
360,Subadjustment,What is a problem you may have encountered when working on a machine learning algorithm?,"If you’re working on a machine learning algorithm, there’s a problem you may have encountered."
361,Reinforcing learning,What is a type of machine learning in which a positive or negative reinforcement is given after a decision made by an algorithm?,Reinforcement learning is a type of machine learning by which after a decision made by an algorithm a reinforcement (positive or negative) is given.
362,Reinforcing learning,What is a type of machine learning in which a positive or negative reinforcement is given?,Reinforcement learning is a type of machine learning by which after a decision is made by an algorithm a reinforcement (positive or negative) is given.
363,GPU,What are graphics cards that are used for other than graphical processing called?,Graphic cards that are used for anything other than graphical processing are called GPUs or general purpose GPUs.
364,Model,What do we train to predict the likelihood of a given outcome?,In this paper we show how to train an artificial intelligence (AI) model to predict the likelihood of a given outcome.
365,Prolog,What language do I use to write code?,In this tutorial I will show you how to use the Prolog language to write code.
366,Model,What does this paper describe how to train?,This paper describes how to train an artificial intelligence (AI) model that can predict the likelihood of a given event.
367,Merkle Tree,What is another name for a hash tree?,A Hash Tree or Merkle Tree is a tree-type data structure in which:
368,Sugar code,"In this tutorial, we will learn how to write code using what?","In this tutorial, we are going to learn how to write code using the Sugar Coding."
369,Overadjustment,Researchers at the Massachusetts Institute of Technology have found a way to overcome what problem of artificial intelligence models?,"Researchers at the Massachusetts Institute of Technology (MIT) have found a way to overcome the problem of ""overfitting"" of artificial intelligence models:"
370,GPU,What are general purpose graphics cards called?,"Graphic cards that are used for anything other than graphical processing are called GP-GPUs, or general purpose GPUs."
371,Prolog,"In this tutorial, I will show you how to use what language?",In this tutorial I will show you how to use the Prolog language in a factorial situation.
372,Data science,What field of study has the number of students studying in the last few years increased?,The number of students studying Data Science has increased significantly over the last few years.
373,Big data,What revolution is Ahmed Rashid looking at?,"In our series of letters from African journalists, film-maker and columnist Ahmed Rashid looks at the big data revolution and how it is changing the way we do business."
374,Merkle Tree,What is another name for a Hash Tree?,A Hash Tree or Merkle Tree is a tree-type data structure in which: A) Each leaf node is with the result of applying a Hash to the data corresponding to that sheet.
375,Metadata,What is information that accompanies the data itself?,Metadata are information that accompanies the data itself
376,Generational models,What is a new type of artificial intelligence called?,A new type of artificial intelligence is being developed called generative models.
377,GPU,What is another name for a general purpose graphic card?,Graphic cards that are used for anything other than graphical processing are called GP-GPUs or general purpose GPUs.
378,Autoencoder,What is a type of artificial neural network that is divided into the encoder and the decoder?,Autoencoders are a type of artificial neural network that is divided into two parts: the encoder and the decoder.
379,Hash function,What is a mathematical function that transforms a data set into a fixed lengthnumeric code?,A Hash Function is a mathematical function that transforms a data set into a fixed-lengthnumeric code.
380,Data science,What field of study has the number of students studying in the last few years increased?,The number of students studying data science has increased significantly over the past few years.
