,Topic,Question,Answer
510,Full Turing,Ahmedou Ould-Abdallah looks at the role of what systems in philosophy?,"In our series of letters from African journalists, film-maker and columnist Ahmedou Ould-Abdallah looks at the role of Full Turing systems in philosophy."
511,Hash function,What is another name for a mathematical function that transforms a data set into a fixed length alphanumeric code?,A Hash Function or Summary Function is a mathematical function that transformations a data set into a fixed-length alphanumeric code.
512,Hash function,What is another name for a mathematical function that transforms a data set into a fixed-lengthnumeric code?,A Hash Function or Summary Function is a mathematical function that transforms a data set into a fixed-lengthnumeric code.
513,Full Turing,What type of system does Ahmedou Ould-Abdallah look at?,"In our series of letters from African journalists, film-maker and columnist Ahmedou Ould-Abdallah looks at some of the most striking examples of Full Turing systems."
514,Green computing,What report has Research and Markets added to their offering?,"Research and Markets (http://www.researchandmarkets.com/reports/global-green-computing) has announced the addition of the "" Green Computing"" report to their offering."
515,Länder learning,"Federated Learning is a machine learning technique that allows you to train an algorithm in a way, using your own data and local?","Federated Learning is a machine learning technique that allows you to train an algorithm in a way, using your own data (private) and local."
516,Autoencoder,What is the second part of an artificial neural network?,Autoencoders are a particular type of artificial neural network that is divided into two part: the encoder and the decoder.
517,Hash table,What is a data structure that relates a value called a key to another or other elements?,"A Hash Table is a data structure that relates a value called ""key"" to another or other elements."
518,Augmented reality,What is another name for AR?,Augmented Reality (AR) and Virtual Reality (VR) are two of the most popular technologies in the world of technology.
519,Hash table,What is a data structure that relates a value called 'key' to another or other elements?,"A Hash Table is a data structure that relates a value called "" key"" to another or other elements."
520,Generational models,What is the new type of artificial intelligence called?,"A new type of artificial intelligence, called generative models, is being developed."
521,Variables dummy,What is a variable that is created when the original variable cannot be used?,A Dummy Variable is a variable that is created when the original variable cannot be used.
522,Merkle Tree,What is another name for a Hash Tree?,A Hash Tree or Merkle Tree is a tree-type data structure in which:
523,Subadjustment,What is a problem you may have when working on a machine learning algorithm?,"If you’re working on a machine learning algorithm, there’s a problem you may have."
524,Bot,What is a computer program capable of performing repetitive tasks called?,A robot is a computer program capable of performing repetitive tasks.
525,IoT,What does Ahmedou Ould-Abdallah refer to as the internet of things?,"In our series of letters from African journalists, filmmaker and columnist Ahmedou Ould-Abdallah looks at how the internet of things (IoT) is changing the way we live."
526,Big data,Ahmedou Ould-Abdallah looks at the revolution in what field?,"In our series of letters from African journalists, filmmaker and columnist Ahmedou Ould-Abdallah looks at the big data revolution in Africa."
527,Tree,"In this course, we will learn how to use what type of tree to solve problems?",In this course we are going to learn how to use a tree to solve problems.
528,Reinforcing learning,What is a type of machine learning by which a reinforcement is given after a decision made by an algorithm?,Reinforcement learning is a type of machine learning by which after a decision made by an algorithm a reinforcement is given.
529,Variables dummy,What is a variable called that is created when the original variable cannot be used?,"A Dummy Variable is a variable that is created when the original variable cannot be used, so we can measure distances between different instances."
530,Overadjustment,Researchers at MIT have found a way to overcome what problem with neural networks?,"Researchers at the Massachusetts Institute of Technology (MIT) have found a way to overcome the problem of ""overfitting"" neural networks."
531,Sugar code,"In this tutorial, you will learn how to write code using what?","In this tutorial, you will learn how to write code using the Sugar Coding."
532,Prolog,What language will I use to write complex code?,In this tutorial I will show you how to use the Prolog language to write complex code.
533,Generational models,What is a new type of artificial intelligence?,"A new type of artificial intelligence, called generative models, has been developed."
534,Reinforcing learning,What is a type of machine learning in which a positive reinforcement is given?,Reinforcement learning is a type of machine learning by which after a decision made by an algorithm a reinforcement (positive or positive) is given.
535,Prolog,What language will I show you how to use in a factorial problem?,In this tutorial I will show you how to use the Prolog language in a factorial problem.
536,Merkle Tree,What is another name for a Hash Tree?,A Hash Tree or Merkle Tree is a tree-type data structure in which: A) Each leaf node is with the result of applying a Hash Function to the data corresponding to that sheet.
537,Metadata,What is the term for information that accompanies data?,Metadata are information that accompanies data.
538,Metadata,What is it called?,What is metadata?
539,Subadjustment,What is a problem you may have with your machine learning algorithm?,"If you’re working on a machine learning algorithm, there’s a problem you may have."
540,Turing Test,What test has DeepMind passed for the first time?,An artificial intelligence system called DeepMind has passed the Turing Test for the first time.
541,Metadata,What is the term for information that accompanies data itself?,Metadata are information that accompanies data itself.
542,Sugar code,"In this tutorial, you will learn how to write code using what programming language?","In this tutorial, you will learn how to write code using the Sugar Coding."
543,Länder learning,Federated Learning is a machine learning technique that allows you to train an algorithm in a way using your own data?,"Federated Learning is a machine learning technique that allows you to train an algorithm in a way, using your own data (private or local)."
544,Overadjustment,Researchers at MIT have found a way to overcome the problem of what?,"Researchers at the Massachusetts Institute of Technology (MIT) have found a way to overcome the problem of ""overfitting"" of artificial intelligence models:"
545,Metadata,What is the term for information that accompanies data?,Metadata are information that accompanies data itself.
546,Metadata,What is the term for the information that accompanies the data itself?,Metadata are the information that accompanies the data itself.
547,Merkle Tree,What is another name for a Hash tree?,A Hash Tree or Merkle Tree is a tree-type data structure in which: A) Each leaf node is with the result of applying a Hash to the data corresponding to that sheet.
548,Subadjustment,What is the term for a problem that you don't want to talk about?,"If you’re working on a machine learning algorithm, you may have encountered a problem that you don’t want to talk about."
549,Reinforcing learning,What is a type of machine learning by which a positive or negative reinforcement is given?,Reinforcement learning is a type of machine learning by which after a decision made by a algorithm a reinforcement (positive or negative) is given.
550,Bot,What is a computer program that performs repetitive tasks?,A robot is a computer program capable of performing repetitive tasks.
551,Rules of association,What is a set of rules that can be used to classify data?,association rules are a set of rules that can be used to classify data sets.
552,Subadjustment,What is the term for a problem that you don’t know what to do about?,"If you’re working on a machine learning algorithm, you may have encountered a problem that you don’t know what to do about."
553,Länder learning,Federated Learning is a machine learning technique that allows you to train an algorithm in a way using your own data and local?,"Federated Learning is a machine learning technique that allows you to train an algorithm in a way, using your own data (private) and local."
554,Decision tree,What does Farai Sevenzo call the art of classification?,"In our series of letters from African journalists, film-maker and columnist Farai Sevenzo looks at the art of classification."
555,Metaverse,What is a metaverse called?,"You may have heard of a metaverse, but what is it and how can we get started?"
556,Data science,What field of study has increased in recent years?,The number of students studying data science has increased significantly over the last few years.
557,Overadjustment,Researchers at the Massachusetts Institute of Technology have found a way to overcome the problem of what?,"Researchers at the Massachusetts Institute of Technology (MIT) have found a way to overcome the problem of ""overfitting"" in machine learning."
558,Autoencoder,What is a particular type of artificial neural network?,Autoencoders are a particular type of artificial neural network that is divided into two parts: the encoder and the decoder
559,Full Turing,What type of system will I show you in this post?,"In this post, I'm going to show you some examples of Full Turing systems."
560,Model,This paper describes how to train what to predict the likelihood of a given event?,This paper describes how to train an artificial intelligence (AI) model to predict the likelihood of a given event.
561,Hash function,What transforms a data set into a fixed-length code?,A Hash Function is a mathematical function that transforms a data set into a fixed-length code.
562,Smart data,What term is often used to refer to data that has been preprocessed or cured?,"The term ""smart data"" is often used to refer to data that has been preprocessed or cured."
563,Turing Test,What test does Ahmed Rashid look at?,"In our series of letters from African journalists, film-maker and columnist Ahmed Rashid looks at the Turing Test."
564,Generational models,What type of models can distinguish between fiction and reality?,In this talk we will show how to train generative models that can discriminate between reality and fiction.
565,GPU,What are general purpose graphics cards called?,Graphic cards that are used for anything other than graphical processing are called GP- GPUs or general purpose GPUs.
566,Tree,"In this course, we will look at how to use what to solve common problems?",In this course we are going to look at how to use a tree to solve some common problems.
567,Metaverse,Virtual reality is also called what?,"You may have heard of metaverses, or virtual reality, or both."
568,Turing Machine,"In our series of letters from Italian scientists, we look at some of the most interesting what?","In our series of letters from Italian scientists, we look at some of the most interesting Turing machines."
569,Subadjustment,What is the term for a subadjustment of a machine learning algorithm?,"If you’re working on a machine learning algorithm, there’s a problem you may have encountered."
570,Autoencoder,What is a type of artificial neural network that is used to learn the encodings of unlabelled data?,Autoencoders are a type of artificial neural network that are used to learn the encodings of unlabelled data.
571,Metaverse,What is a term for a metaverse?,You may have heard of a metaverse.
572,GPU,What is another name for a graphics card?,Graphic cards that are used for anything other than graphical processing are called GP-GPUs.
573,Bot,What is a computer program capable of performing repetitive tasks?,"A bot is a computer program capable of performing repetitive tasks and usually operates on the Internet and simulates the behavior that a person would have, doing the same or automatically."
574,Metaverse,What does a metaverse mean?,"You may have heard of a metaverse, but what is it and what does it mean?"
575,Länder learning,Federated Learning is a technique that allows you to train an algorithm in a way using your own data?,"Federated Learning is a technique that allows you to train an algorithm in a way, using your own data."
576,Data science,What field of study has the number of students studying increased in the last few years?,The number of students studying data science has increased significantly over the past few years.
577,Turing Test,What does Ahmedou Ould-Abdallah look at?,"In our series of letters from African journalists, film-maker and columnist Ahmedou Ould-Abdallah looks at the Turing Test."
578,GPU,What is another term for general purpose graphics cards?,Graphic cards that are used foranything other than graphical processing are called GP-GPUs or general purpose GPUs.
579,Länder learning,Federated Learning is a machine learning technique that allows you to train an algorithm using your own data?,"Federated Learning is a machine learning technique that allows you to train an algorithm in a way, using your own data (private and local)."
580,Model,"In this paper, we show how to train what to predict the likelihood of a given outcome?",In this paper we show how to train an artificial intelligence (AI) model to predict the likelihood of a given outcome.
581,Grapho,What is the term for graph theory?,Graph theory is a theory of how data is organised and relationships between points in it.
582,Hash table,"What is a data structure that relates a value called ""key"" to another element?","A Hash Table is a data structure that relates a value called ""key"" to another or other element."
583,Augmented reality,What is the main technology in the field of augmented reality?,Augmented Reality (AR) and Virtual Reality (VR) are the two main technologies in the field of augmented reality.
584,Autoencoder,What is a particular type of artificial neural network?,Autoencoders are a particular type of artificial neural network that are divided into two parts: the encoder and the decoder.
585,Prolog,"In this tutorial, you will learn how to use which language to write code?",In this tutorial you will learn how to use the Prolog language to write code.
586,Bot,What is a computer program that performs repetitive tasks?,"A bot is a computer program capable of performing repetitive tasks and usually operates on the Internet or simulates the behaviour that a person would have, doing the same or automatically."
587,Tree,In this course we will look at how to use what to solve common problems?,In this course we are going to look at how to use a tree to solve some common problems.
588,Generational models,What is a new type of artificial intelligence being developed?,A new type of artificial intelligence is being developed called generative models.
589,Model,This paper shows how to train an AI model to predict the likelihood of a given event?,This paper shows how to train an artificial intelligence (AI) model to predict the likelihood of a given event.
590,Subadjustment,What is the term for a subadjustment?,"If you’re working on a machine learning algorithm, you may have encountered a problem that you don’t know what to do with."
591,IoT,What does Ahmedou Ould-Abdallah call the internet of things?,"In our series of letters from African journalists, filmmaker and columnist Ahmedou Ould-Abdallah looks at how the Internet of Things (IoT) is changing the way we live."
592,Turing Machine,"Along with Turin computers, what type of machine is used by Italian researchers?","In our series of letters from Italian scientists, we look at some of the most important contributions made by Italian researchers to the field of artificial intelligence through the use of Turing machines and Turin computers."
593,Model,This paper describes how to train an AI model to predict the likelihood of a given outcome?,This paper describes how to train an artificial intelligence (AI) model to predict the likelihood of a given outcome.
594,Generational models,What is the new type of artificial intelligence called?,"A new type of artificial intelligence, called generative models, has been developed at the University of Cambridge."
595,Smart data,What type of data is big?,There are two types of data: smart and big.
596,Merkle Tree,What is another name for a hash tree?,A Hash Tree or Merkle Tree is a tree-type data structure in which: A) Each leaf node is with the result of applying a Hash Function to the data corresponding to that sheet.
597,Autoencoder,What is a type of artificial neural network that is divided into two parts?,Autoencoders are a type of artificial neural network that is divided into two parts: the encoder and the decoder.
598,Green computing,What report has Research and Markets added to their offering?,"Research and Markets (http://www.researchandmarkets.com/reports/global-greencomputing) has announced the addition of the ""Green Computing"" report to their offering."
599,Rules of association,What are a set of rules used to classify objects in a data set?,The association rules are a set of rules that can be used to classify objects in a data set.
600,Hash function,What is another name for a mathematical function that transforms a data set into a fixed-length alphanumeric code?,A Hash Function or Summary Function is a mathematical function that transformations a data set into a fixed-length alphanumeric code.
601,Smart agent.,There are many different types of what type of agent?,"There are many different types of intelligent agents, but they all have one thing in common - they all have one thing in common - they all have one thing in common - they all have one thing in common - they all have one thing in common - they all all have one thing in common - they all have"
602,Model,What does this paper describe how to train to predict the likelihood of an event taking place?,This paper describes how to train an artificial intelligence (AI) model that can predict the likelihood of a given event taking place.
603,Smart agent.,There are many different types of what type of agent?,"There are many different types of intelligent agents, but they all have one thing in common - they all have one thing in common - they all have one thing in common - they all all have one thing in common - they all have one thing in common - they all have one thing in common - they all have"
604,Green computing,What is the name of the report that Research and Markets has added to their offering?,"Research and Markets has announced the addition of the ""Green Computing"" report to their offering."
605,Bot,What is a computer program capable of performing repetitive tasks?,"A bot is a computer program capable of performing repetitive tasks and usually operates on the Internet or simulates the behavior that a person would have, doing the same but automatically."
606,IoT,What does Ahmedou Ould-Abdallah call the Internet of Things?,"In our series of letters from African journalists, filmmaker and columnist Ahmedou Ould-Abdallah looks at how the internet of things (IoT) is changing the way we live and work."
607,Grapho,What is the term for graph theory?,Graph theory is a theory of how data is organised.
608,Automatic learning,Machine learning is a branch of what?,Machine learning is a branch within AI that allows a computer to learn based on examples.
609,Big data,Ahmed Rashid looks at the revolution in what field?,"In our series of letters from African journalists, film-maker and columnist Ahmed Rashid looks at the big data revolution and how it is changing our lives."
610,IoT,What does Ahmedou Ould-Abdallah call the Internet of Things?,"In our series of letters from African journalists, filmmaker and columnist Ahmedou Ould-Abdallah looks at how the Internet of Things (IoT) is changing the way we live."
611,Big data,What does Ahmedou Ould-Abdallah look at?,"In our series of letters from African journalists, filmmaker and columnist Ahmedou Ould-Abdallah looks at the role of Big Data in our daily lives."
612,Reinforcing learning,What is a type of machine learning by which a positive or negative reinforcement is given after a decision made by an algorithm?,Reinforcement learning is a type of machine learning by which after a decision made by an algorithm a reinforcement (positive or negative) is given.
613,Big data,Ahmedou Ould-Abdallah looks at the revolution in what field in Africa?,"In our series of letters from African journalists, filmmaker and columnist Ahmedou Ould-Abdallah looks at the big data revolution in Africa."
614,Prolog,"In this tutorial, you will learn how to write complex code using what language?","In this tutorial, you will learn how to use the Prolog language to write complex code."
615,Full Turing,Ahmedou Ould-Abdallah looks at the role of what system in philosophy?,"In our series of letters from African journalists, film-maker and columnist Ahmedou Ould-Abdallah looks at the role of Full Turing systems in philosophy."
616,Overadjustment,Researchers at the Massachusetts Institute of Technology have found a way to overcome the problem of what?,"Researchers at the Massachusetts Institute of Technology (MIT) have found a way to overcome the problem of ""overfitting"" of artificial intelligence models."
617,Länder learning,What is Federated Learning?,"Federated Learning is a machine learning technique that allows you to train an algorithm in a way, using your own data (private and local)."
618,Metadata,What is the term for the information that accompanies the data?,Metadata are information that accompanies the data itself.
619,Blockchain,What is a system for digital transfer based on the distribution of information on several independent computers?,"Blockchain is a system for digital transfer based on the distribution of information on several independent computers that record and validate such information, eliminating intermediaries."
620,Smart data,Big data is what type of data?,There are two main types of data: smart and big.
621,IoT,What does Ahmedou Ould-Abdallah refer to as the internet of things?,"In our series of letters from African journalists, filmmaker and columnist Ahmedou Ould-Abdallah looks at how the internet of things (IoT) is changing our lives."
622,Rules of association,What are a set of rules that can be used to classify data sets?,The association rules are a set of rules that can be used to classify data sets.
623,Länder learning,Federated Learning uses what kind of data?,"Federated Learning is a machine learning technique which allows you to train an algorithm in a way, using your own data (private and local)."
624,Bot,What type of computer program performs repetitive tasks?,"A bot is a computer program capable of performing repetitive tasks and usually operates on the Internet or simulates the behavior that a person would have, doing the same but automatically."
625,Smart agent.,There are many different types of what type of agent?,"There are many different types of intelligent agents, but they all have one thing in common - they all have one thing in common - they all all have one thing in common - they all have one thing in common - they all have one thing in common - they all have one thing in common - they all have"
626,Full Turing,What type of system did Ahmedou Ould-Abdallah look at?,"In our series of letters from African journalists, film-maker and columnist Ahmedou Ould-Abdallah looks at some of the most interesting Full Turing systems."
627,Rules of association,What are rules that can be used to classify data?,association rules are a set of rules that can be used to classify data.
628,Turing Machine,What type of machine did researchers at the University of Turin contribute to the theory of?,"In our series of letters from Italian scientists, we look at some of the most important contributions made by researchers at the University of Turin to the theory of Turing machines."
629,Rules of association,What are a set of rules that can be used to classify data?,association rules are a set of rules that can be used to classify data.
630,Overadjustment,Researchers at the Massachusetts Institute of Technology have found a way to overcome what problem of artificial intelligence models?,"Researchers at the Massachusetts Institute of Technology (MIT) have found a way to overcome the problem of ""overfitting"" of artificial intelligence models."
631,Decision tree,What does Farai Sevenzo look at in his series of letters?,"In our series of letters from African journalists, film-maker and columnist Farai Sevenzo looks at the tree of decisions."
632,Full Turing,What system does Ahmedou Ould-Abdallah look at?,"In our series of letters from African journalists, film-maker and columnist Ahmedou Ould-Abdallah looks at the role of Full Turing systems in philosophy."
633,Metadata,What is information that accompanies data called?,Metadata are information that accompanies data.
634,Rules of association,What are rules that can be used to classify objects in data sets?,The association rules are a set of rules that can be used to classify objects in data sets.
635,Generational models,What is the new type of artificial intelligence called?,"A new type of artificial intelligence, called generative models, has been developed."
636,Augmented reality,What is the most popular form of technology in entertainment?,Augmented Reality (AR) and Virtual Reality (VR) are two of the most popular forms of technology in the world of entertainment.
