,source,target
538,What is a type of machine learning where a decision made by an algorithm is followed by a reinforcement?,Reinforcement learning is a type of machine learning whereby a decision made by an algorithm is followed by a reinforcement.
539,What is a computer program that performs repetitive tasks?,"A bot is a computer program capable of performing repetitive tasks and usually operates on the Internet and simulates the behavior that a person would have, doing the same thing but automatically."
540,What is a set of rules that can be used to classify objects in a data set?,Association rules are a set of rules that can be used to classify objects in a data set.
541,What does Ahmed Rashid think is important in computer science?,"In our series of letters from African journalists, film-maker and columnist Ahmed Rashid looks at the importance of overfitting in computer science."
542,What is a system for digital transfer based on the distribution of information in several independent computers that register and validate such information?,"Blockchain is a system for digital transfer based on the distribution of information in several independent computers that register and validate such information, eliminating intermediaries."
543,In this lesson we will learn how to use what to solve common problems?,In this lesson we are going to learn how to use a tree to solve some common problems.
544,What does Ahmedou Ould-Abdallah look at?,"In our series of letters from African journalists, filmmaker and columnist Ahmedou Ould-Abdallah looks at some of the ideas behind metaverses."
545,What type of scientist is able to extract useful information from large volumes of data?,There is a growing demand for data scientists who are able to extract useful information from large volumes of data.
546,What does Ahmed Rashid discuss in his letters?,"In our series of letters from African journalists, film-maker and columnist Ahmed Rashid looks at the importance of overfitting in computer science."
547,What is a type of artificial neural network called?,Autoencoders are a type of artificial neural network that is divided into two parts: the encoder and the decoder.
548,This paper describes how to train what?,This paper describes how to train an artificial intelligence model.
549,What are there many different types of?,"There are many different types of intelligent agents, but they all have one thing in common - they all have one thing in common - they all have one thing in common - they all have one thing in common - they all have one thing in common - they all all have one thing in common - they all have"
550,What is a system called that has a computational power equivalent to theUniversal Turing Machine?,A Turing Complete system is one that has a computational power equivalent to theUniversal Turing Machine.
551,What is a device that uses a table of rules to manipulate symbols on a tape?,A Turing machine is a device that uses a table of rules to manipulate symbols on a data tape.
552,What type of models have been used to train machine learning algorithms?,Generative models are an important part of artificial intelligence and have been used for many years to train machine learning algorithms.
553,What is a piece of computer hardware that is used to process data called?,A graphics processing unit (GPU) is a piece of computer hardware that is used to process data.
554,What is the name of the graph theory?,Graph theory is a theory of how data is organised.
555,Ahmedou Ould-Abdallah looks at the future of what type of universe?,"In our series of letters from African journalists, filmmaker and columnist Ahmedou Ould-Abdallah looks at the future of metaverses."
556,What is a formal model of computation?,A Turing machine is a formal model of computation capable of performing any computation (that a computer is capable of performing this theoretical model) according to their complexity.
557,Ahmedou Ould-Abdallah looks at one of the most common problems faced by researchers working in the field of artificial intelligence?,"In our series of letters from African journalists, filmmaker and columnist Ahmedou Ould-Abdallah looks at one of the most common problems faced by researchers working in the field of artificial intelligence."
558,What type of neural network is used to learn encodings from unlabeled data?,Autoencoders are a type of artificial neural network that are used to learn encodings from unlabeled data.
559,What type of technology does Ahmed Rashid look at?,"In our series of letters from African journalists, film-maker and columnist Ahmed Rashid looks at the future of metaverse technology."
560,What is a piece of computer equipment used for processing data?,A graphics processing unit (GPU) is a piece of computer equipment that is used for processing data.
561,What is a computer program that can perform repetitive tasks?,A robot is a computer program capable of performing repetitive tasks.
562,Farai Sevenzo looks at the future of what type of technology?,"In our series of letters from African journalists, film-maker and columnist Farai Sevenzo looks at the future of metaverse technology."
563,"What is a technique that allows to train an algorithm in a way, using its own data and other users' data?","Federated Learning is a technique that allows to train an algorithm in a way, using its own data (private and local) and other users' data."
564,What is a branch of science that deals with the analysis of large amounts of data?,Data Science is a branch of science that deals with the analysis of large amounts of data.
565,What test did DeepMind pass?,"An artificial intelligence (AI) called DeepMind has passed the Turing Test for the first time, the BBC reports."
566,What is a piece of computer equipment that is used to process data called?,A graphics processing unit (GPU) is a piece of computer equipment that is used to process data.
567,What is a technique that allows to train an algorithm in a way?,"Federated Learning is a technique that allows to train an algorithm in a way, using its own data (private and local), and only shares this model with other users."
568,What does AR stand for?,Augmented Reality (AR) and Virtual Reality (VR) are two of the hottest technologies in the world of technology.
569,Which branch of mathematics deals with the relationship between information and people?,Graph theory is a branch of mathematics that deals with the relationship between information and people.
570,"What is a data structure that relates a value called ""key"" to one or more other elements?","A Hash Table is a data structure that relates a value called ""key"" to one or more other Elements."
571,What does AR stand for?,Augmented Reality (AR) and Virtual Reality (VR) are two of the newest technologies in the world of technology.
572,What is the name of the type of artificial neural network that is divided into two parts?,Autoencoders are a particular type of artificial neural network that is divided into two parts: the encoder and the decoder
573,In what language will we learn how to solve a factorial with two Facts and a Rule?,In this lesson we are going to learn how to solve a factorial with two Facts and a Rule in the Prolog language.
574,What is a computer program capable of performing repetitive tasks?,"A bot is a computer program capable of performing repetitive tasks and usually operates on the Internet or simulates the behaviour that a person would have, doing the same thing but automatically."
575,In this course we will learn how to use what to solve computer science problems?,In this course we are going to learn how to use a tree to solve some common problems in computer science.
576,What type of models are an important part of machine learning?,Generative models are an important part of machine learning.
577,What do we show how to train to predict the likelihood of a given outcome?,"In this paper, we show how to train an artificial intelligence (AI) model to predict the likelihood of a given outcome."
578,Ahmedou Ould-Abdallah looks at one of the most common problems faced by African journalists - failure to identify a pattern in data.,"In our series of letters from African journalists, filmmaker and columnist Ahmedou Ould-Abdallah looks at one of the most common problems faced by African journalists - failure to identify a pattern in data."
579,What does Ahmedou Ould-Abdallah call the internet of things?,"In our series of letters from African journalists, filmmaker and columnist Ahmedou Ould-Abdallah looks at how the internet of things is changing the way we live."
580,What is a formal model of computation?,A Turing machine is a formal model of computation capable of performing any computation (that a computer is capable of doing this theoretical model).
581,This paper describes how to train an AI model that can predict the outcome of a clinical trial?,This paper describes how to train an artificial intelligence (AI) model that can predict the outcome of a clinical trial.
582,What are an important part of artificial intelligence research?,Generative models are an important part of artificial intelligence research.
583,Hash Trees and Merkle Trees are two types of data structures that are used in Blockchain technology?,Hash Trees and Merkle Trees are two types of data structures that are used in Blockchain technology.
584,What is a type of artificial neural network?,Autoencoders are a type of artificial neural network that are used to learn encodings from unlabelled data.
585,What refers to computing that makes responsible use of resources?,Green Computing refers to computing that makes responsible use of resources.
586,What does Ahmed Rashid look at in his letters?,"In our series of letters from African journalists, film-maker and columnist Ahmed Rashid looks at the tree of decision."
587,What is a data structure that relates a value called 'key' to one or more other elements?,"A Hash Table is a data structure that relates avalue called ""key"" to one or more other elements."
588,What type of agent has one thing in common?,"There are many different types of intelligent agents, but they all have one thing in common - they all have one thing in common - they all have one thing in common - they all have one thing in common - they all all have one thing in common - they all have one thing in common - they all have"
589,What do we show how to train to predict the outcome of a problem?,"In this paper, we show how to train an artificial intelligence (AI) model to predict the outcome of a problem."
590,What is a variable called that can be created when the original variable cannot be used?,A Dummy Variable is a variable that can be created when the original variable cannot be used.
591,What is the name of the report that Research and Markets has added?,"Research and Markets (http://www.researchandmarkets.com/reports/global-green-computing-research) has announced the addition of the ""Green Computing"" report to their offering."
592,What is a computer program capable of performing repetitive tasks called?,A bot is a computer program capable of performing repetitive tasks.
593,Ahmedou Ould-Abdallah looks at what technology?,"In our series of letters from African journalists, filmmaker and columnist Ahmedou Ould-Abdallah looks at how the internet of things (IoT) is changing our lives."
594,Graph theory is a branch of mathematics that deals with the structure of data?,Graph theory is a branch of mathematics that deals with the structure of data.
595,What type of learning can be categorized into?,"They can be grouped into: Supervised, Unsupervised, Semi-supervised."
596,What revolution does Ahmed Rashid look at?,"In our series of letters from African journalists, film-maker and columnist Ahmed Rashid looks at the big data revolution."
597,What does Ahmedou Ould-Abdallah call the internet?,"In our series of letters from African journalists, filmmaker and columnist Ahmedou Ould-Abdallah looks at how the internet of things is changing the way we live."
598,What type of challenges does Ahmed Rashid look at?,"In our series of letters from African journalists, film-maker and columnist Ahmed Rashid looks at some of the big data challenges facing the industry."
599,What is a type of machine learning wherein a decision made by an algorithm is followed by a reinforcement?,Reinforcement learning is a type of machine learning wherein a decision made by an algorithm is followed by a reinforcement (positive or negative).
600,What type of revolution does Ahmed Rashid look at?,"In our series of letters from African journalists, film-maker and columnist Ahmed Rashid looks at the big data revolution in Africa."
601,In what part of the text will we learn how to solve a factorial?,In this lesson we are going to learn how to solve a factorial with two Facts and a Rule in Prolog.
602,What is the term for a system that has computing power equivalent to the Universal Turing Machine?,A Turing Complete system is one that has a computing power equivalent to the Universal Turing Machine.
603,What does Ahmed Rashid talk about in his letters to African journalists?,"In our series of letters from African journalists, film-maker and columnist Ahmed Rashid looks at the importance of ""overfitting"" in computer science."
604,"What is a technique that allows to train an algorithm in a way, using its own data?","Federated Learning is a technique that allows to train an algorithm in a way, using its own data (private and local)."
606,What does Farai Sevenzo look at the future of?,"In our series of letters from African journalists, film-maker and columnist Farai Sevenzo looks at the future of metaverses."
607,What type of data is big data?,There are two main types of data: smart and big.
608,What technology is changing the way we live?,"In our series of letters from African journalists, filmmaker and columnist Ahmedou Ould-Abdallah looks at how the internet of things is changing the way we live."
609,A set of what can be used to classify objects in a data set?,Association rules are a set of rules that can be used to classify objects in a data set.
610,"What is a technique that allows to train an algorithm in a way, using its own data?","Federated Learning is a technique that allows to train an algorithm in a way, using its own data (private or local)."
611,What is a computer program that can perform repetitive tasks?,"A bot is a computer program capable of performing repetitive tasks and usually operates on the Internet or simulates the behaviour that a person would have, doing the same thing but automatically."
612,What is another term for a mathematical function that transforms a set of data into an alphanumeric code of fixed length?,A Hash Function or Summary Function is a mathematical function that transforms a set of data into an alphanumeric code of fixed length.
613,What system has a computational power equivalent to the Universal Turing machine?,A Turing Complete system is one that has a computational power equivalent to the Universal Turing machine.
614,What does Ahmed Rashid look at the hierarchy of the human mind?,"In our series of letters from African journalists, film-maker and columnist Ahmed Rashid looks at the hierarchy of the human mind."
615,What is a formal model of computation capable of performing any computation?,A Turing machine is a formal model of computation capable of performing any computation (that a computer is capable of performing this theoretical model) according to its complexity.
616,What are rules that can be used to classify data?,Association rules are a set of rules that can be used to classify data.
617,What problem does Ahmed Rashid look at in computer science?,"In our series of letters from African journalists, film-maker and columnist Ahmed Rashid looks at the problem of ""overfitting"" in computer science."
618,What does Ahmed Rashid look at in his letters?,"In our series of letters from African journalists, film-maker and columnist Ahmed Rashid looks at the importance of the tree."
619,What type of system has a computing power equivalent to the Universal Turing Machine?,A Turing Complete system is one that has a computing power equivalent to the Universal Turing Machine.
620,What is the mathematical function that transforms a set of data into anumeric code of fixed length?,A Hash Function is a mathematical function that transforms a set of data into anumeric code of fixed length.
621,What is a set of rules that govern the classification of objects in a data set?,Association rules are a set of rules that govern the classification of objects in a data set.
622,What is an important part of artificial intelligence?,Generative models are an important part of artificial intelligence.
623,What is AR?,Augmented Reality (AR) and Virtual Reality (VR) are two of the newest technologies in the world of technology.
624,What is another name for a mathematical function that transforms a set of data into a code of fixed length?,A Hash Function or Summary Function is a mathematical function that transforms a set of data into a code of fixed length.
625,"What does Ahmed Rashid call the ""overfitting"" of artificial intelligence?","In our series of letters from African journalists, film-maker and columnist Ahmed Rashid looks at the importance of ""overfitting"" in artificial intelligence (AI)."
626,What is changing the way we live?,"In our series of letters from African journalists, film-maker and columnist Farai Sevenzo looks at how the internet of things (IoT) is changing the way we live."
627,What type of variable is created when the original variables cannot be used?,A Dummy Variable is a variable that is created when the original variables cannot be used.
628,What term has gained popularity in the last few years?,The term Data Science has been gaining popularity in recent years.
629,Big data and what other type of data are there?,There are two main types of data: big data and smart data.
630,What type of model is an important part of machine learning?,Generative models are an important part of machine learning.
631,What system has a computational power equivalent to the Universal Turing Machines?,A Turing Complete system is one that has a computational power equivalent to the Universal Turing Machines.
632,What is a set of rules that govern the classification of data?,Association rules are a set of rules that govern the classification of data.
633,Ahmedou Ould-Abdallah looks at one of the most common problems faced by African journalists:,"In our series of letters from African journalists, filmmaker and columnist Ahmedou Ould-Abdallah looks at one of the most common problems faced by African journalists:"
634,"What is a technique that allows an algorithm to be trained in a way, using its own data?","Federated Learning is a technique that allows to train an algorithm in a way, using its own data (private or local)."
635,What report did Research and Markets add to their offering?,"Research and Markets (http://www.researchandmarkets.com/reports/global-green-computing) has announced the addition of the ""Green Computing"" report to its offering."
636,"What is a technique that allows to train an algorithm in a way, using its own data but only sharing it with other users?","Federated Learning is a technique that allows to train an algorithm in a way, using its own data (private and local), but only shares it with other users."
637,What does Ahmed Rashid explain why it is important?,"In our series of letters from African journalists, film-maker and columnist Ahmed Rashid explains why big data is so important."
638,Graph theory is a branch of computer science that deals with data structures?,Graph theory is a branch of computer science that deals with data structures.
639,What does Ahmed Rashid look at in his series of letters?,"In our series of letters from African journalists, film-maker and columnist Ahmed Rashid looks at the importance of overfitting in machine learning."
640,Farai Sevenzo looks at what technology that is changing the way we live and work?,"In our series of letters from African journalists, film-maker and columnist Farai Sevenzo looks at how the internet of things (IoT) is changing the way we live and work."
641,"What is a data structure that relates a value called ""key"" to one or more other elements?","A Hash Table is a data structure that relates a value called ""key"" to one or more other element."
642,What is a system that has a computational power equivalent to the Universal Turing Machine?,A Turing Complete system is one that has a computational power equivalent to the Universal Turing Machine.
643,What is a mathematical function that transforms a set of data into a code of fixed length?,A Hash Function is a mathematical function that transforms a set of data into a code of fixed length.
644,In what program will I show you how to solve a factorial?,In this tutorial I will show you how to solve a factorial with two Facts and a Rule in PROLOG.
645,What does Ahmedou Ould-Abdallah look at?,"In our series of letters from African journalists, filmmaker and columnist Ahmedou Ould-Abdallah looks at how the internet of things (IoT) could change the way we live."
646,What technology is changing our lives?,"In our series of letters from African journalists, filmmaker and columnist Ahmedou Ould-Abdallah looks at how the internet of things (IoT) is changing our lives."
647,What does Ahmedou Ould-Abdallah look at in his letters?,"In our series of letters from African journalists, filmmaker and columnist Ahmedou Ould-Abdallah looks at the meaning of sugar."
648,What does Farai Sevenzo look at the future of?,"In our series of letters from African journalists, filmmaker and columnist Farai Sevenzo looks at the future of metaverses."
649,What type of models are an important part of artificial intelligence?,"Generative models are an important part of artificial intelligence, and their use is growing."
650,What issue does Ahmed Rashid look at in his series of letters?,"In our series of letters from African journalists, film-maker and columnist Ahmed Rashid looks at some of the big data issues facing the continent."
651,Graph theory is a branch of mathematics that deals with the relationship between data and people.,Graph theory is a branch of mathematics that deals with the relationship between data and people.
652,What is another name for AR?,Augmented Reality (AR) and Virtual Reality (VR) are two of the most popular technologies in the world of technology.
653,What is a variable that is created when the original variable cannot be used?,"A Dummy Variable is a variable that is created when the original variable cannot be used, such as a categorical variable."
654,What is a particular type of artificial neural network?,Autoencoders are a particular type of artificial neural network that is divided into two parts: the encoder and the decoder
655,What revolution is Ahmed Rashid looking at?,"In our series of letters from African journalists, film-maker and columnist Ahmed Rashid looks at the big data revolution and how it is changing our world."
656,"What is a data structure that relates a value called ""key"" to one or more other elements?","A Hash Table is a data structure that relates avalue called ""key"" to one or more other elements."
657,What are the rules that govern the classification of data?,Association rules are a set of rules that govern the classification of data.
658,In this class we will learn how to use what to solve some common problems?,In this class we are going to learn how to use a tree to solve some common problems.
659,"In this paper, we show how to train an artificial intelligence (AI) model that can predict the outcome of a clinical trial?","In this paper, we show how to train an artificial intelligence (AI) model that can predict the outcome of a clinical trial."
660,"What is the name of the living robot created at the University of California, Los Angeles?","Scientists at the University of California, Los Angeles, have created a new type of living robot called a xenobot."
661,What system has a computational power equal to the Universal Turing Machine?,A Turing Complete system is one that has a computational power equal to the Universal Turing Machine.
662,Ahmed Rashid looks at some of the issues facing Africa?,"In our series of letters from African journalists, film-maker and columnist Ahmed Rashid looks at some of the big data issues facing Africa."
663,What is a variable called that is created when the original variable cannot be used?,A Dummy Variable is a variable that is created when the original variable cannot be used.
664,What is a system for digital transfer based on the distribution of information in several independent computers that register and validate information?,"Blockchain is a system for digital transfer based on the distribution of information in several independent computers that register and validate such information, eliminating intermediaries."
665,What is a computer program capable of performing repetitive tasks?,A bot is a computer program capable of performing repetitive tasks.
666,What report has Research and Markets added to their offering?,"Research and Markets (http://www.researchandmarkets.com/reports/global...) has announced the addition of the ""Green Computing"" report to their offering."
667,What is a particular type of artificial neural network called?,Autoencoders are a particular type of artificial neural network that is divided into two parts: the encoder and the decoder
668,What is a formal model of computation capable of performing any computation?,A Turing machine is a formal model of computation capable of performing any computation (that a computer is capable of performing this theoretical model).
