,source,target
134,What is changing the way we live and work?,"In our series of letters from African journalists, filmmaker and columnist Ahmedou Ould-Abdallah looks at how the internet of things (IoT) is changing the way we live and work."
135,"What is the new type of robot created by scientists at the University of California, Los Angeles?","Scientists at the University of California, Los Angeles, have created a new type of robot."
136,What is a piece of computer equipment that is used to process data?,A graphics processing unit (GPU) is a piece of computer equipment that is used to process data.
137,What is a data structure that relates a value called key to one or more other elements?,"A Hash Table is a data structure that relates a value called ""key"" to one or more other elements."
138,What does this paper describe how to train?,This paper describes how to train an artificial intelligence model.
139,What is a computer program capable of performing repetitive tasks?,"A bot is a computer program capable of performing repetitive tasks and usually operates on the Internet or simulates the behavior that a person would have, doing the same thing but automatically."
140,What is another name for virtual reality?,Augmented Reality (AR) and Virtual Reality (VR) are two of the most popular technologies in the world today.
141,What does Ahmed Rashid look at in his letters?,"In our series of letters from African journalists, film-maker and columnist Ahmed Rashid looks at the problem of ""overfitting""."
142,What does Ahmed Rashid believe is important in computer science?,"In our series of letters from African journalists, film-maker and columnist Ahmed Rashid looks at the importance of ""overfitting"" in computer science."
143,What are rules of association?,Association rules are a set of rules that govern the classification of data.
144,"In this paper, we show how to train what to predict the likelihood of a given outcome?","In this paper, we show how to train an artificial intelligence (AI) model to predict the likelihood of a given outcome."
145,Hash Trees and Merkle Trees are two types of data structures in the Blockchain.,Hash Trees and Merkle Trees are two types of data structures used in the Blockchain.
146,In what language will we solve a factorial?,In this lesson we are going to learn how to solve a factorial in Prolog.
147,Ahmed Rashid looks at one of the most common problems faced by African journalists.,"In our series of letters from African journalists, film-maker and columnist Ahmed Rashid looks at one of the most common problems faced by African journalists:"
148,What type of scientist is there a growing demand for?,There is a growing demand for data scientists across the world.
149,Ahmed Rashid looks at what revolution in Africa?,"In our series of letters from African journalists, film-maker and columnist Ahmed Rashid looks at the big data revolution in Africa."
150,"What is the name of the robot created by scientists at the University of California, Berkeley?","Scientists at the University of California, Berkeley, have created a new type of robot."
151,What is a type of machine learning whereby a decision made by an algorithm is followed by a reinforcement?,Reinforcement learning is a type of machine learning whereby a decision made by a algorithm is followed by a reinforcement (positive or negative).
152,What is one of the most common problems faced by African journalists?,"In our series of letters from African journalists, filmmaker and columnist Farai Sevenzo looks at one of the most common problems faced by African journalists:"
153,What does this paper describe how to train?,This paper describes how to train an artificial intelligence (AI) model.
154,What will you learn about in this tutorial?,"In this tutorial, you will learn about sugar coding and how to use it in your programming."
155,"What is a technique called that allows to train an algorithm in a way, using its own data?","Federated Learning is a technique that allows to train an algorithm in a way, using its own data (private and local), but only shares this model with other users."
156,In what program can you solve a factorial?,In this tutorial I will show you how to solve a factorial in Prolog.
157,"What is the name of the new type of living robot created by scientists at the University of California, Los Angeles?","Scientists at the University of California, Los Angeles, have created a new type of living robot called a xenobot."
158,What could be used to make bank transfers without a bank?,"If we talk about bank transfers, these could be done without the need for a centralized computer (a bank)."
159,What does Ahmed Rashid look at in his letters to African journalists?,"In our series of letters from African journalists, film-maker and columnist Ahmed Rashid looks at the importance of the tree."
160,What is a piece of computer equipment that is used to process data?,A Graphics Processing Unit (GPU) is a piece of computer equipment that is used to process data.
161,What is a technique that allows to train an algorithm in a way using its own data?,"Federated Learning is a technique that allows to train an algorithm in a way, using its own data (private and local)."
162,What is a computer program capable of performing repetitive tasks?,"A bot is a computer program capable of performing repetitive tasks and usually operates on the Internet and simulates the behavior that a person would have, doing the same thing but automatically."
163,"What is the name of the new type of robot created by scientists at the University of California, Los Angeles?","Scientists at the University of California, Los Angeles, have created a new type of robot."
164,What does Ahmed Rashid look at in his letters to African journalists?,"In our series of letters from African journalists, film-maker and columnist Ahmed Rashid looks at the tree of life."
165,What type of computer program performs repetitive tasks?,"A bot is a computer program capable of performing repetitive tasks and usually operates on the Internet or simulates the behavior that a person would have, doing the same thing, but automatically."
166,What will we learn about in this lesson?,"In this lesson, we are going to learn about sugar coding and how to use it."
167,What is AR also known as?,Augmented Reality (AR) and Virtual Reality (VR) are two of the most popular technologies in the world today.
168,What do we train to predict the likelihood of a problem being solved?,"In this paper, we show how to train an artificial intelligence (AI) model to predict the likelihood of a problem being solved."
169,What is a type of machine learning where a decision made by an algorithm is followed by a reinforcement?,Reinforcement learning is a type of machine learning whereby a decision made by an algorithm is followed by a reinforcement ( positive or negative).
170,This paper describes how to train an artificial intelligence (AI) model.,This paper describes how to train an artificial intelligence (AI) model.
171,What is a particular type of artificial neural network called?,Autoencoders are a particular type of artificial neural network that is divided into two part: the encoder and the decoder.
172,What does AR stand for?,Augmented Reality (AR) and Virtual Reality (VR) are two of the most popular forms of technology today.
173,What does Ahmed Rashid look at in his series of letters?,"In our series of letters from African journalists, film-maker and columnist Ahmed Rashid looks at the importance of the tree."
174,What is changing the way we live and work?,"In our series of letters from African journalists, film-maker and columnist Farai Sevenzo looks at how the internet of things (IoT) is changing the way we live and work."
175,What type of models are an important part of artificial intelligence?,Generative models are an important part of artificial intelligence.
176,What does Ahmed Rashid look at in a series of letters?,"In our series of letters from African journalists, film-maker and columnist Ahmed Rashid looks at how to make a tree."
177,What is a set of rules that can be used to classify data?,Association rules are a set of rules that can be used to classify data.
178,What is the term for computing that uses resources responsibly?,Green Computing refers to computing that makes responsible use of resources.
179,Graph theory is a theory of how data is organized?,Graph theory is a theory of how data is organised.
180,"What is the name of the living robot created by scientists at the University of California, Los Angeles?","Scientists at the University of California, Los Angeles, have created a new type of living robot, a Xenobot."
181,What is a set of rules that can be used to classify data sets?,Association rules are a set of rules that can be used to classify data sets.
182,What is the second part of an artificial neural network?,Autoencoders are a particular type of artificial neural network that is divided into two part: the encoder and the decoder.
183,What are there many different types of?,"There are many different types of intelligent agents, but they all have one thing in common - they all have one thing in common - they all have one thing in common - they all have one thing in common - they all have one thing in common - they all have one thing in common - they all all have"
184,"What is the name of the living robot created by scientists at the University of California, Los Angeles?","Scientists at the University of California, Los Angeles, have created a new type of living robot called a Xenobot."
185,What does Ahmed Rashid look at in his series of letters?,"In our series of letters from African journalists, film-maker and columnist Ahmed Rashid looks at the importance of overfitting in computer science."
186,What branch of science deals with the analysis of large amounts of data?,Data Science is a branch of science that deals with the analysis of large amounts of data.
187,What type of models are an important part of computer science?,Generative models are an important part of computer science.
188,What is a computer program that performs repetitive tasks?,A robot is a computer program capable of performing repetitive tasks.
189,What type of data is big data?,There are two types of data: smart data and big data.
190,Ahmedou Ould-Abdallah looks at what test?,"In our series of letters from African journalists, film-maker and columnist Ahmedou Ould-Abdallah looks at the Turing Test."
191,"In this tutorial, you will learn about what?","In this tutorial, you will learn about sugar coding and how to use it in your programming."
192,Big data is what type of data?,There are two types of data: smart data and big data.
193,What term has been gaining popularity?,The term Data Science has been gaining popularity in recent years.
194,What is a piece of computer equipment used to process data?,A graphics processing unit (GPU) is a piece of computer equipment used to process data.
195,What does Ahmed Rashid look at in a series of letters?,"In our series of letters from African journalists, film-maker and columnist Ahmed Rashid looks at the tree of decision."
196,What type of models are an important part of artificial intelligence and computer science?,Generative models are an important part of artificial intelligence and computer science.
197,"What does Ahmed Rashid call the problem of ""overfitting""?","In our series of letters from African journalists, film-maker and columnist Ahmed Rashid looks at the problem of ""overfitting""."
198,A machine that is capable of performing any computation is called what?,A Turing machine is a machine that is capable of performing any computation (that a computer is capable of performing this theoretical model).
199,Machine learning is a branch of what?,Machine learning is a branch within AI that allows a computer to learn based on examples.
200,What field of study is booming?,The world of data science is booming.
201,"In this course, we will learn how to use what to solve computer science problems?",In this course we are going to learn how to use a tree to solve some common problems in computer science.
202,What type of system has a computational power equivalent to the Universal Turing Machine?,A Turing Complete system is one that has a computational power equivalent to the Universal Turing Machine...
203,What is a type of artificial neural network that is divided into two parts?,Autoencoders are a type of artificial neural network that is divided into two parts: the encoder and the decoder.
204,What does Ahmed Rashid look at in his letters?,"In our series of letters from African journalists, film-maker and columnist Ahmed Rashid looks at the tree of decisions."
205,What type of scientist is needed to extract useful information from large amounts of data?,There is a growing demand for data scientists who are able to extract useful information from large amounts of data.
206,"What is a data structure that relates a value called ""key"" to one or more elements called?","A Hash Table is a data structure that relates a value called ""key"" to one or more elements."
207,What is a type of machine learning whereby a decision made by an algorithm is followed by a reinforcement?,Reinforcement learning is a type of machine learning whereby a decision made by an algorithm is followed by a reinforcement ( positive or negative).
208,What does Farai Sevenzo look at in a series of letters?,"In our series of letters from African journalists, film-maker and columnist Farai Sevenzo looks at how the internet of things (IoT) is changing the way we live and work."
209,What are there many different types of?,"There are many different types of intelligent agents, but they all have one thing in common - they all have one thing in common - they all have one thing in common - they all all have one thing in common - they all have one thing in common - they all have one thing in common - they all have"
210,What is a type of machine learning whereby a decision is followed by a reinforcement?,Reinforcement learning is a type of machine learning whereby a decision is followed by a reinforcement (positive or negative).
211,What is another name for virtual reality?,Augmented Reality (AR) and Virtual Reality (VR) are two of the most popular forms of technology in the world today.
212,Graph theory is a theory of how data is organised?,Graph theory is a theory of how data is organised.
213,"What is the name of the new type of living robot created by scientists at the University of California, Los Angeles?","Scientists at the University of California, Los Angeles, have created a new type of living robot called a  Xenobot."
214,Hash Trees and Merkle Trees are two types of data structures that can be used in blockchain technology.,Hash Trees and Merkle Trees are two types of data structures that can be used in Blockchain technology.
215,There are many different types of what type of agent?,"There are many different types of intelligent agents, but they all have one thing in common - they all have one thing in common - they all have one thing in common - they all have one thing in common - they all have one thing in common - they all have one thing in common - they all have a"
216,"What is the name of the living robot created by scientists at the University of California, Los Angeles?","Scientists at the University of California, Los Angeles, have created a new type of living robot called a xenobot."
217,DeepMind has passed what test?,"An artificial intelligence (AI) system called DeepMind has passed the Turing Test for the first time, the BBC reports."
218,What is a data structure that relates a value called key to one or more other elements?,A Hash Table is a data structure that relates a value called key to one or more other elements.
219,What is a computer program capable of performing repetitive tasks?,"A bot is a computer program capable of performing repetitive tasks and usually operates on the Internet and simulates the behavior that a person would have, doing the same thing, but automatically."
220,What is AR also known as?,Augmented Reality (AR) and Virtual Reality (VR) are two of the hottest technologies in the world of technology.
221,"In this paper, we show how to train an AI model to predict the likelihood of a problem being solved?","In this paper, we show how to train an artificial intelligence (AI) model to predict the likelihood of a problem being solved."
222,What type of algorithm is used to solve a problem?,Sequence of instructions to solve a problem.
223,In this class we will learn how to use what to solve some common problems in computer science?,In this class we are going to learn how to use a tree to solve some common problems in computer science.
224,What is a type of machine learning in which a decision made by an algorithm is followed by a reinforcement?,Reinforcement learning is a type of machine learning wherein a decision made by an algorithm is followed by a reinforcement (positive or negative).
225,In what program will we learn how to solve a factorial?,In this lesson we are going to learn how to solve a factorial with two Facts and a Rule in PROLOG.
226,In what program will I show you how to solve a factorial using two Facts and a Rule?,In this tutorial I will show you how to solve a factorial with two Facts and a Rule in PROLOG.
227,What is another name for Merkle Trees?,Hash Trees and Merkle Trees are two types of data structures that are used in Blockchain technology.
228,What does Ahmedou Ould-Abdallah call sugar code?,"In our series of letters from African journalists, filmmaker and columnist Ahmedou Ould-Abdallah looks at some of the most popular letters from the continent."
229,What does Ahmed Rashid look at?,"In our series of letters from African journalists, film-maker and columnist Ahmed Rashid looks at the future of metaverses."
230,What is a data structure that relates a value called key to one or more other elements called?,A Hash Table is a data structure that relates a value called key to one or more other elements.
231,What report has Research and Markets added to its offering?,"Research and Markets (http://www.researchandmarkets.com/reports/global-green-computing) has announced the addition of the ""Green Computing"" report to its offering."
232,In which language will we learn how to solve a factorial?,In this lesson we are going to learn how to solve a factorial with two Facts and a Rule in the Prolog language.
233,What is the hierarchy of a Christmas tree?,The hierarchy of a Christmas tree is an interesting concept.
234,In this course we will learn how to use what type of data structure?,In this course we are going to learn how to use a tree as a data structure.
235,Farai Sevenzo looks at one of the most common problems faced by African journalists.,"In our series of letters from African journalists, filmmaker and columnist Farai Sevenzo looks at one of the most common problems faced by African journalists:"
236,What is it called when a set of data is transformed into an alphanumeric code of fixed length?,A Hash Function is a mathematical function that transforms a set of data into an alphanumeric code of fixed length.
237,What technology is changing the way we live?,"In our series of letters from African journalists, film-maker and columnist Farai Sevenzo looks at how the internet of things (IoT) is changing the way we live."
238,What transforms a set of data into an alphabetic code of fixed length?,A Hash Function is a mathematical function that transforms a set of data into an alphabetic code of fixed length.
239,In what part of the text will we learn how to solve a factorial with two Facts and a Rule?,In this lesson we are going to learn how to solve a factorial with two Facts and a Rule in Prolog.
240,"What does Ahmed Rashid call the ""overfitting"" in AI?","In our series of letters from African journalists, film-maker and columnist Ahmed Rashid looks at the importance of ""overfitting"" in artificial intelligence (AI)."
241,What is the term for a piece of computer equipment used to process data?,A graphics processing unit (GPU) is a piece of computer equipment used to process data.
242,What technology does Farai Sevenzo look at?,"In our series of letters from African journalists, film-maker and columnist Farai Sevenzo looks at the future of metaverse technology."
243,What is an important part of AI?,"Generative models are an important part of artificial intelligence, and their use is growing."
244,What type of variable is created when the original variable can't be used?,A Dummy Variable is a variable that is created when the original variable can't be used.
245,Ahmedou Ould-Abdallah looks at one of the most common problems faced by African journalists: failure to identify a pattern?,"In our series of letters from African journalists, filmmaker and columnist Ahmedou Ould-Abdallah looks at one of the most common problems faced by African journalists - failure to identify a pattern."
246,What is a formal model of computation capable of performing any computation?,A Turing machine is a formal model of computation capable of performing any computation (that a computer is capable of doing this theoretical model).
247,What is the hierarchy of the human mind?,"In our series of letters from African journalists, film-maker and columnist Ahmed Rashid looks at the hierarchy of the human mind."
248,What is another term for a mathematical function that transforms a set of data into an alphabetic code of fixed length?,A Hash Function or Summary Function is a mathematical function that transforms a set of data into an alphabetic code of fixed length.
249,What does Ahmedou Ould-Abdallah look at in his series of letters?,"In our series of letters from African journalists, filmmaker and columnist Ahmedou Ould-Abdallah looks at the meaning of sugar."
250,Ahmed Rashid looks at the future of what type of technology?,"In our series of letters from African journalists, film-maker and columnist Ahmed Rashid looks at the future of metaverse technology."
251,What type of system has a computational power equivalent to theUniversal Turing Machine?,A Turing Complete system is one that has a computational power equivalent to theUniversal Turing Machine.
252,What is the problem of overfitting?,"In our series of letters from African journalists, film-maker and columnist Ahmed Rashid looks at the problem of ""overfitting"" in computer science."
253,What is another name for virtual reality?,Augmented Reality (AR) and Virtual Reality (VR) are two of the most popular forms of technology in the world.
254,"What is the name of the robot created by scientists at the University of California, Los Angeles?","Scientists at the University of California, Los Angeles, have created a new type of robot."
255,"In this class, we will learn how to use what to solve common problems?",In this class we will learn how to use a tree to solve some common problems.
256,What is the name of the report that Research and Markets has added to their offering?,"Research and Markets (http://www.researchandmarkets.com/reports/global-green-computing-research) has announced the addition of the ""Green Computing"" report to their offering."
257,What test did DeepMind pass?,An artificial intelligence (AI) system called DeepMind has passed the Turing Test for the first time.
258,In this class we will learn how to use what to solve common problems?,In this class we are going to learn how to use a tree to solve some common problems.
259,What report has Research and Markets added to their offering?,"Research and Markets (http://www.researchandmarkets.com/reports/global-green-computing) has announced the addition of the ""Green Computing - Research and Markets"" report to their offering."
260,What is a formal model of computation capable of performing any computation according to their complexity?,A Turing machine is a formal model of computation capable of performing any computation (that a computer is capable of performing this theoretical model) according to their complexity.
261,What is a technique that allows to train an algorithm in a way using its own data?,"Federated Learning is a technique that allows to train an algorithm in a way, using its own data (private or local)."
262,Ahmedou Ould-Abdallah looks at one of the most common problems faced by researchers in the field of artificial intelligence.,"In our series of letters from African journalists, filmmaker and columnist Ahmedou Ould-Abdallah looks at one of the most common problems faced by researchers working in the field of artificial intelligence."
263,There is a growing demand for what type of scientist?,There is a growing demand for data scientists across the world.
264,What report has Research and Markets added to their offering?,"Research and Markets (http://www.researchandmarkets.com/reports/global-green-computing) has announced the addition of the ""Green Computing"" report to their offering."
265,There are many different types of what?,"There are many different types of intelligent agents, but they all have one thing in common - they all have one thing in common - they all have one thing in common - they all have one thing in common - they all have one thing in common - they all have one thing in common - they all all have"
266,What test did DeepMind pass for the first time?,"An artificial intelligence (AI) system called DeepMind has passed the Turing Test for the first time, according to BBC News."
267,What does Ahmed Rashid think is important in machine learning?,"In our series of letters from African journalists, film-maker and columnist Ahmed Rashid looks at the importance of overfitting in machine learning."
