,source,target
268,Ahmedou Ould-Abdallah looks at what technology that is changing the way we live?,"In our series of letters from African journalists, filmmaker and columnist Ahmedou Ould-Abdallah looks at how the internet of things (IoT) is changing the way we live."
269,"What is a data structure that relates a value called ""key"" to one or more elements?","A Hash Table is a data structure that relates a value called ""key"" to one or more elements."
270,What are an important part of computer science and artificial intelligence?,Generative models are an important part of computer science and artificial intelligence.
271,What are rules of association?,Association rules are a set of rules that can be used to classify data.
272,What is the term for the internet of things?,"In our series of letters from African journalists, film-maker and columnist Farai Sevenzo looks at how the internet of things is changing the way we live."
273,What does Ahmed Rashid look at in his letters to African journalists?,"In our series of letters from African journalists, film-maker and columnist Ahmed Rashid looks at the tree of decision."
274,What report did Research and Markets add to their offering?,"Research and Markets (http://www.researchandmarkets.com/reports/global...) has announced the addition of the ""Green Computing"" report to their offering."
275,What is the process used to make croquettes?,Algorithm for making croquettes: Step 1: Chop the ham into small pieces.
276,What type of revolution does Ahmed Rashid look at?,"In our series of letters from African journalists, film-maker and columnist Ahmed Rashid looks at the big data revolution."
277,What branch of science deals with the analysis and management of large amounts of data?,Data Science is a branch of science that deals with the analysis and management of large amounts of data.
278,What is a system called that has a computational power equivalent to the Universal Turing machine?,A Turing Complete system is one that has a computational power equivalent to the Universal Turing machine.
279,In this class we will learn how to use what to solve common problems?,In this class we will learn how to use a tree to solve some common problems.
280,What does Ahmedou Ould-Abdallah look at in his series of letters?,"In our series of letters from African journalists, filmmaker and columnist Ahmedou Ould-Abdallah looks at some of the ideas behind metaverses."
281,"What is a technique that allows to train an algorithm in a way, using its own data and only sharing it with other users?","Federated Learning is a technique that allows to train an algorithm in a way, using its own data (private and local), and only shares it with other users."
282,In what part of the text will I show you how to solve a factorial?,In this tutorial I will show you how to solve a factorial with two Facts and a Rule in Prolog.
283,Ahmedou Ould-Abdallah looks at one of the most common problems faced by African journalists?,"In our series of letters from African journalists, filmmaker and columnist Ahmedou Ould-Abdallah looks at one of the most common problems faced by African journalists:"
284,In what program will we learn to solve a factorial with two Facts and a Rule?,In this lesson we are going to learn how to solve a factorial with two Facts and a Rule in PROLOG.
285,Ahmed Rashid looks at the future of what kind of world?,"In our series of letters from African journalists, film-maker and columnist Ahmed Rashid looks at the future of metaverses."
286,Ahmedou Ould-Abdallah looks at the future of what type of technology?,"In our series of letters from African journalists, filmmaker and columnist Ahmedou Ould-Abdallah looks at the future of metaverse technology."
287,What does Ahmed Rashid think is important in artificial intelligence?,"In our series of letters from African journalists, film-maker and columnist Ahmed Rashid looks at the importance of overfitting in artificial intelligence."
288,What is the name of the type of artificial neural network?,Autoencoders are a particular type of artificial neural network that is divided into two parts: the encoder and the decoding decoder.
289,What is an important part of artificial intelligence?,"Generative models are an important part of artificial intelligence, and their use is growing."
290,What does AR stand for?,Augmented Reality (AR) and Virtual Reality (VR) are two of the newest technologies in the world of entertainment.
291,What is a piece of computer equipment used to process data?,A Graphics Processing Unit (GPU) is a piece of computer equipment that is used to process data.
292,What is a set of rules that govern the classification of data sets?,Association rules are a set of rules that govern the classification of data sets.
293,What is a system for digital transfer?,"Blockchain is a system for digital transfer based on the distribution of information in several independent computers that register and validate such information, eliminating intermediaries."
294,In what part of the text will I show you how to solve a factorial with two Facts and a Rule?,In this tutorial I will show you how to solve a factorial with two Facts and a Rule in Prolog.
295,What is a device that uses a table of rules to manipulate symbols on a data tape?,A Turing machine is a device that uses a table of rules to manipulate symbols on a data tape.
296,What is the hierarchy of a tree?,The hierarchy of a Christmas tree is an interesting concept.
297,"Along with big data, what type of data is there?",There are two main types of data: smart data and big data.
298,Ahmedou Ould-Abdallah looks at one of the most common problems faced by those working in the film and television industry?,"In our series of letters from African journalists, filmmaker and columnist Ahmedou Ould-Abdallah looks at one of the most common problems faced by those working in the film and television industry:"
299,What is a computer program that can perform repetitive tasks?,"A bot is a computer program capable of performing repetitive tasks and usually operates on the Internet or simulates the behavior that a person would have, doing the same thing, but automatically."
300,Big data and what other type of data are there?,There are two types of data: smart and big.
301,What is the name of the living robot created by scientists at the University of California?,"Scientists at the University of California, Los Angeles, have created a new type of living robot, a Xenobot."
302,Which branch of mathematics deals with the relationship between data and people?,Graph theory is a branch of mathematics that deals with the relationship between data and people.
303,What is the name of the algorithm used in step 2?,"Step 2: Put in a frying pan a little butter, a spoonful of flour and..."
304,"What is a technique that allows to train an algorithm in a way, using its own data and local?","Federated Learning is a technique that allows to train an algorithm in a way, using its own data (private) and local."
305,"What is the name of the living robot created at the University of California, Berkeley?","Scientists at the University of California, Berkeley, have created a new type of living robot."
306,What report did Research and Markets add to their offering?,"Research and Markets (http://www.researchandmarkets.com/reports/global-green-computing) has announced the addition of the ""Green Computing"" report to their offering."
307,What will you learn in this tutorial?,"In this tutorial, you will learn about sugar coding and how to use it in your coding."
308,What kind of models are important in computer science?,Generative models are an important part of computer science.
309,Big data and what other type of data?,There are two main types of data: big data and smart data.
310,What type of system has a computational power equivalent to the Turing Machine?,A Turing Complete system is one that has a computational power equivalent to the Turing Machine.
311,What is a data structure called that relates a value called key to one or more other elements?,A Hash Table is a data structure that relates a value called key to one or more other elements.
312,Ahmedou Ould-Abdallah looks at one of the most common problems faced by researchers working in artificial intelligence.,"In our series of letters from African journalists, filmmaker and columnist Ahmedou Ould-Abdallah looks at one of the most common problems faced by researchers working in the field of artificial intelligence."
313,What type of data is big data?,There are two main types of data: smart data and big data.
314,"In this lesson, we're going to learn how to write code using what?","In this lesson, we are going to learn how to write code using sugar."
315,What is a system that has a computational power equivalent to the Turing Machine?,A Turing Complete system is one that has a computational power equivalent to the Turing Machine.
316,What is a piece of computer equipment used to process data?,A graphics processing unit (GPU) is a piece of computer equipment that is used to process data.
317,What is a variable that can be created when the original variable cannot be used?,A Dummy Variable is a variable that can be created when the original variable cannot be used.
318,What is a particular type of artificial neural network called?,Autoencoders are a particular type of artificial neural network that is divided into two parts: the encoder and the decoder.
319,What is a type of artificial neural network used to learn encodings from unlabelled data?,Autoencoders are a type of artificial neural network that are used to learn encodings from unlabelled data.
320,What is another name for Merkle Trees?,Hash Trees and Merkle Trees are part of the Blockchain technology.
321,What test has DeepMind passed?,An artificial intelligence (AI) called DeepMind has passed the Turing Test for the first time.
322,Ahmed Rashid looks at the future of what technology?,"In our series of letters from African journalists, film-maker and columnist Ahmed Rashid looks at the future of metaverse technology."
323,"What is the name of the living robot created by scientists at the University of California, Berkeley?","Scientists at the University of California, Berkeley, have created a new type of living robot."
324,What is a computer program that performs repetitive tasks?,A bot is a computer program capable of performing repetitive tasks.
325,What is a type of machine learning where a decision made by an algorithm is followed by a reinforcement (positive or negative)?,Reinforcement learning is a type of machine learning where a decision made by an algorithm is followed by a reinforcement (positive or negative).
326,What is an important part of computer science?,Generative models are an important part of computer science and artificial intelligence.
327,What is a system for digital transfer based on the distribution of information in several independent computers?,"Blockchain is a system for digital transfer based on the distribution of information in several independent computers that register and validate such information, eliminating intermediaries."
328,What type of technology is AR?,Augmented Reality (AR) and Virtual Reality (VR) are two of the hottest technologies in the world of technology.
329,What test has DeepMind passed for the first time?,"An artificial intelligence (AI) called DeepMind has passed the Turing Test for the first time, the BBC reports."
330,What tree of life does Ahmed Rashid look at?,"In our series of letters from African journalists, film-maker and columnist Ahmed Rashid looks at the importance of the tree of life."
331,What type of data is big?,There are two main types of data: smart and big.
332,"What is the technique that allows to train an algorithm in a way, using its own data?","Federated Learning is a technique that allows to train an algorithm in a way, using its own data (private and local), but only shares this model with other users."
333,"Along with big data, what type of data is there?",There are two main types of data: smart and big data.
334,What is used to make croquettes?,Algorithm for making croquettes: Step 1: Chop the ham into small pieces.
335,What is another name for Merkle Trees?,Hash Trees and Merkle Trees are two types of Blockchain technology.
336,Graph theory is a branch of mathematics that deals with the relationship between information and people?,Graph theory is a branch of mathematics that deals with the relationship between information and people.
337,"What is the name of the living robot created by scientists at the University of California, Los Angeles?","Scientists at the University of California, Los Angeles, have created a new type of living robot called a  Xenobot."
338,What report did Research and Markets add to their offering?,"Research and Markets (http://www.researchandmarkets.com/reports/global-green-computing) has announced the addition of the ""Green Computing - Research and Markets"" report to their offering."
339,In what program will we solve a factorial with two Facts and a Rule?,In this lesson we are going to learn how to solve a factorial with two Facts and a Rule in PROLOG.
340,What is the branch of science that deals with the analysis of large volumes of data?,Data Science is a branch of science that deals with the analysis of large volumes of data.
341,Ahmed Rashid looks at the revolution in what field?,"In our series of letters from African journalists, film-maker and columnist Ahmed Rashid looks at the big data revolution and how it is changing our world."
342,What is a computer program that performs repetitive tasks on the internet called?,"A bot is a computer program capable of performing repetitive tasks and usually operates on the Internet and simulates the behavior that a person would have, doing the same thing, but automatically."
343,What is the other type of data?,There are two types of data: big data and smart data.
344,What is a data structure that relates a value called a key to one or more other elements?,"A Hash Table is a data structure that relates avalue called ""key"" to one or more other elements."
345,What does Ahmedou Ould-Abdallah look at in his series of letters?,"In our series of letters from African journalists, filmmaker and columnist Ahmedou Ould-Abdallah looks at how the internet of things (IoT) could change the way we live."
346,In what language will we learn how to solve a factorial?,In this lesson we are going to learn how to solve a factorial with two Facts and a Rule in the Prolog language.
347,What type of agent has one thing in common?,"There are many different types of intelligent agents, but they all have one thing in common - they all have one thing in common - they all have one thing in common - they all have one thing in common - they all have one thing in common - they all have one thing in common - they all have one"
348,What is a Variable that is created when the original Variable cannot be used?,A Dummy Variable is a variable that is created when the original Variable cannot be used.
349,Ahmedou Ould-Abdallah looks at one of the most common problems faced by African journalists - failure to identify a pattern in data?,"In our series of letters from African journalists, filmmaker and columnist Ahmedou Ould-Abdallah looks at one of the most common problems faced by African journalists - failure to identify a pattern in the data."
350,What does Ahmed Rashid explain why it's important?,"In our series of letters from African journalists, film-maker and columnist Ahmed Rashid explains why big data is so important."
351,What is a type of machine learning where a decision made by an algorithm is followed by a reinforcement?,Reinforcement learning is a type of machine learning wherein a decision made by an algorithm is followed by a reinforcement (positive or negative).
352,What is a system that has a computational power equivalent to the Universal Turing machine?,A Turing Complete system is one that has a computational power equivalent to the Universal Turing machine.
353,"In this paper, we show how to train what to predict the outcome of a problem?","In this paper, we show how to train an artificial intelligence (AI) model to predict the outcome of a problem."
354,Hash Trees and Merkle Trees are part of the Blockchain technology?,Hash Trees and Merkle Trees are part of the Blockchain technology.
355,What do we train to predict the outcome of a problem?,"In this paper, we show how to train an artificial intelligence (AI) model to predict the outcome of a problem."
356,Hash Trees and Merkle Trees are two types of data structures used in the blockchain.,Hash Trees and Merkle Trees are two types of data structures used in the Blockchain.
357,What language will I show you how to solve a factorial with two Facts and a Rule?,In this tutorial I will show you how to solve a factorial with two Facts and a Rule in the Prolog language.
358,What does Ahmed Rashid think is important in artificial intelligence?,"In our series of letters from African journalists, film-maker and columnist Ahmed Rashid looks at the importance of ""overfitting"" in artificial intelligence."
359,What test did DeepMind pass?,"An artificial intelligence (AI) system called DeepMind has passed the Turing Test for the first time, according to BBC News."
360,What is another name for Hash Trees?,Hash Trees and Merkle Trees are two types of Blockchain technology.
361,What field is there a growing demand for?,There is a growing demand for data scientists who are able to extract useful information from large amounts of data.
362,Ahmed Rashid looks at some of the challenges facing the African film industry?,"In our series of letters from African journalists, film-maker and columnist Ahmed Rashid looks at some of the big data challenges facing the industry."
363,What is another name for Summary Function?,A Hash Function or Summary Function is a mathematical function that transforms a set of data into an alphabetic code of fixed length.
364,"Along with big data, what type of data is there?",There are two types of data: smart data and big data.
365,What are an important part of artificial intelligence?,Generative models are an important part of artificial intelligence.
366,What is a particular type of artificial neural network?,Autoencoders are a particular type of artificial neural network that are divided into two parts: the encoder and the decoder.
367,What is a particular type of artificial neural network called?,Autoencoders are a particular type of artificial neural network that is divided into two parts: the encoder and the decoding decoder.
368,What type of agent has one thing in common?,"There are many different types of intelligent agents, but they all have one thing in common - they all have one thing in common: they all have one thing in common - they all have one thing in common - they all have one thing in common - they all have one thing in common - they all have one"
369,What branch of science deals with analysis and management of large amounts of data?,Data Science is a branch of science that deals with the analysis and management of large amounts of data.
370,What could be used to make bank transfers?,"If we talk about bank transfers, these could be done without the need for a centralized computer (a bank)."
371,What is the branch of science that deals with the analysis of large amounts of data?,Data Science is a branch of science that deals with the analysis of large amounts of data.
372,In this class we will learn how to use what to solve computer science problems?,In this class we are going to learn how to use a tree to solve some common problems in computer science.
373,What is a type of machine learning in which a decision is followed by a reinforcement?,Reinforcement learning is a type of machine learning whereby a decision is followed by a reinforcement (positive or negative).
374,What is a machine capable of performing any computation?,A Turing machine is a machine that is capable of performing any computation (that a computer is capable of performing this theoretical model).
375,What is an important part of computer science?,Generative models are an important part of computer science.
376,What type of variable is created when the original Variable cannot be used?,A Dummy Variable is a variable that is created when the original Variable cannot be used.
377,Big data is what type of data?,There are two types of data: smart and big.
378,"In this class, we will learn how to use what to solve some common problems?",In this class we are going to learn how to use a tree to solve some common problems.
379,What is the new type of decision tree?,association rules are a new type of decision tree.
380,Graph theory is a branch of mathematics that deals with data structures called?,Graph theory is a branch of mathematics that deals with data structures.
381,"In this lesson, we will learn how to write code using what?","In this lesson, we are going to learn how to write code using sugar."
382,What type of scientist is needed to extract useful information from large volumes of data?,There is a growing demand for data scientists who are able to extract useful information from large volumes of data.
383,Ahmed Rashid looks at what revolution?,"In our series of letters from African journalists, film-maker and columnist Ahmed Rashid looks at the big data revolution."
384,What is a device that uses a table of rules to manipulate symbols on a tape?,A Turing Machine is a device that uses a table of rules to manipulate symbols on a data tape.
385,There are many different types of what type of agent?,"There are many different types of intelligent agents, but they all have one thing in common - they all have one thing in common - they all have one thing in common - they all have one thing in common - they all have one thing in common - they all all have one thing in common - they all have"
386,What is a particular type of artificial neural network that is divided into two parts?,Autoencoders are a particular type of artificial neural network that are divided into two parts: the encoder and the decoder.
387,What does Ahmed Rashid look at?,"In our series of letters from African journalists, film-maker and columnist Ahmed Rashid looks at the hierarchy of the human mind."
388,In what program can you solve a factorial with two Facts and a Rule?,In this tutorial I will show you how to solve a factorial with two Facts and a Rule in PROLOG.
389,What does Ahmedou Ould-Abdallah call the sugar code?,"In our series of letters from African journalists, filmmaker and columnist Ahmedou Ould-Abdallah looks at some of the most popular letters from the continent."
390,Ahmedou Ould-Abdallah looks at one of the most common problems faced by African journalists: failure to identify a pattern in data?,"In our series of letters from African journalists, filmmaker and columnist Ahmedou Ould-Abdallah looks at one of the most common problems faced by African journalists - failure to identify a pattern in data."
391,Graph theory is a branch of mathematics that deals with the relationship between data and information?,Graph theory is a branch of mathematics that deals with the relationship between data and information.
392,What is a type of machine learning whereby a decision is followed by a reinforcement (positive or negative)?,Reinforcement learning is a type of machine learning whereby a decision is followed by a reinforcement (positive or negative).
393,What do we show how to train to predict the outcome of a clinical trial?,"In this paper, we show how to train an artificial intelligence (AI) model that can predict the outcome of a clinical trial."
394,What is the name of the type of artificial neural network that is divided into two parts?,Autoencoders are a particular type of artificial neural network that are divided into two parts: the encoder and the decoder.
395,What type of algorithm solves a problem?,Sequence of instructions to solve a problem.
396,What is the term for a system that has a computational power equivalent to the Universal Turing Machine?,A Turing Complete system is one that has a computational power equivalent to the Universal Turing Machine...
397,What test has DeepMind passed?,"An artificial intelligence (AI) system called DeepMind has passed the Turing Test for the first time, the BBC reports."
398,What is the term for a variable that is created when the original variable cannot be used?,A Dummy Variable is a variable that is created when the originalvariable cannot be used.
399,What is a machine that uses a table of rules to manipulate symbols on a data tape?,A Turing Machine is a machine that uses a table of rules to manipulate symbols on a data tape.
400,What is the name of the method used in step 2?,"Step 2: Put in a frying pan a little butter, a spoonful of flour and..."
401,"What is a technique called that allows to train an algorithm in a way, using its own data and other users' data?","Federated Learning is a technique that allows to train an algorithm in a way, using its own data (private and local) and other users' data."
402,What is a formal model of computation that is capable of performing any computation?,A Turing machine is a formal model of computation capable of performing any computation (that a computer is capable of performing this theoretical model).
403,What is a technique that allows to train an algorithm in a way using its own data?,"Federated Learning is a technique that allows to train an algorithm in a way, using its own data (private and local), and only shares this model with other users."
404,"What is a data structure that relates a value called ""key"" to one or more Elements?","A Hash Table is a data structure that relates a value called ""key"" to one or more other Elements."
405,What is a new type of decision tree called?,association rules are a new type of decision tree.
